,text_raw,text_clean
0,CHAPTER 1 THE WINDOW,chapter the window
1,"""Yes, of course, if it's fine tomorrow,"" said Mrs. Ramsay.",yes of course if it be fine tomorrow say mrs ramsay
2,"""But you'll have to be up with the lark,"" she added.",but you will have to be up with the lark she add
3,"To her son these words conveyed an extraordinary joy, as if it were settled, the expedition were bound to take place, and the wonder to which he had looked forward, for years and years it seemed, was, after a night's darkness and a day's sail, within touch.",to her son this word convey a extraordinary joy a if it be settle the expedition be bind to take place and the wonder to which he have look forward for year and year it seem be after a night s darkness and a day s sail within touch
4,"Since he belonged, even at the age of six, to that great clan which cannot keep this feeling separate from that, but must let future prospects, with their joys and sorrows, cloud what is actually at hand, since to such people even in earliest childhood any turn in the wheel of sensation has the power to crystallise and transfix the moment upon which its gloom or radiance rests, James Ramsay, sitting on the floor cutting out pictures from the illustrated catalogue of the Army and Navy stores, endowed the picture of a refrigerator, as his mother spoke, with heavenly bliss.",since he belong even at the age of six to that great clan which can not keep this feel separate from that but must let future prospect with their joy and sorrow cloud what be actually at hand since to such people even in early childhood any turn in the wheel of sensation have the power to crystallise and transfix the moment upon which its gloom or radiance rest james ramsay sit on the floor cut out picture from the illustrate catalogue of the army and navy store endow the picture of a refrigerator a his mother speak with heavenly bliss
5,It was fringed with joy.,it be fringe with joy
6,"The wheelbarrow, the lawnmower, the sound of poplar trees, leaves whitening before rain, rooks cawing, brooms knocking, dresses rustlingall these were so coloured and distinguished in his mind that he had already his private code, his secret language, though he appeared the image of stark and uncompromising severity, with his high forehead and his fierce blue eyes, impeccably candid and pure, frowning slightly at the sight of human frailty, so that his mother, watching him guide his scissors neatly round the refrigerator, imagined him all red and ermine on the Bench or directing a stern and momentous enterprise in some crisis of public affairs.",the wheelbarrow the lawnmower the sound of poplar tree leave whiten before rain rook caw broom knock dress rustlingall this be so colour and distinguish in his mind that he have already his private code his secret language though he appear the image of stark and uncompromising severity with his high forehead and his fierce blue eye impeccably candid and pure frown slightly at the sight of human frailty so that his mother watch him guide his scissor neatly round the refrigerator imagine him all red and ermine on the bench or direct a stern and momentous enterprise in some crisis of public affair
7,"""But,"" said his father, stopping in front of the drawing-room window, ""it won't be fine.""",but say his father stop in front of the draw room window it will not be fine
8,"Had there been an axe handy, a poker, or any weapon that would have gashed a hole in his father's breast and killed him, there and then, James would have seized it.",have there be a axe handy a poker or any weapon that would have gash a hole in his father s breast and kill him there and then james would have seize it
9,"Such were the extremes of emotion that Mr. Ramsay excited in his children's breasts by his mere presence; standing, as now, lean as a knife, narrow as the blade of one, grinning sarcastically, not only with the pleasure of disillusioning his son and casting ridicule upon his wife, who was ten thousand times better in every way than he was (James thought), but also with some secret conceit at his own accuracy of judgement.",such be the extreme of emotion that mr ramsay excite in his child s breast by his mere presence stand a now lean a a knife narrow a the blade of one grin sarcastically not only with the pleasure of disillusion his son and cast ridicule upon his wife who be ten thousand time well in every way than he be james think but also with some secret conceit at his own accuracy of judgement
10,What he said was true.,what he say be true
11,It was always true.,it be always true
12,"He was incapable of untruth; never tampered with a fact; never altered a disagreeable word to suit the pleasure or convenience of any mortal being, least of all of his own children, who, sprung from his loins, should be aware from childhood that life is difficult; facts uncompromising; and the passage to that fabled land where our brightest hopes are extinguished, our frail barks founder in darkness (here Mr. Ramsay would straighten his back and narrow his little blue eyes upon the horizon), one that needs, above all, courage, truth, and the power to endure.",he be incapable of untruth never tamper with a fact never alter a disagreeable word to suit the pleasure or convenience of any mortal be little of all of his own child who spring from his loin should be aware from childhood that life be difficult fact uncompromising and the passage to that fabled land where our bright hope be extinguish our frail bark founder in darkness here mr ramsay would straighten his back and narrow his little blue eye upon the horizon one that need above all courage truth and the power to endure
13,"""But it may be fineI expect it will be fine,"" said Mrs. Ramsay, making some little twist of the reddish brown stocking she was knitting, impatiently.",but it may be finei expect it will be fine say mrs ramsay make some little twist of the reddish brown stock she be knit impatiently
14,"If she finished it tonight, if they did go to the Lighthouse after all, it was to be given to the Lighthouse keeper for his little boy, who was threatened with a tuberculous hip; together with a pile of old magazines, and some tobacco, indeed, whatever she could find lying about, not really wanted, but only littering the room, to give those poor fellows, who must be bored to death sitting all day with nothing to do but polish the lamp and trim the wick and rake about on their scrap of garden, something to amuse them.",if she finish it tonight if they do go to the lighthouse after all it be to be give to the lighthouse keeper for his little boy who be threaten with a tuberculous hip together with a pile of old magazine and some tobacco indeed whatever she can find lie about not really want but only litter the room to give that poor fellow who must be bore to death sit all day with nothing to do but polish the lamp and trim the wick and rake about on their scrap of garden something to amuse them
15,"For how would you like to be shut up for a whole month at a time, and possibly more in stormy weather, upon a rock the size of a tennis lawn?",for how would you like to be shut up for a whole month at a time and possibly much in stormy weather upon a rock the size of a tennis lawn
16,"she would ask; and to have no letters or newspapers, and to see nobody; if you were married, not to see your wife, not to know how your children were,if they were ill, if they had fallen down and broken their legs or arms; to see the same dreary waves breaking week after week, and then a dreadful storm coming, and the windows covered with spray, and birds dashed against the lamp, and the whole place rocking, and not be able to put your nose out of doors for fear of being swept into the sea?",she would ask and to have no letter or newspaper and to see nobody if you be marry not to see your wife not to know how your child be if they be ill if they have fall down and break their leg or arm to see the same dreary wave break week after week and then a dreadful storm come and the window cover with spray and bird dash against the lamp and the whole place rock and not be able to put your nose out of door for fear of be sweep into the sea
17,How would you like that?,how would you like that
18,"she asked, addressing herself particularly to her daughters.",she ask address herself particularly to her daughter
19,"So she added, rather differently, one must take them whatever comforts one can.",so she add rather differently one must take them whatever comfort one can
20,"""It's due west,"" said the atheist Tansley, holding his bony fingers spread so that the wind blew through them, for he was sharing Mr. Ramsay's evening walk up and down, up and down the terrace.",it be due west say the atheist tansley hold his bony finger spread so that the wind blow through them for he be share mr ramsay s even walk up and down up and down the terrace
21,"That is to say, the wind blew from the worst possible direction for landing at the Lighthouse.",that be to say the wind blow from the wrong possible direction for land at the lighthouse
22,"Yes, he did say disagreeable things, Mrs. Ramsay admitted; it was odious of him to rub this in, and make James still more disappointed; but at the same time, she would not let them laugh at him.",yes he do say disagreeable thing mrs ramsay admit it be odious of him to rub this in and make james still much disappoint but at the same time she would not let them laugh at him
23,"""The atheist,"" they called him; ""the little atheist.""",the atheist they call him the little atheist
24,"Rose mocked him; Prue mocked him; Andrew, Jasper, Roger mocked him; even old Badger without a tooth in his head had bit him, for being (as Nancy put it) the hundred and tenth young man to chase them all the way up to the Hebrides when it was ever so much nicer to be alone.",rise mock him prue mock him andrew jasper roger mock him even old badger without a tooth in his head have bite him for be a nancy put it the hundred and 10 young man to chase them all the way up to the hebrides when it be ever so much nice to be alone
25,"""Nonsense,"" said Mrs. Ramsay, with great severity.",nonsense say mrs ramsay with great severity
26,"Apart from the habit of exaggeration which they had from her, and from the implication (which was true) that she asked too many people to stay, and had to lodge some in the town, she could not bear incivility to her guests, to young men in particular, who were poor as churchmice, ""exceptionally able,"" her husband said, his great admirers, and come there for a holiday.",apart from the habit of exaggeration which they have from her and from the implication which be true that she ask too many people to stay and have to lodge some in the town she can not bear incivility to her guest to young man in particular who be poor a churchmice exceptionally able her husband say his great admirer and come there for a holiday
27,"Indeed, she had the whole of the other sex under her protection; for reasons she could not explain, for their chivalry and valour, for the fact that they negotiated treaties, ruled India, controlled finance; finally for an attitude towards herself which no woman could fail to feel or to find agreeable, something trustful, childlike, reverential; which an old woman could take from a young man without loss of dignity, and woe betide the girlpray Heaven it was none of her daughters!who did not feel the worth of it, and all that it implied, to the marrow of her bones!",indeed she have the whole of the other sex under her protection for reason she can not explain for their chivalry and valour for the fact that they negotiate treaty rule india control finance finally for a attitude towards herself which no woman can fail to feel or to find agreeable something trustful childlike reverential which a old woman can take from a young man without loss of dignity and woe betide the girlpray heaven it be none of her daughter who do not feel the worth of it and all that it imply to the marrow of her bone
28,She turned with severity upon Nancy.,she turn with severity upon nancy
29,"He had not chased them, she said.",he have not chase them she say
30,He had been asked.,he have be ask
31,They must find a way out of it all.,they must find a way out of it all
32,"There might be some simpler way, some less laborious way, she sighed.",there may be some simple way some little laborious way she sigh
33,"When she looked in the glass and saw her hair grey, her cheek sunk, at fifty, she thought, possibly she might have managed things betterher husband; money; his books.",when she look in the glass and see her hair grey her cheek sink at fifty she think possibly she may have manage thing betterher husband money his book
34,"But for her own part she would never for a single second regret her decision, evade difficulties, or slur over duties.",but for her own part she would never for a single 2 regret her decision evade difficulty or slur over duty
35,"She was now formidable to behold, and it was only in silence, looking up from their plates, after she had spoken so severely about Charles Tansley, that her daughters, Prue, Nancy, Rosecould sport with infidel ideas which they had brewed for themselves of a life different from hers; in Paris, perhaps; a wilder life; not always taking care of some man or other; for there was in all their minds a mute questioning of deference and chivalry, of the Bank of England and the Indian Empire, of ringed fingers and lace, though to them all there was something in this of the essence of beauty, which called out the manliness in their girlish hearts, and made them, as they sat at table beneath their mother's eyes, honour her strange severity, her extreme courtesy, like a queen's raising from the mud to wash a beggar's dirty foot, when she admonished them so very severely about that wretched atheist who had chased themor, speaking accurately, been invited to stay with themin the Isle of Skye.",she be now formidable to behold and it be only in silence look up from their plate after she have speak so severely about charles tansley that her daughter prue nancy rosecould sport with infidel idea which they have brew for themselves of a life different from hers in paris perhaps a wild life not always take care of some man or other for there be in all their mind a mute question of deference and chivalry of the bank of england and the indian empire of ring finger and lace though to them all there be something in this of the essence of beauty which call out the manliness in their girlish heart and make them a they sit at table beneath their mother s eye honour her strange severity her extreme courtesy like a queen s raise from the mud to wash a beggar s dirty foot when she admonish them so very severely about that wretched atheist who have chase themor speak accurately be invite to stay with themin the isle of skye
36,"""There'll be no landing at the Lighthouse tomorrow,"" said Charles Tansley, clapping his hands together as he stood at the window with her husband.",there will be no land at the lighthouse tomorrow say charles tansley clap his hand together a he stand at the window with her husband
37,"Surely, he had said enough.",surely he have say enough
38,She wished they would both leave her and James alone and go on talking.,she wish they would both leave her and james alone and go on talk
39,She looked at him.,she look at him
40,"He was such a miserable specimen, the children said, all humps and hollows.",he be such a miserable specimen the child say all hump and hollow
41,He couldn't play cricket; he poked; he shuffled.,he can not play cricket he poke he shuffle
42,"He was a sarcastic brute, Andrew said.",he be a sarcastic brute andrew say
43,"They knew what he liked bestto be for ever walking up and down, up and down, with Mr. Ramsay, and saying who had won this, who had won that, who was a ""first rate man"" at Latin verses, who was ""brilliant but I think fundamentally unsound,"" who was undoubtedly the ""ablest fellow in Balliol,"" who had buried his light temporarily at Bristol or Bedford, but was bound to be heard of later when his Prolegomena, of which Mr. Tansley had the first pages in proof with him if Mr. Ramsay would like to see them, to some branch of mathematics or philosophy saw the light of day.",they know what he like bestto be for ever walk up and down up and down with mr ramsay and say who have win this who have win that who be a ﻿1 rate man at latin verse who be brilliant but i think fundamentally unsound who be undoubtedly the able fellow in balliol who have bury his light temporarily at bristol or bedford but be bind to be hear of late when his prolegomena of which mr tansley have the ﻿1 page in proof with him if mr ramsay would like to see them to some branch of mathematics or philosophy see the light of day
44,That was what they talked about.,that be what they talk about
45,She could not help laughing herself sometimes.,she can not help laugh herself sometimes
46,"She said, the other day, something about ""waves mountains high.""",she say the other day something about wave mountain high
47,"Yes, said Charles Tansley, it was a little rough.",yes say charles tansley it be a little rough
48,"""Aren't you drenched to the skin?""",be not you drench to the skin
49,she had said.,she have say
50,"""Damp, not wet through,"" said Mr. Tansley, pinching his sleeve, feeling his socks.",damp not wet through say mr tansley pinch his sleeve feel his sock
51,"But it was not that they minded, the children said.",but it be not that they mind the child say
52,It was not his face; it was not his manners.,it be not his face it be not his manner
53,It was himhis point of view.,it be himhis point of view
54,"When they talked about something interesting, people, music, history, anything, even said it was a fine evening so why not sit out of doors, then what they complained of about Charles Tansley was that until he had turned the whole thing round and made it somehow reflect himself and disparage themhe was not satisfied.",when they talk about something interest people music history anything even say it be a fine even so why not sit out of door then what they complain of about charles tansley be that until he have turn the whole thing round and make it somehow reflect himself and disparage themhe be not satisfy
55,"And he would go to picture galleries they said, and he would ask one, did one like his tie?",and he would go to picture gallery they say and he would ask one do one like his tie
56,"God knows, said Rose, one did not.",god know say rise one do not
57,"Disappearing as stealthily as stags from the dinner-table directly the meal was over, the eight sons and daughters of Mr. and Mrs. Ramsay sought their bedrooms, their fastness in a house where there was no other privacy to debate anything, everything; Tansley's tie; the passing of the Reform Bill; sea birds and butterflies; people; while the sun poured into those attics, which a plank alone separated from each other so that every footstep could be plainly heard and the Swiss girl sobbing for her father who was dying of cancer in a valley of the Grisons, and lit up bats, flannels, straw hats, ink-pots, paint-pots, beetles, and the skulls of small birds, while it drew from the long frilled strips of seaweed pinned to the wall a smell of salt and weeds, which was in the towels too, gritty with sand from bathing.",disappear a stealthily a stag from the dinner table directly the meal be over the eight son and daughter of mr and mrs ramsay seek their bedroom their fastness in a house where there be no other privacy to debate anything everything tansley s tie the pass of the reform bill sea bird and butterfly people while the sun pour into that attic which a plank alone separate from each other so that every footstep can be plainly hear and the swiss girl sob for her father who be dye of cancer in a valley of the grisons and light up bat flannel straw hat ink pot paint pot beetle and the skull of small bird while it draw from the long frill strip of seaweed pin to the wall a smell of salt and weed which be in the towel too gritty with sand from bathe
58,"Strife, divisions, difference of opinion, prejudices twisted into the very fibre of being, oh, that they should begin so early, Mrs. Ramsay deplored.",strife division difference of opinion prejudice twist into the very fibre of be oh that they should begin so early mrs ramsay deplore
59,"They were so critical, her children.",they be so critical her child
60,They talked such nonsense.,they talk such nonsense
61,"She went from the dining-room, holding James by the hand, since he would not go with the others.",she go from the dine room hold james by the hand since he would not go with the other
62,"It seemed to her such nonsenseinventing differences, when people, heaven knows, were different enough without that.",it seem to her such nonsenseinventing difference when people heaven know be different enough without that
63,"The real differences, she thought, standing by the drawing-room window, are enough, quite enough.",the real difference she think stand by the draw room window be enough quite enough
64,"She had in mind at the moment, rich and poor, high and low; the great in birth receiving from her, half grudging, some respect, for had she not in her veins the blood of that very noble, if slightly mythical, Italian house, whose daughters, scattered about English drawing-rooms in the nineteenth century, had lisped so charmingly, had stormed so wildly, and all her wit and her bearing and her temper came from them, and not from the sluggish English, or the cold Scotch; but more profoundly, she ruminated the other problem, of rich and poor, and the things she saw with her own eyes, weekly, daily, here or in London, when she visited this widow, or that struggling wife in person with a bag on her arm, and a note-book and pencil with which she wrote down in columns carefully ruled for the purpose wages and spendings, employment and unemployment, in the hope that thus she would cease to be a private woman whose charity was half a sop to her own indignation, half a relief to her own curiosity, and become what with her untrained mind she greatly admired, an investigator, elucidating the social problem.",she have in mind at the moment rich and poor high and low the great in birth receive from her half grudge some respect for have she not in her vein the blood of that very noble if slightly mythical italian house whose daughter scatter about english draw room in the 19 century have lisp so charmingly have storm so wildly and all her wit and her bear and her temper come from them and not from the sluggish english or the cold scotch but much profoundly she ruminate the other problem of rich and poor and the thing she see with her own eye weekly daily here or in london when she visit this widow or that struggle wife in person with a bag on her arm and a note book and pencil with which she write down in column carefully rule for the purpose wage and spendings employment and unemployment in the hope that thus she would cease to be a private woman whose charity be half a sop to her own indignation half a relief to her own curiosity and become what with her untrained mind she greatly admire a investigator elucidate the social problem
65,"Insoluble questions they were, it seemed to her, standing there, holding James by the hand.",insoluble question they be it seem to her stand there hold james by the hand
66,"He had followed her into the drawing-room, that young man they laughed at; he was standing by the table, fidgeting with something, awkwardly, feeling himself out of things, as she knew without looking round.",he have follow her into the draw room that young man they laugh at he be stand by the table fidget with something awkwardly feel himself out of thing a she know without look round
67,They had all gonethe children; Minta Doyle and Paul Rayley; Augustus Carmichael; her husbandthey had all gone.,they have all gonethe child minta doyle and paul rayley augustus carmichael her husbandthey have all go
68,"So she turned with a sigh and said, ""Would it bore you to come with me, Mr.",so she turn with a sigh and say would it bear you to come with me mr
69,"Tansley?""",tansley
70,She had a dull errand in the town; she had a letter or two to write; she would be ten minutes perhaps; she would put on her hat.,she have a dull errand in the town she have a letter or two to write she would be ten minute perhaps she would put on her hat
71,"And, with her basket and her parasol, there she was again, ten minutes later, giving out a sense of being ready, of being equipped for a jaunt, which, however, she must interrupt for a moment, as they passed the tennis lawn, to ask Mr. Carmichael, who was basking with his yellow cat's eyes ajar, so that like a cat's they seemed to reflect the branches moving or the clouds passing, but to give no inkling of any inner thoughts or emotion whatsoever, if he wanted anything.",and with her basket and her parasol there she be again ten minute late give out a sense of be ready of be equip for a jaunt which however she must interrupt for a moment a they pass the tennis lawn to ask mr carmichael who be bask with his yellow cat s eye ajar so that like a cat s they seem to reflect the branch move or the cloud pass but to give no inkling of any inner thought or emotion whatsoever if he want anything
72,"For they were making the great expedition, she said, laughing.",for they be make the great expedition she say laugh
73,They were going to the town.,they be go to the town
74,"""Stamps, writing-paper, tobacco?""",stamp write paper tobacco
75,"she suggested, stopping by his side.",she suggest stop by his side
76,"But no, he wanted nothing.",but no he want nothing
