,text_raw,text_clean
1623,"""It is a triumph,"" said Mr. Bankes, laying his knife down for a moment.",it be a triumph say mr bankes lay his knife down for a moment
1624,He had eaten attentively.,he have eat attentively
1625,It was rich; it was tender.,it be rich it be tender
1626,It was perfectly cooked.,it be perfectly cook
1627,How did she manage these things in the depths of the country?,how do she manage this thing in the depth of the country
1628,he asked her.,he ask her
1629,She was a wonderful woman.,she be a wonderful woman
1630,"All his love, all his reverence, had returned; and she knew it.",all his love all his reverence have return and she know it
1631,"""It is a French recipe of my grandmother's,"" said Mrs. Ramsay, speaking with a ring of great pleasure in her voice.",it be a french recipe of my grandmother s say mrs ramsay speak with a ring of great pleasure in her voice
1632,Of course it was French.,of course it be french
1633,What passes for cookery in England is an abomination (they agreed).,what pass for cookery in england be a abomination they agree
1634,It is putting cabbages in water.,it be putt cabbage in water
1635,It is roasting meat till it is like leather.,it be roast meat till it be like leather
1636,It is cutting off the delicious skins of vegetables.,it be cut off the delicious skin of vegetable
1637,"""In which,"" said Mr. Bankes, ""all the virtue of the vegetable is contained.""",in which say mr bankes all the virtue of the vegetable be contain
1638,"And the waste, said Mrs. Ramsay.",and the waste say mrs ramsay
1639,A whole French family could live on what an English cook throws away.,a whole french family can live on what a english cook throw away
1640,"Spurred on by her sense that William's affection had come back to her, and that everything was all right again, and that her suspense was over, and that now she was free both to triumph and to mock, she laughed, she gesticulated, till Lily thought, How childlike, how absurd she was, sitting up there with all her beauty opened again in her, talking about the skins of vegetables.",spur on by her sense that william s affection have come back to her and that everything be all right again and that her suspense be over and that now she be free both to triumph and to mock she laugh she gesticulate till lily think how childlike how absurd she be sit up there with all her beauty open again in her talk about the skin of vegetable
1641,There was something frightening about her.,there be something frighten about her
1642,She was irresistible.,she be irresistible
1643,"Always she got her own way in the end, Lily thought.",always she get her own way in the end lily think
1644,"Now she had brought this offPaul and Minta, one might suppose, were engaged.",now she have bring this offpaul and minta one may suppose be engage
1645,Mr. Bankes was dining here.,mr bankes be dine here
1646,"She put a spell on them all, by wishing, so simply, so directly, and Lily contrasted that abundance with her own poverty of spirit, and supposed that it was partly that belief (for her face was all lit upwithout looking young, she looked radiant) in this strange, this terrifying thing, which made Paul Rayley, sitting at her side, all of a tremor, yet abstract, absorbed, silent.",she put a spell on them all by wish so simply so directly and lily contrast that abundance with her own poverty of spirit and suppose that it be partly that belief for her face be all light upwithout look young she look radiant in this strange this terrify thing which make paul rayley sit at her side all of a tremor yet abstract absorb silent
1647,"Mrs. Ramsay, Lily felt, as she talked about the skins of vegetables, exalted that, worshipped that; held her hands over it to warm them, to protect it, and yet, having brought it all about, somehow laughed, led her victims, Lily felt, to the altar.",mrs ramsay lily feel a she talk about the skin of vegetable exalt that worship that hold her hand over it to warm them to protect it and yet have bring it all about somehow laugh lead her victim lily feel to the altar
1648,"It came over her too nowthe emotion, the vibration, of love.",it come over her too nowthe emotion the vibration of love
1649,How inconspicuous she felt herself by Paul's side!,how inconspicuous she feel herself by paul s side
1650,"He, glowing, burning; she, aloof, satirical; he, bound for adventure; she, moored to the shore; he, launched, incautious; she solitary, left outand, ready to implore a share, if it were a disaster, in his disaster, she said shyly:",he glow burn she aloof satirical he bind for adventure she moor to the shore he launch incautious she solitary leave outand ready to implore a share if it be a disaster in his disaster she say shyly
1651,"""When did Minta lose her brooch?""",when do minta lose her brooch
1652,"He smiled the most exquisite smile, veiled by memory, tinged by dreams.",he smile the much exquisite smile veil by memory tinge by dream
1653,He shook his head.,he shake his head
1654,"""On the beach,"" he said.",on the beach he say
1655,"""I'm going to find it,"" he said, ""I'm getting up early.""",i be go to find it he say i be get up early
1656,"This being kept secret from Minta, he lowered his voice, and turned his eyes to where she sat, laughing, beside Mr. Ramsay.",this be keep secret from minta he lower his voice and turn his eye to where she sit laugh beside mr ramsay
1657,"Lily wanted to protest violently and outrageously her desire to help him, envisaging how in the dawn on the beach she would be the one to pounce on the brooch half-hidden by some stone, and thus herself be included among the sailors and adventurers.",lily want to protest violently and outrageously her desire to help him envisage how in the dawn on the beach she would be the one to pounce on the brooch half hide by some stone and thus herself be include among the sailor and adventurer
1658,But what did he reply to her offer?,but what do he reply to her offer
1659,"She actually said with an emotion that she seldom let appear, ""Let me come with you,"" and he laughed.",she actually say with a emotion that she seldom let appear let me come with you and he laugh
1660,He meant yes or no either perhaps.,he mean yes or no either perhaps
1661,"But it was not his meaningit was the odd chuckle he gave, as if he had said, Throw yourself over the cliff if you like, I don't care.",but it be not his meaningit be the odd chuckle he give a if he have say throw yourself over the cliff if you like i do not care
1662,"He turned on her cheek the heat of love, its horror, its cruelty, its unscrupulosity.",he turn on her cheek the heat of love its horror its cruelty its unscrupulosity
1663,"It scorched her, and Lily, looking at Minta, being charming to Mr. Ramsay at the other end of the table, flinched for her exposed to these fangs, and was thankful.",it scorch her and lily look at minta be charm to mr ramsay at the other end of the table flinch for her expose to this fang and be thankful
1664,"For at any rate, she said to herself, catching sight of the salt cellar on the pattern, she need not marry, thank Heaven: she need not undergo that degradation.",for at any rate she say to herself catch sight of the salt cellar on the pattern she need not marry thank heaven she need not undergo that degradation
1665,She was saved from that dilution.,she be save from that dilution
1666,She would move the tree rather more to the middle.,she would move the tree rather much to the middle
1667,Such was the complexity of things.,such be the complexity of thing
1668,"For what happened to her, especially staying with the Ramsays, was to be made to feel violently two opposite things at the same time; that's what you feel, was one; that's what I feel, was the other, and then they fought together in her mind, as now.",for what happen to her especially stay with the ramsays be to be make to feel violently two opposite thing at the same time that be what you feel be one that be what i feel be the other and then they fight together in her mind a now
1669,"It is so beautiful, so exciting, this love, that I tremble on the verge of it, and offer, quite out of my own habit, to look for a brooch on a beach; also it is the stupidest, the most barbaric of human passions, and turns a nice young man with a profile like a gem's (Paul's was exquisite) into a bully with a crowbar (he was swaggering, he was insolent) in the Mile End Road.",it be so beautiful so excite this love that i tremble on the verge of it and offer quite out of my own habit to look for a brooch on a beach also it be the stupid the much barbaric of human passion and turn a nice young man with a profile like a gem s paul s be exquisite into a bully with a crowbar he be swagger he be insolent in the mile end road
1670,"Yet, she said to herself, from the dawn of time odes have been sung to love; wreaths heaped and roses; and if you asked nine people out of ten they would say they wanted nothing but thislove; while the women, judging from her own experience, would all the time be feeling, This is not what we want; there is nothing more tedious, puerile, and inhumane than this; yet it is also beautiful and necessary.",yet she say to herself from the dawn of time ode have be sing to love wreath heap and rose and if you ask nine people out of ten they would say they want nothing but thislove while the woman judge from her own experience would all the time be feel this be not what we want there be nothing much tedious puerile and inhumane than this yet it be also beautiful and necessary
1671,"Well then, well then?",good then good then
1672,"she asked, somehow expecting the others to go on with the argument, as if in an argument like this one threw one's own little bolt which fell short obviously and left the others to carry it on.",she ask somehow expect the other to go on with the argument a if in a argument like this one throw one s own little bolt which fall short obviously and leave the other to carry it on
1673,So she listened again to what they were saying in case they should throw any light upon the question of love.,so she listen again to what they be say in case they should throw any light upon the question of love
1674,"""Then,"" said Mr. Bankes, ""there is that liquid the English call coffee.""",then say mr bankes there be that liquid the english call coffee
1675,"""Oh, coffee!""",oh coffee
1676,said Mrs. Ramsay.,say mrs ramsay
1677,"But it was much rather a question (she was thoroughly roused, Lily could see, and talked very emphatically) of real butter and clean milk.",but it be much rather a question she be thoroughly rouse lily can see and talk very emphatically of real butter and clean milk
1678,"Speaking with warmth and eloquence, she described the iniquity of the English dairy system, and in what state milk was delivered at the door, and was about to prove her charges, for she had gone into the matter, when all round the table, beginning with Andrew in the middle, like a fire leaping from tuft to tuft of furze, her children laughed; her husband laughed; she was laughed at, fire- encircled, and forced to veil her crest, dismount her batteries, and only retaliate by displaying the raillery and ridicule of the table to Mr. Bankes as an example of what one suffered if one attacked the prejudices of the British Public.",speak with warmth and eloquence she describe the iniquity of the english dairy system and in what state milk be deliver at the door and be about to prove her charge for she have go into the matt when all round the table begin with andrew in the middle like a fire leap from tuft to tuft of furze her child laugh her husband laugh she be laugh at fire encircle and force to veil her crest dismount her battery and only retaliate by display the raillery and ridicule of the table to mr bankes a a example of what one suffer if one attack the prejudice of the british public
1679,"Purposely, however, for she had it on her mind that Lily, who had helped her with Mr. Tansley, was out of things, she exempted her from the rest; said ""Lily anyhow agrees with me,"" and so drew her in, a little fluttered, a little startled.",purposely however for she have it on her mind that lily who have help her with mr tansley be out of thing she exempt her from the rest say lily anyhow agree with me and so draw her in a little flutter a little startle
1680,(For she was thinking about love.),for she be think about love
1681,"They were both out of things, Mrs. Ramsay had been thinking, both Lily and Charles Tansley.",they be both out of thing mrs ramsay have be think both lily and charles tansley
1682,Both suffered from the glow of the other two.,both suffer from the glow of the other two
1683,"He, it was clear, felt himself utterly in the cold; no woman would look at him with Paul Rayley in the room.",he it be clear feel himself utterly in the cold no woman would look at him with paul rayley in the room
1684,Poor fellow!,poor fellow
1685,"Still, he had his dissertation, the influence of somebody upon something: he could take care of himself.",still he have his dissertation the influence of somebody upon something he can take care of himself
1686,With Lily it was different.,with lily it be different
1687,"She faded, under Minta's glow; became more inconspicuous than ever, in her little grey dress with her little puckered face and her little Chinese eyes.",she fade under minta s glow become much inconspicuous than ever in her little grey dress with her little pucker face and her little chinese eye
1688,Everything about her was so small.,everything about her be so small
1689,"Yet, thought Mrs. Ramsay, comparing her with Minta, as she claimed her help (for Lily should bear her out she talked no more about her dairies than her husband did about his bootshe would talk by the hour about his boots) of the two, Lily at forty will be the better.",yet think mrs ramsay compare her with minta a she claim her help for lily should bear her out she talk no much about her dairy than her husband do about his bootshe would talk by the hour about his boot of the two lily at forty will be the well
1690,"There was in Lily a thread of something; a flare of something; something of her own which Mrs. Ramsay liked very much indeed, but no man would, she feared.",there be in lily a thread of something a flare of something something of her own which mrs ramsay like very much indeed but no man would she fear
1691,"Obviously, not, unless it were a much older man, like William Bankes.",obviously not unless it be a much old man like william bankes
1692,"But then he cared, well, Mrs. Ramsay sometimes thought that he cared, since his wife's death, perhaps for her.",but then he care good mrs ramsay sometimes think that he care since his wife s death perhaps for her
1693,"He was not ""in love"" of course; it was one of those unclassified affections of which there are so many.",he be not in love of course it be one of that unclassified affection of which there be so many
1694,"Oh, but nonsense, she thought; William must marry Lily.",oh but nonsense she think william must marry lily
1695,They have so many things in common.,they have so many thing in common
1696,Lily is so fond of flowers.,lily be so fond of flower
1697,They are both cold and aloof and rather self-sufficing.,they be both cold and aloof and rather self suffice
1698,She must arrange for them to take a long walk together.,she must arrange for them to take a long walk together
1699,"Foolishly, she had set them opposite each other.",foolishly she have set them opposite each other
1700,That could be remedied tomorrow.,that can be remedy tomorrow
1701,"If it were fine, they should go for a picnic.",if it be fine they should go for a picnic
1702,Everything seemed possible.,everything seem possible
1703,Everything seemed right.,everything seem right
1704,"Just now (but this cannot last, she thought, dissociating herself from the moment while they were all talking about boots) just now she had reached security; she hovered like a hawk suspended; like a flag floated in an element of joy which filled every nerve of her body fully and sweetly, not noisily, solemnly rather, for it arose, she thought, looking at them all eating there, from husband and children and friends; all of which rising in this profound stillness (she was helping William Bankes to one very small piece more, and peered into the depths of the earthenware pot) seemed now for no special reason to stay there like a smoke, like a fume rising upwards, holding them safe together.",just now but this can not last she think dissociate herself from the moment while they be all talk about boot just now she have reach security she hover like a hawk suspend like a flag float in a element of joy which fill every nerve of her body fully and sweetly not noisily solemnly rather for it arise she think look at them all eat there from husband and child and friend all of which rise in this profound stillness she be help william bankes to one very small piece much and peer into the depth of the earthenware pot seem now for no special reason to stay there like a smoke like a fume rise upwards hold them safe together
1705,Nothing need be said; nothing could be said.,nothing need be say nothing can be say
1706,"There it was, all round them.",there it be all round them
1707,"It partook, she felt, carefully helping Mr. Bankes to a specially tender piece, of eternity; as she had already felt about something different once before that afternoon; there is a coherence in things, a stability; something, she meant, is immune from change, and shines out (she glanced at the window with its ripple of reflected lights) in the face of the flowing, the fleeting, the spectral, like a ruby; so that again tonight she had the feeling she had had once today, already, of peace, of rest.",it partake she feel carefully help mr bankes to a specially tender piece of eternity a she have already feel about something different once before that afternoon there be a coherence in thing a stability something she mean be immune from change and shine out she glance at the window with its ripple of reflect light in the face of the flow the fleeting the spectral like a ruby so that again tonight she have the feel she have have once today already of peace of rest
1708,"Of such moments, she thought, the thing is made that endures.",of such moment she think the thing be make that endure
1709,"""Yes,"" she assured William Bankes, ""there is plenty for everybody.""",yes she assure william bankes there be plenty for everybody
1710,"""Andrew,"" she said, ""hold your plate lower, or I shall spill it.""",andrew she say hold your plate low or i shall spill it
1711,(The BOEUF EN DAUBE was a perfect triumph.),the boeuf en daube be a perfect triumph
1712,"Here, she felt, putting the spoon down, where one could move or rest; could wait now (they were all helped) listening; could then, like a hawk which lapses suddenly from its high station, flaunt and sink on laughter easily, resting her whole weight upon what at the other end of the table her husband was saying about the square root of one thousand two hundred and fifty-three.",here she feel putt the spoon down where one can move or rest can wait now they be all help listen can then like a hawk which lapse suddenly from its high station flaunt and sink on laughter easily rest her whole weight upon what at the other end of the table her husband be say about the square root of one thousand two hundred and fifty three
1713,"That was the number, it seemed, on his watch.",that be the numb it seem on his watch
1714,What did it all mean?,what do it all mean
1715,To this day she had no notion.,to this day she have no notion
1716,A square root?,a square root
1717,What was that?,what be that
1718,Her sons knew.,her son know
1719,"She leant on them; on cubes and square roots; that was what they were talking about now; on Voltaire and Madame de Stael; on the character of Napoleon; on the French system of land tenure; on Lord Rosebery; on Creevey's Memoirs: she let it uphold her and sustain her, this admirable fabric of the masculine intelligence, which ran up and down, crossed this way and that, like iron girders spanning the swaying fabric, upholding the world, so that she could trust herself to it utterly, even shut her eyes, or flicker them for a moment, as a child staring up from its pillow winks at the myriad layers of the leaves of a tree.",she lean on them on cube and square root that be what they be talk about now on voltaire and madame de stael on the character of napoleon on the french system of land tenure on lord rosebery on creevey s memoir she let it uphold her and sustain her this admirable fabric of the masculine intelligence which run up and down cross this way and that like iron girder span the sway fabric uphold the world so that she can trust herself to it utterly even shut her eye or flicker them for a moment a a child stare up from its pillow wink at the myriad layer of the leave of a tree
1720,Then she woke up.,then she wake up
1721,It was still being fabricated.,it be still be fabricate
1722,William Bankes was praising the Waverly novels.,william bankes be praise the waverly novel
1723,"He read one of them every six months, he said.",he read one of them every six month he say
1724,And why should that make Charles Tansley angry?,and why should that make charles tansley angry
1725,"He rushed in (all, thought Mrs. Ramsay, because Prue will not be nice to him) and denounced the Waverly novels when he knew nothing about it, nothing about it whatsoever, Mrs. Ramsay thought, observing him rather than listening to what he said.",he rush in all think mrs ramsay because prue will not be nice to him and denounce the waverly novel when he know nothing about it nothing about it whatsoever mrs ramsay think observe him rather than listen to what he say
1726,"She could see how it was from his mannerhe wanted to assert himself, and so it would always be with him till he got his Professorship or married his wife, and so need not be always saying, ""III.""",she can see how it be from his mannerhe want to assert himself and so it would always be with him till he get his professorship or marry his wife and so need not be always say iii
1727,"For that was what his criticism of poor Sir Walter, or perhaps it was Jane Austen, amounted to.",for that be what his criticism of poor sir walter or perhaps it be jane austen amount to
1728,"""I-I-I.""",i i i
1729,"He was thinking of himself and the impression he was making, as she could tell by the sound of his voice, and his emphasis and his uneasiness.",he be think of himself and the impression he be make a she can tell by the sound of his voice and his emphasis and his uneasiness
1730,Success would be good for him.,success would be good for him
1731,At any rate they were off again.,at any rate they be off again
1732,Now she need not listen.,now she need not listen
1733,"It could not last, she knew, but at the moment her eyes were so clear that they seemed to go round the table unveiling each of these people, and their thoughts and their feelings, without effort like a light stealing under water so that its ripples and the reeds in it and the minnows balancing themselves, and the sudden silent trout are all lit up hanging, trembling.",it can not last she know but at the moment her eye be so clear that they seem to go round the table unveil each of this people and their thought and their feeling without effort like a light steal under water so that its ripple and the reed in it and the minnow balance themselves and the sudden silent trout be all light up hang tremble
1734,"So she saw them; she heard them; but whatever they said had also this quality, as if what they said was like the movement of a trout when, at the same time, one can see the ripple and the gravel, something to the right, something to the left; and the whole is held together; for whereas in active life she would be netting and separating one thing from another; she would be saying she liked the Waverly novels or had not read them; she would be urging herself forward; now she said nothing.",so she see them she hear them but whatever they say have also this quality a if what they say be like the movement of a trout when at the same time one can see the ripple and the gravel something to the right something to the leave and the whole be hold together for whereas in active life she would be net and separate one thing from another she would be say she like the waverly novel or have not read them she would be urge herself forward now she say nothing
1735,"For the moment, she hung suspended.",for the moment she hang suspend
1736,"""Ah, but how long do you think it'll last?""",ah but how long do you think it will last
1737,said somebody.,say somebody
1738,"It was as if she had antennae trembling out from her, which, intercepting certain sentences, forced them upon her attention.",it be a if she have antenna tremble out from her which intercept certain sentence force them upon her attention
1739,This was one of them.,this be one of them
1740,She scented danger for her husband.,she scent danger for her husband
1741,"A question like that would lead, almost certainly, to something being said which reminded him of his own failure.",a question like that would lead almost certainly to something be say which remind him of his own failure
1742,How long would he be readhe would think at once.,how long would he be readhe would think at once
1743,"William Bankes (who was entirely free from all such vanity) laughed, and said he attached no importance to changes in fashion.",william bankes who be entirely free from all such vanity laugh and say he attach no importance to change in fashion
