,text_raw,text_clean
678,"But now while she still looked, Mr. Bankes had done.",but now while she still look mr bankes have do
679,He had put on his spectacles.,he have put on his spectacle
680,He had stepped back.,he have step back
681,He had raised his hand.,he have raise his hand
682,"He had slightly narrowed his clear blue eyes, when Lily, rousing herself, saw what he was at, and winced like a dog who sees a hand raised to strike it.",he have slightly narrow his clear blue eye when lily rouse herself see what he be at and wince like a dog who see a hand raise to strike it
683,"She would have snatched her picture off the easel, but she said to herself, One must.",she would have snatch her picture off the easel but she say to herself one must
684,She braced herself to stand the awful trial of some one looking at her picture.,she brace herself to stand the awful trial of some one look at her picture
685,"One must, she said, one must.",one must she say one must
686,"And if it must be seen, Mr. Bankes was less alarming than another.",and if it must be see mr bankes be little alarm than another
687,"But that any other eyes should see the residue of her thirty-three years, the deposit of each day's living mixed with something more secret than she had ever spoken or shown in the course of all those days was an agony.",but that any other eye should see the residue of her thirty three year the deposit of each day s live mix with something much secret than she have ever speak or show in the course of all that day be a agony
688,At the same time it was immensely exciting.,at the same time it be immensely excite
689,Nothing could be cooler and quieter.,nothing can be cool and quiet
690,"Taking out a pen-knife, Mr. Bankes tapped the canvas with the bone handle.",take out a pen knife mr bankes tap the canvas with the bone handle
691,"What did she wish to indicate by the triangular purple shape, ""just there""?",what do she wish to indicate by the triangular purple shape just there
692,he asked.,he ask
693,"It was Mrs. Ramsay reading to James, she said.",it be mrs ramsay read to james she say
694,She knew his objection that no one could tell it for a human shape.,she know his objection that no one can tell it for a human shape
695,"But she had made no attempt at likeness, she said.",but she have make no attempt at likeness she say
696,For what reason had she introduced them then?,for what reason have she introduce them then
697,he asked.,he ask
698,"Why indeed?except that if there, in that corner, it was bright, here, in this, she felt the need of darkness.",why indeed except that if there in that corner it be bright here in this she feel the need of darkness
699,"Simple, obvious, commonplace, as it was, Mr. Bankes was interested.",simple obvious commonplace a it be mr bankes be interest
700,"Mother and child thenobjects of universal veneration, and in this case the mother was famous for her beautymight be reduced, he pondered, to a purple shadow without irreverence.",mother and child thenobjects of universal veneration and in this case the mother be famous for her beautymight be reduce he ponder to a purple shadow without irreverence
701,"But the picture was not of them, she said.",but the picture be not of them she say
702,"Or, not in his sense.",or not in his sense
703,There were other senses too in which one might reverence them.,there be other sense too in which one may reverence them
704,"By a shadow here and a light there, for instance.",by a shadow here and a light there for instance
705,"Her tribute took that form if, as she vaguely supposed, a picture must be a tribute.",her tribute take that form if a she vague suppose a picture must be a tribute
706,A mother and child might be reduced to a shadow without irreverence.,a mother and child may be reduce to a shadow without irreverence
707,A light here required a shadow there.,a light here require a shadow there
708,He considered.,he consider
709,He was interested.,he be interest
710,He took it scientifically in complete good faith.,he take it scientifically in complete good faith
711,"The truth was that all his prejudices were on the other side, he explained.",the truth be that all his prejudice be on the other side he explain
712,"The largest picture in his drawing-room, which painters had praised, and valued at a higher price than he had given for it, was of the cherry trees in blossom on the banks of the Kennet.",the large picture in his draw room which painter have praise and value at a high price than he have give for it be of the cherry tree in blossom on the bank of the kennet
713,"He had spent his honeymoon on the banks of the Kennet, he said.",he have spend his honeymoon on the bank of the kennet he say
714,"Lily must come and see that picture, he said.",lily must come and see that picture he say
715,"But nowhe turned, with his glasses raised to the scientific examination of her canvas.",but nowhe turn with his glass raise to the scientific examination of her canvas
716,"The question being one of the relations of masses, of lights and shadows, which, to be honest, he had never considered before, he would like to have it explainedwhat then did she wish to make of it?",the question be one of the relation of masse of light and shadow which to be honest he have never consider before he would like to have it explainedwhat then do she wish to make of it
717,And he indicated the scene before them.,and he indicate the scene before them
718,She looked.,she look
719,"She could not show him what she wished to make of it, could not see it even herself, without a brush in her hand.",she can not show him what she wish to make of it can not see it even herself without a brush in her hand
720,"She took up once more her old painting position with the dim eyes and the absent-minded manner, subduing all her impressions as a woman to something much more general; becoming once more under the power of that vision which she had seen clearly once and must now grope for among hedges and houses and mothers and childrenher picture.",she take up once much her old paint position with the dim eye and the absent mind manner subdue all her impression a a woman to something much much general become once much under the power of that vision which she have see clearly once and must now grope for among hedge and house and mother and childrenher picture
721,"It was a question, she remembered, how to connect this mass on the right hand with that on the left.",it be a question she remember how to connect this mass on the right hand with that on the leave
722,She might do it by bringing the line of the branch across so; or break the vacancy in the foreground by an object (James perhaps) so.,she may do it by bring the line of the branch across so or break the vacancy in the foreground by a object james perhaps so
723,But the danger was that by doing that the unity of the whole might be broken.,but the danger be that by do that the unity of the whole may be break
724,She stopped; she did not want to bore him; she took the canvas lightly off the easel.,she stop she do not want to bear him she take the canvas lightly off the easel
725,But it had been seen; it had been taken from her.,but it have be see it have be take from her
726,This man had shared with her something profoundly intimate.,this man have share with her something profoundly intimate
727,"And, thanking Mr. Ramsay for it and Mrs. Ramsay for it and the hour and the place, crediting the world with a power which she had not suspectedthat one could walk away down that long gallery not alone any more but arm in arm with somebodythe strangest feeling in the world, and the most exhilaratingshe nicked the catch of her paint-box to, more firmly than was necessary, and the nick seemed to surround in a circle forever the paint-box, the lawn, Mr. Bankes, and that wild villain, Cam, dashing past.",and thank mr ramsay for it and mrs ramsay for it and the hour and the place credit the world with a power which she have not suspectedthat one can walk away down that long gallery not alone any much but arm in arm with somebodythe strange feel in the world and the much exhilaratingshe nick the catch of her paint box to much firmly than be necessary and the nick seem to surround in a circle forever the paint box the lawn mr bankes and that wild villain cam dash past
728,SECTION 10,section
729,"For Cam grazed the easel by an inch; she would not stop for Mr. Bankes and Lily Briscoe; though Mr. Bankes, who would have liked a daughter of his own, held out his hand; she would not stop for her father, whom she grazed also by an inch; nor for her mother, who called ""Cam!",for cam graze the easel by a inch she would not stop for mr bankes and lily briscoe though mr bankes who would have like a daughter of his own hold out his hand she would not stop for her father whom she graze also by a inch nor for her mother who call cam
730,"I want you a moment!""",i want you a moment
731,as she dashed past.,a she dash past
732,"She was off like a bird, bullet, or arrow, impelled by what desire, shot by whom, at what directed, who could say?",she be off like a bird bullet or arrow impel by what desire shoot by whom at what direct who can say
733,"What, what?",what what
734,"Mrs. Ramsay pondered, watching her.",mrs ramsay ponder watch her
735,"It might be a visionof a shell, of a wheelbarrow, of a fairy kingdom on the far side of the hedge; or it might be the glory of speed; no one knew.",it may be a visionof a she will of a wheelbarrow of a fairy kingdom on the far side of the hedge or it may be the glory of speed no one know
736,"But when Mrs. Ramsay called ""Cam!""",but when mrs ramsay call cam
737,"a second time, the projectile dropped in mid career, and Cam came lagging back, pulling a leaf by the way, to her mother.",a 2 time the projectile drop in mid career and cam come lag back pull a leaf by the way to her mother
738,"What was she dreaming about, Mrs. Ramsay wondered, seeing her engrossed, as she stood there, with some thought of her own, so that she had to repeat the message twiceask Mildred if Andrew, Miss Doyle, and Mr. Rayley have come back?The words seemed to be dropped into a well, where, if the waters were clear, they were also so extraordinarily distorting that, even as they descended, one saw them twisting about to make Heaven knows what pattern on the floor of the child's mind.",what be she dream about mrs ramsay wonder see her engross a she stand there with some think of her own so that she have to repeat the message twiceask mildred if andrew miss doyle and mr rayley have come back the word seem to be drop into a good where if the water be clear they be also so extraordinarily distort that even a they descend one see them twist about to make heaven know what pattern on the floor of the child s mind
739,What message would Cam give the cook?,what message would cam give the cook
740,Mrs. Ramsay wondered.,mrs ramsay wonder
741,"And indeed it was only by waiting patiently, and hearing that there was an old woman in the kitchen with very red cheeks, drinking soup out of a basin, that Mrs. Ramsay at last prompted that parrot-like instinct which had picked up Mildred's words quite accurately and could now produce them, if one waited, in a colourless singsong.",and indeed it be only by wait patiently and hear that there be a old woman in the kitchen with very red cheek drink soup out of a basin that mrs ramsay at last prompt that parrot like instinct which have pick up mildred s word quite accurately and can now produce them if one wait in a colourless singsong
742,"Shifting from foot to foot, Cam repeated the words, ""No, they haven't, and I've told Ellen to clear away tea.""",shift from foot to foot cam repeat the word no they have not and i have tell ellen to clear away tea
743,Minta Doyle and Paul Rayley had not come back then.,minta doyle and paul rayley have not come back then
744,"That could only mean, Mrs. Ramsay thought, one thing.",that can only mean mrs ramsay think one thing
745,"She must accept him, or she must refuse him.",she must accept him or she must refuse him
746,"This going off after luncheon for a walk, even though Andrew was with themwhat could it mean?",this go off after luncheon for a walk even though andrew be with themwhat can it mean
747,"except that she had decided, rightly, Mrs. Ramsay thought (and she was very, very fond of Minta), to accept that good fellow, who might not be brilliant, but then, thought Mrs. Ramsay, realising that James was tugging at her, to make her go on reading aloud the Fisherman and his Wife, she did in her own heart infinitely prefer boobies to clever men who wrote dissertations; Charles Tansley, for instance.",except that she have decide rightly mrs ramsay think and she be very very fond of minta to accept that good fellow who may not be brilliant but then think mrs ramsay realise that james be tug at her to make her go on read aloud the fisherman and his wife she do in her own heart infinitely prefer booby to clever man who write dissertation charles tansley for instance
748,"Anyhow it must have happened, one way or the other, by now.",anyhow it must have happen one way or the other by now
749,"But she read, ""Next morning the wife awoke first, and it was just daybreak, and from her bed she saw the beautiful country lying before her.",but she read next morning the wife awake ﻿1 and it be just daybreak and from her bed she see the beautiful country lie before her
750,"Her husband was still stretching himself...""",her husband be still stretch himself
751,But how could Minta say now that she would not have him?,but how can minta say now that she would not have him
752,Not if she agreed to spend whole afternoons trapesing about the country alonefor Andrew would be off after his crabsbut possibly Nancy was with them.,not if she agree to spend whole afternoon trapesing about the country alonefor andrew would be off after his crabsbut possibly nancy be with them
753,She tried to recall the sight of them standing at the hall door after lunch.,she try to recall the sight of them stand at the hall door after lunch
754,"There they stood, looking at the sky, wondering about the weather, and she had said, thinking partly to cover their shyness, partly to encourage them to be off (for her sympathies were with Paul),",there they stand look at the sky wonder about the weather and she have say think partly to cover their shyness partly to encourage them to be off for her sympathy be with paul
755,"""There isn't a cloud anywhere within miles,"" at which she could feel little Charles Tansley, who had followed them out, snigger.",there be not a cloud anywhere within mile at which she can feel little charles tansley who have follow them out snigger
756,But she did it on purpose.,but she do it on purpose
757,"Whether Nancy was there or not, she could not be certain, looking from one to the other in her mind's eye.",whether nancy be there or not she can not be certain look from one to the other in her mind s eye
758,"She read on: ""Ah, wife,"" said the man, ""why should we be King?",she read on ah wife say the man why should we be king
759,"I do not want to be King.""",i do not want to be king
760,"""Well,"" said the wife, ""if you won't be King, I will; go to the Flounder, for I will be King.""",good say the wife if you will not be king i will go to the flounder for i will be king
761,"""Come in or go out, Cam,"" she said, knowing that Cam was attracted only by the word ""Flounder"" and that in a moment she would fidget and fight with James as usual.",come in or go out cam she say know that cam be attract only by the word flounder and that in a moment she would fidget and fight with james a usual
762,Cam shot off.,cam shoot off
763,"Mrs. Ramsay went on reading, relieved, for she and James shared the same tastes and were comfortable together.",mrs ramsay go on read relieve for she and james share the same taste and be comfortable together
764,"""And when he came to the sea, it was quite dark grey, and the water heaved up from below, and smelt putrid.",and when he come to the sea it be quite dark grey and the water heave up from below and smell putrid
765,"Then he went and stood by it and said,",then he go and stand by it and say
766,"'Flounder, flounder, in the sea, Come, I pray thee, here to me; For my wife, good Ilsabil, Wills not as I'd have her will.",flounder flounder in the sea come i pray you here to me for my wife good ilsabil will not a i would have her will
767,"'Well, what does she want then?'",good what doe she want then
768,said the Flounder.,say the flounder
769,""" And where were they now?",and where be they now
770,"Mrs. Ramsay wondered, reading and thinking, quite easily, both at the same time; for the story of the Fisherman and his Wife was like the bass gently accompanying a tune, which now and then ran up unexpectedly into the melody.",mrs ramsay wonder read and think quite easily both at the same time for the story of the fisherman and his wife be like the bass gently accompany a tune which now and then run up unexpectedly into the melody
771,And when should she be told?,and when should she be tell
772,"If nothing happened, she would have to speak seriously to Minta.",if nothing happen she would have to speak seriously to minta
773,"For she could not go trapesing about all over the country, even if Nancy were with them (she tried again, unsuccessfully, to visualize their backs going down the path, and to count them).",for she can not go trapesing about all over the country even if nancy be with them she try again unsuccessfully to visualize their back go down the path and to count them
774,She was responsible to Minta's parentsthe Owl and the Poker.,she be responsible to minta s parentsthe owl and the poker
775,Her nicknames for them shot into her mind as she read.,her nickname for them shoot into her mind a she read
776,"The Owl and the Pokeryes, they would be annoyed if they heardand they were certain to hearthat Minta, staying with the Ramsays, had been seen etcetera, etcetera, etcetera.",the owl and the pokeryes they would be annoy if they heardand they be certain to hearthat minta stay with the ramsays have be see etcetera etcetera etcetera
777,"""He wore a wig in the House of Commons and she ably assisted him at the head of the stairs,"" she repeated, fishing them up out of her mind by a phrase which, coming back from some party, she had made to amuse her husband.",he wear a wig in the house of common and she ably assist him at the head of the stair she repeat fish them up out of her mind by a phrase which come back from some party she have make to amuse her husband
778,"Dear, dear, Mrs. Ramsay said to herself, how did they produce this incongruous daughter?",dear dear mrs ramsay say to herself how do they produce this incongruous daughter
779,"this tomboy Minta, with a hole in her stocking?",this tomboy minta with a hole in her stock
780,"How did she exist in that portentous atmosphere where the maid was always removing in a dust-pan the sand that the parrot had scattered, and conversation was almost entirely reduced to the exploitsinteresting perhaps, but limited after allof that bird?",how do she exist in that portentous atmosphere where the maid be always remove in a dust pan the sand that the parrot have scatter and conversation be almost entirely reduce to the exploitsinteresting perhaps but limit after allof that bird
781,"Naturally, one had asked her to lunch, tea, dinner, finally to stay with them up at Finlay, which had resulted in some friction with the Owl, her mother, and more calling, and more conversation, and more sand, and really at the end of it, she had told enough lies about parrots to last her a lifetime (so she had said to her husband that night, coming back from the party).",naturally one have ask her to lunch tea dinner finally to stay with them up at finlay which have result in some friction with the owl her mother and much call and much conversation and much sand and really at the end of it she have tell enough lie about parrot to last her a lifetime so she have say to her husband that night come back from the party
782,"However, Minta came...Yes, she came, Mrs. Ramsay thought, suspecting some thorn in the tangle of this thought; and disengaging it found it to be this: a woman had once accused her of ""robbing her of her daughter's affections""; something Mrs. Doyle had said made her remember that charge again.",however minta come yes she come mrs ramsay think suspect some thorn in the tangle of this think and disengage it find it to be this a woman have once accuse her of rob her of her daughter s affection something mrs doyle have say make her remember that charge again
783,"Wishing to dominate, wishing to interfere, making people do what she wishedthat was the charge against her, and she thought it most unjust.",wish to dominate wish to interfere make people do what she wishedthat be the charge against her and she think it much unjust
784,"How could she help being ""like that"" to look at?",how can she help be like that to look at
785,No one could accuse her of taking pains to impress.,no one can accuse her of take pain to impress
786,She was often ashamed of her own shabbiness.,she be often ashamed of her own shabbiness
787,"Nor was she domineering, nor was she tyrannical.",nor be she domineer nor be she tyrannical
788,It was more true about hospitals and drains and the dairy.,it be much true about hospital and drain and the dairy
789,"About things like that she did feel passionately, and would, if she had the chance, have liked to take people by the scruff of their necks and make them see.",about thing like that she do feel passionately and would if she have the chance have like to take people by the scruff of their neck and make them see
790,No hospital on the whole island.,no hospital on the whole island
791,It was a disgrace.,it be a disgrace
792,Milk delivered at your door in London positively brown with dirt.,milk deliver at your door in london positively brown with dirt
793,It should be made illegal.,it should be make illegal
794,"A model dairy and a hospital up herethose two things she would have liked to do, herself.",a model dairy and a hospital up herethose two thing she would have like to do herself
795,But how?,but how
796,With all these children?,with all this child
797,"When they were older, then perhaps she would have time; when they were all at school.",when they be old then perhaps she would have time when they be all at school
798,"Oh, but she never wanted James to grow a day older!",oh but she never want james to grow a day old
799,or Cam either.,or cam either
800,"These two she would have liked to keep for ever just as they were, demons of wickedness, angels of delight, never to see them grow up into long-legged monsters.",this two she would have like to keep for ever just a they be demon of wickedness angel of delight never to see them grow up into long leg monster
801,Nothing made up up for the loss.,nothing make up up for the loss
802,"When she read just now to James, ""and there were numbers of soldiers with kettledrums and trumpets,"" and his eyes darkened, she thought, why should they grow up and lose all that?",when she read just now to james and there be number of soldier with kettledrum and trumpet and his eye darken she think why should they grow up and lose all that
803,"He was the most gifted, the most sensitive of her children.",he be the much gift the much sensitive of her child
804,"But all, she thought, were full of promise.",but all she think be full of promise
805,"Prue, a perfect angel with the others, and sometimes now, at night especially, she took one's breath away with her beauty.",prue a perfect angel with the other and sometimes now at night especially she take one s breath away with her beauty
806,Andreweven her husband admitted that his gift for mathematics was extraordinary.,andreweven her husband admit that his gift for mathematics be extraordinary
807,"And Nancy and Roger, they were both wild creatures now, scampering about over the country all day long.",and nancy and roger they be both wild creature now scamper about over the country all day long
808,"As for Rose, her mouth was too big, but she had a wonderful gift with her hands.",a for rise her mouth be too big but she have a wonderful gift with her hand
809,"If they had charades, Rose made the dresses; made everything; liked best arranging tables, flowers, anything.",if they have charade rise make the dress make everything like well arrange table flower anything
810,She did not like it that Jasper should shoot birds; but it was only a stage; they all went through stages.,she do not like it that jasper should shoot bird but it be only a stage they all go through stage
811,"Why, she asked, pressing her chin on James's head, should they grow up so fast?",why she ask press her chin on james s head should they grow up so fast
812,Why should they go to school?,why should they go to school
813,She would have liked always to have had a baby.,she would have like always to have have a baby
814,She was happiest carrying one in her arms.,she be happy carry one in her arm
815,"Then people might say she was tyrannical, domineering, masterful, if they chose; she did not mind.",then people may say she be tyrannical domineer masterful if they choose she do not mind
816,"And, touching his hair with her lips, she thought, he will never be so happy again, but stopped herself, remembering how it angered her husband that she should say that.",and touch his hair with her lip she think he will never be so happy again but stop herself remember how it anger her husband that she should say that
817,"Still, it was true.",still it be true
818,They were happier now than they would ever be again.,they be happy now than they would ever be again
