,text_raw,text_clean
0,Once upon a time and a very good time it was there was a moocow coming down along the road and this moocow that was coming down along the road met a nicens little boy named baby tuckoo...,once upon a time and a very good time it be there be a moocow come down along the road and this moocow that be come down along the road meet a nicens little boy name baby tuckoo
1,His father told him that story: his father looked at him through a glass: he had a hairy face.,his father tell him that story his father look at him through a glass he have a hairy face
2,He was baby tuckoo.,he be baby tuckoo
3,The moocow came down the road where Betty Byrne lived: she sold lemon platt.,the moocow come down the road where betty byrne live she sell lemon platt
4,"O, the wild rose blossoms     On the little green place.",o the wild rise blossom on the little green place
5,He sang that song.,he sing that song
6,That was his song.,that be his song
7,"O, the green wothe botheth.",o the green wothe botheth
8,When you wet the bed first it is warm then it gets cold.,when you wet the bed ﻿1 it be warm then it get cold
9,His mother put on the oilsheet.,his mother put on the oilsheet
10,That had the queer smell.,that have the queer smell
11,His mother had a nicer smell than his father.,his mother have a nice smell than his father
12,She played on the piano the sailor's hornpipe for him to dance.,she play on the piano the sailor s hornpipe for him to dance
13,He danced:,he dance
14,"Tralala lala,     Tralala tralaladdy,     Tralala lala,     Tralala lala.",tralala lala tralala tralaladdy tralala lala tralala lala
15,Uncle Charles and Dante clapped.,uncle charles and dante clap
16,They were older than his father and mother but uncle Charles was older than Dante.,they be old than his father and mother but uncle charles be old than dante
17,Dante had two brushes in her press.,dante have two brush in her press
18,The brush with the maroon velvet back was for Michael Davitt and the brush with the green velvet back was for Parnell.,the brush with the maroon velvet back be for michael davitt and the brush with the green velvet back be for parnell
19,Dante gave him a cachou every time he brought her a piece of tissue paper.,dante give him a cachou every time he bring her a piece of tissue paper
20,The Vances lived in number seven.,the vances live in numb seven
21,They had a different father and mother.,they have a different father and mother
22,They were Eileen's father and mother.,they be eileen s father and mother
23,When they were grown up he was going to marry Eileen.,when they be grow up he be go to marry eileen
24,He hid under the table.,he hide under the table
25,His mother said:,his mother say
26,"O, Stephen will apologize.",o stephen will apologize
27,Dante said:,dante say
28,"O, if not, the eagles will come and pull out his eyes.",o if not the eagle will come and pull out his eye
29,"Pull out his eyes,     Apologize,     Apologize,     Pull out his eyes.",pull out his eye apologize apologize pull out his eye
30,"Apologize,     Pull out his eyes,     Pull out his eyes,     Apologize.",apologize pull out his eye pull out his eye apologize
31,The wide playgrounds were swarming with boys.,the wide playground be swarm with boy
32,All were shouting and the prefects urged them on with strong cries.,all be shout and the prefect urge them on with strong cry
33,The evening air was pale and chilly and after every charge and thud of the footballers the greasy leather orb flew like a heavy bird through the grey light.,the even air be pale and chilly and after every charge and thud of the footballer the greasy leather orb fly like a heavy bird through the grey light
34,"He kept on the fringe of his line, out of sight of his prefect, out of the reach of the rude feet, feigning to run now and then.",he keep on the fringe of his line out of sight of his prefect out of the reach of the rude foot feign to run now and then
35,He felt his body small and weak amid the throng of the players and his eyes were weak and watery.,he feel his body small and weak amid the throng of the player and his eye be weak and watery
36,Rody Kickham was not like that: he would be captain of the third line all the fellows said.,rody kickham be not like that he would be captain of the 3 line all the fellow say
37,Rody Kickham was a decent fellow but Nasty Roche was a stink.,rody kickham be a decent fellow but nasty roche be a stink
38,Rody Kickham had greaves in his number and a hamper in the refectory.,rody kickham have greaves in his numb and a hamper in the refectory
39,Nasty Roche had big hands.,nasty roche have big hand
40,He called the Friday pudding dog-in-the-blanket.,he call the friday pudding dog in the blanket
41,And one day he had asked:,and one day he have ask
42,What is your name?,what be your name
43,Stephen had answered: Stephen Dedalus.,stephen have answer stephen dedalus
44,Then Nasty Roche had said:,then nasty roche have say
45,What kind of a name is that?,what kind of a name be that
46,And when Stephen had not been able to answer Nasty Roche had asked:,and when stephen have not be able to answer nasty roche have ask
47,What is your father?,what be your father
48,Stephen had answered:,stephen have answer
49,A gentleman.,a gentleman
50,Then Nasty Roche had asked:,then nasty roche have ask
51,Is he a magistrate?,be he a magistrate
52,"He crept about from point to point on the fringe of his line, making little runs now and then.",he creep about from point to point on the fringe of his line make little run now and then
53,But his hands were bluish with cold.,but his hand be bluish with cold
54,He kept his hands in the side pockets of his belted grey suit.,he keep his hand in the side pocket of his belt grey suit
55,That was a belt round his pocket.,that be a belt round his pocket
56,And belt was also to give a fellow a belt.,and belt be also to give a fellow a belt
57,One day a fellow said to Cantwell:,one day a fellow say to cantwell
58,I'd give you such a belt in a second.,i would give you such a belt in a 2
59,Cantwell had answered:,cantwell have answer
60,Go and fight your match.,go and fight your match
61,Give Cecil Thunder a belt.,give cecil thunder a belt
62,I'd like to see you.,i would like to see you
63,He'd give you a toe in the rump for yourself.,he would give you a toe in the rump for yourself
64,That was not a nice expression.,that be not a nice expression
65,His mother had told him not to speak with the rough boys in the college.,his mother have tell him not to speak with the rough boy in the college
66,Nice mother!,nice mother
67,The first day in the hall of the castle when she had said goodbye she had put up her veil double to her nose to kiss him: and her nose and eyes were red.,the ﻿1 day in the hall of the castle when she have say goodbye she have put up her veil double to her nose to kiss him and her nose and eye be red
68,But he had pretended not to see that she was going to cry.,but he have pretend not to see that she be go to cry
69,She was a nice mother but she was not so nice when she cried.,she be a nice mother but she be not so nice when she cry
70,And his father had given him two five-shilling pieces for pocket money.,and his father have give him two five shilling piece for pocket money
71,"And his father had told him if he wanted anything to write home to him and, whatever he did, never to peach on a fellow.",and his father have tell him if he want anything to write home to him and whatever he do never to peach on a fellow
72,"Then at the door of the castle the rector had shaken hands with his father and mother, his soutane fluttering in the breeze, and the car had driven off with his father and mother on it.",then at the door of the castle the rector have shake hand with his father and mother his soutane flutter in the breeze and the car have drive off with his father and mother on it
73,"They had cried to him from the car, waving their hands:",they have cry to him from the car wave their hand
74,"Goodbye, Stephen, goodbye!",goodbye stephen goodbye
75,"Goodbye, Stephen, goodbye!",goodbye stephen goodbye
76,"He was caught in the whirl of a scrimmage and, fearful of the flashing eyes and muddy boots, bent down to look through the legs.",he be catch in the whirl of a scrimmage and fearful of the flash eye and muddy boot bend down to look through the leg
77,The fellows were struggling and groaning and their legs were rubbing and kicking and stamping.,the fellow be struggle and groan and their leg be rub and kick and stamp
78,Then Jack Lawton's yellow boots dodged out the ball and all the other boots and legs ran after.,then jack lawton s yellow boot dodge out the ball and all the other boot and leg run after
79,He ran after them a little way and then stopped.,he run after them a little way and then stop
80,It was useless to run on.,it be useless to run on
81,Soon they would be going home for the holidays.,soon they would be go home for the holiday
82,After supper in the study hall he would change the number pasted up inside his desk from seventy-seven to seventy-six.,after supper in the study hall he would change the numb paste up inside his desk from seventy seven to seventy six
83,It would be better to be in the study hall than out there in the cold.,it would be well to be in the study hall than out there in the cold
84,The sky was pale and cold but there were lights in the castle.,the sky be pale and cold but there be light in the castle
85,He wondered from which window Hamilton Rowan had thrown his hat on the ha-ha and had there been flowerbeds at that time under the windows.,he wonder from which window hamilton rowan have throw his hat on the ha ha and have there be flowerbed at that time under the window
86,One day when he had been called to the castle the butler had shown him the marks of the soldiers' slugs in the wood of the door and had given him a piece of shortbread that the community ate.,one day when he have be call to the castle the butler have show him the mark of the soldier slug in the wood of the door and have give him a piece of shortbread that the community eat
87,It was nice and warm to see the lights in the castle.,it be nice and warm to see the light in the castle
88,It was like something in a book.,it be like something in a book
89,Perhaps Leicester Abbey was like that.,perhaps leicester abbey be like that
90,And there were nice sentences in Doctor Cornwell's Spelling Book.,and there be nice sentence in doctor cornwell s spell book
91,They were like poetry but they were only sentences to learn the spelling from.,they be like poetry but they be only sentence to learn the spell from
92,Wolsey died in Leicester Abbey     Where the abbots buried him.,wolsey die in leicester abbey where the abbot bury him
93,"Canker is a disease of plants,     Cancer one of animals.",canker be a disease of plant cancer one of animal
94,"It would be nice to lie on the hearthrug before the fire, leaning his head upon his hands, and think on those sentences.",it would be nice to lie on the hearthrug before the fire lean his head upon his hand and think on that sentence
95,He shivered as if he had cold slimy water next his skin.,he shiver a if he have cold slimy water next his skin
96,"That was mean of Wells to shoulder him into the square ditch because he would not swop his little snuff box for Wells's seasoned hacking chestnut, the conqueror of forty.",that be mean of well to shoulder him into the square ditch because he would not swop his little snuff box for well s season hack chestnut the conqueror of forty
97,How cold and slimy the water had been!,how cold and slimy the water have be
98,A fellow had once seen a big rat jump into the scum.,a fellow have once see a big rat jump into the scum
99,Mother was sitting at the fire with Dante waiting for Brigid to bring in the tea.,mother be sit at the fire with dante wait for brigid to bring in the tea
100,She had her feet on the fender and her jewelly slippers were so hot and they had such a lovely warm smell!,she have her foot on the fender and her jewelly slipper be so hot and they have such a lovely warm smell
101,Dante knew a lot of things.,dante know a lot of thing
102,She had taught him where the Mozambique Channel was and what was the longest river in America and what was the name of the highest mountain in the moon.,she have teach him where the mozambique channel be and what be the long river in america and what be the name of the high mountain in the moon
103,Father Arnall knew more than Dante because he was a priest but both his father and uncle Charles said that Dante was a clever woman and a well-read woman.,father arnall know much than dante because he be a priest but both his father and uncle charles say that dante be a clever woman and a good read woman
104,And when Dante made that noise after dinner and then put up her hand to her mouth: that was heartburn.,and when dante make that noise after dinner and then put up her hand to her mouth that be heartburn
105,A voice cried far out on the playground:,a voice cry far out on the playground
106,Then other voices cried from the lower and third lines:,then other voice cry from the low and 3 line
107,All in!,all in
108,All in!,all in
109,"The players closed around, flushed and muddy, and he went among them, glad to go in.",the player close around flush and muddy and he go among them glad to go in
110,Rody Kickham held the ball by its greasy lace.,rody kickham hold the ball by its greasy lace
111,A fellow asked him to give it one last: but he walked on without even answering the fellow.,a fellow ask him to give it one last but he walk on without even answer the fellow
112,Simon Moonan told him not to because the prefect was looking.,simon moonan tell him not to because the prefect be look
113,The fellow turned to Simon Moonan and said:,the fellow turn to simon moonan and say
114,We all know why you speak.,we all know why you speak
115,You are McGlade's suck.,you be mcglade s suck
116,Suck was a queer word.,suck be a queer word
117,The fellow called Simon Moonan that name because Simon Moonan used to tie the prefect's false sleeves behind his back and the prefect used to let on to be angry.,the fellow call simon moonan that name because simon moonan use to tie the prefect s false sleeve behind his back and the prefect use to let on to be angry
118,But the sound was ugly.,but the sound be ugly
119,Once he had washed his hands in the lavatory of the Wicklow Hotel and his father pulled the stopper up by the chain after and the dirty water went down through the hole in the basin.,once he have wash his hand in the lavatory of the wicklow hotel and his father pull the stopper up by the chain after and the dirty water go down through the hole in the basin
120,And when it had all gone down slowly the hole in the basin had made a sound like that: suck.,and when it have all go down slowly the hole in the basin have make a sound like that suck
121,Only louder.,only loud
122,To remember that and the white look of the lavatory made him feel cold and then hot.,to remember that and the white look of the lavatory make him feel cold and then hot
123,There were two cocks that you turned and water came out: cold and hot.,there be two cock that you turn and water come out cold and hot
124,He felt cold and then a little hot: and he could see the names printed on the cocks.,he feel cold and then a little hot and he can see the name print on the cock
125,That was a very queer thing.,that be a very queer thing
126,And the air in the corridor chilled him too.,and the air in the corridor chill him too
127,It was queer and wettish.,it be queer and wettish
128,But soon the gas would be lit and in burning it made a light noise like a little song.,but soon the gas would be light and in burn it make a light noise like a little song
129,Always the same: and when the fellows stopped talking in the playroom you could hear it.,always the same and when the fellow stop talk in the playroom you can hear it
130,It was the hour for sums.,it be the hour for sum
131,Father Arnall wrote a hard sum on the board and then said:,father arnall write a hard sum on the board and then say
132,"Now then, who will win?",now then who will win
133,"Go ahead, York!",go ahead york
134,"Go ahead, Lancaster!",go ahead lancaster
135,"Stephen tried his best, but the sum was too hard and he felt confused.",stephen try his well but the sum be too hard and he feel confuse
136,The little silk badge with the white rose on it that was pinned on the breast of his jacket began to flutter.,the little silk badge with the white rise on it that be pin on the breast of his jacket begin to flutter
137,"He was no good at sums, but he tried his best so that York might not lose.",he be no good at sum but he try his well so that york may not lose
138,"Father Arnall's face looked very black, but he was not in a wax: he was laughing.",father arnall s face look very black but he be not in a wax he be laugh
139,Then Jack Lawton cracked his fingers and Father Arnall looked at his copybook and said:,then jack lawton crack his finger and father arnall look at his copybook and say
140,Right.,right
141,Bravo Lancaster!,bravo lancaster
142,The red rose wins.,the red rise win
143,"Come on now, York!",come on now york
144,Forge ahead!,forge ahead
145,Jack Lawton looked over from his side.,jack lawton look over from his side
146,The little silk badge with the red rose on it looked very rich because he had a blue sailor top on.,the little silk badge with the red rise on it look very rich because he have a blue sailor top on
147,"Stephen felt his own face red too, thinking of all the bets about who would get first place in elements, Jack Lawton or he.",stephen feel his own face red too think of all the bet about who would get ﻿1 place in element jack lawton or he
148,Some weeks Jack Lawton got the card for first and some weeks he got the card for first.,some week jack lawton get the card for ﻿1 and some week he get the card for ﻿1
149,His white silk badge fluttered and fluttered as he worked at the next sum and heard Father Arnall's voice.,his white silk badge flutter and flutter a he work at the next sum and hear father arnall s voice
150,Then all his eagerness passed away and he felt his face quite cool.,then all his eagerness pass away and he feel his face quite cool
151,He thought his face must be white because it felt so cool.,he think his face must be white because it feel so cool
152,He could not get out the answer for the sum but it did not matter.,he can not get out the answer for the sum but it do not matt
153,White roses and red roses: those were beautiful colours to think of.,white rose and red rose that be beautiful colour to think of
154,And the cards for first place and second place and third place were beautiful colours too: pink and cream and lavender.,and the card for ﻿1 place and 2 place and 3 place be beautiful colour too pink and cream and lavender
155,Lavender and cream and pink roses were beautiful to think of.,lavender and cream and pink rose be beautiful to think of
156,Perhaps a wild rose might be like those colours and he remembered the song about the wild rose blossoms on the little green place.,perhaps a wild rise may be like that colour and he remember the song about the wild rise blossom on the little green place
157,But you could not have a green rose.,but you can not have a green rise
158,But perhaps somewhere in the world you could.,but perhaps somewhere in the world you can
159,The bell rang and then the classes began to file out of the rooms and along the corridors towards the refectory.,the bell ring and then the class begin to file out of the room and along the corridor towards the refectory
160,He sat looking at the two prints of butter on his plate but could not eat the damp bread.,he sit look at the two print of butter on his plate but can not eat the damp bread
161,The tablecloth was damp and limp.,the tablecloth be damp and limp
162,"But he drank off the hot weak tea which the clumsy scullion, girt with a white apron, poured into his cup.",but he drink off the hot weak tea which the clumsy scullion gird with a white apron pour into his cup
163,He wondered whether the scullion's apron was damp too or whether all white things were cold and damp.,he wonder whether the scullion s apron be damp too or whether all white thing be cold and damp
164,Nasty Roche and Saurin drank cocoa that their people sent them in tins.,nasty roche and saurin drink cocoa that their people send them in tin
165,They said they could not drink the tea; that it was hogwash.,they say they can not drink the tea that it be hogwash
166,"Their fathers were magistrates, the fellows said.",their father be magistrate the fellow say
167,All the boys seemed to him very strange.,all the boy seem to him very strange
168,They had all fathers and mothers and different clothes and voices.,they have all father and mother and different clothe and voice
169,He longed to be at home and lay his head on his mother's lap.,he long to be at home and lie his head on his mother s lap
170,But he could not: and so he longed for the play and study and prayers to be over and to be in bed.,but he can not and so he long for the play and study and prayer to be over and to be in bed
171,He drank another cup of hot tea and Fleming said:,he drink another cup of hot tea and fleming say
172,What's up?,what be up
173,Have you a pain or what's up with you?,have you a pain or what be up with you
174,"I don't know, Stephen said.",i do not know stephen say
175,"Sick in your breadbasket, Fleming said, because your face looks white.",sick in your breadbasket fleming say because your face look white
176,It will go away.,it will go away
177,"O yes, Stephen said.",o yes stephen say
178,But he was not sick there.,but he be not sick there
179,He thought that he was sick in his heart if you could be sick in that place.,he think that he be sick in his heart if you can be sick in that place
180,Fleming was very decent to ask him.,fleming be very decent to ask him
181,He wanted to cry.,he want to cry
182,He leaned his elbows on the table and shut and opened the flaps of his ears.,he lean his elbow on the table and shut and open the flap of his ear
183,Then he heard the noise of the refectory every time he opened the flaps of his ears.,then he hear the noise of the refectory every time he open the flap of his ear
184,It made a roar like a train at night.,it make a roar like a train at night
185,And when he closed the flaps the roar was shut off like a train going into a tunnel.,and when he close the flap the roar be shut off like a train go into a tunnel
186,"That night at Dalkey the train had roared like that and then, when it went into the tunnel, the roar stopped.",that night at dalkey the train have roar like that and then when it go into the tunnel the roar stop
187,"He closed his eyes and the train went on, roaring and then stopping; roaring again, stopping.",he close his eye and the train go on roar and then stop roar again stop
188,It was nice to hear it roar and stop and then roar out of the tunnel again and then stop.,it be nice to hear it roar and stop and then roar out of the tunnel again and then stop
189,"Then the higher line fellows began to come down along the matting in the middle of the refectory, Paddy Rath and Jimmy Magee and the Spaniard who was allowed to smoke cigars and the little Portuguese who wore the woolly cap.",then the high line fellow begin to come down along the mat in the middle of the refectory paddy rath and jimmy magee and the spaniard who be allow to smoke cigar and the little portuguese who wear the woolly cap
190,And then the lower line tables and the tables of the third line.,and then the low line table and the table of the 3 line
191,And every single fellow had a different way of walking.,and every single fellow have a different way of walk
192,He sat in a corner of the playroom pretending to watch a game of dominoes and once or twice he was able to hear for an instant the little song of the gas.,he sit in a corner of the playroom pretend to watch a game of domino and once or twice he be able to hear for a instant the little song of the gas
193,The prefect was at the door with some boys and Simon Moonan was knotting his false sleeves.,the prefect be at the door with some boy and simon moonan be knot his false sleeve
194,He was telling them something about Tullabeg.,he be tell them something about tullabeg
195,Then he went away from the door and Wells came over to Stephen and said:,then he go away from the door and well come over to stephen and say
196,"Tell us, Dedalus, do you kiss your mother before you go to bed?",tell us dedalus do you kiss your mother before you go to bed
197,Stephen answered:,stephen answer
198,Wells turned to the other fellows and said:,well turn to the other fellow and say
199,"O, I say, here's a fellow says he kisses his mother every night before he goes to bed.",o i say here be a fellow say he kiss his mother every night before he go to bed
200,"The other fellows stopped their game and turned round, laughing.",the other fellow stop their game and turn round laugh
201,Stephen blushed under their eyes and said:,stephen blush under their eye and say
202,Wells said:,well say
203,"O, I say, here's a fellow says he doesn't kiss his mother before he goes to bed.",o i say here be a fellow say he doe not kiss his mother before he go to bed
204,They all laughed again.,they all laugh again
205,Stephen tried to laugh with them.,stephen try to laugh with them
206,He felt his whole body hot and confused in a moment.,he feel his whole body hot and confuse in a moment
207,What was the right answer to the question?,what be the right answer to the question
208,He had given two and still Wells laughed.,he have give two and still well laugh
