,text_raw,text_clean
2817,What mind of man can understand it?,what mind of man can understand it
2818,"And remember, it is an eternity of pain.",and remember it be a eternity of pain
2819,"Even though the pains of hell were not so terrible as they are, yet they would become infinite, as they are destined to last for ever.",even though the pain of hell be not so terrible a they be yet they would become infinite a they be destine to last for ever
2820,"But while they are everlasting they are at the same time, as you know, intolerably intense, unbearably extensive.",but while they be everlasting they be at the same time a you know intolerably intense unbearably extensive
2821,To bear even the sting of an insect for all eternity would be a dreadful torment.,to bear even the sting of a insect for all eternity would be a dreadful torment
2822,"What must it be, then, to bear the manifold tortures of hell for ever?",what must it be then to bear the manifold torture of hell for ever
2823,For ever!,for ever
2824,For all eternity!,for all eternity
2825,Not for a year or for an age but for ever.,not for a year or for a age but for ever
2826,Try to imagine the awful meaning of this.,try to imagine the awful mean of this
2827,You have often seen the sand on the seashore.,you have often see the sand on the seashore
2828,How fine are its tiny grains!,how fine be its tiny grain
2829,And how many of those tiny little grains go to make up the small handful which a child grasps in its play.,and how many of that tiny little grain go to make up the small handful which a child grasp in its play
2830,"Now imagine a mountain of that sand, a million miles high, reaching from the earth to the farthest heavens, and a million miles broad, extending to remotest space, and a million miles in thickness; and imagine such an enormous mass of countless particles of sand multiplied as often as there are leaves in the forest, drops of water in the mighty ocean, feathers on birds, scales on fish, hairs on animals, atoms in the vast expanse of the air: and imagine that at the end of every million years a little bird came to that mountain and carried away in its beak a tiny grain of that sand.",now imagine a mountain of that sand a million mile high reach from the earth to the far heaven and a million mile broad extend to remote space and a million mile in thickness and imagine such a enormous mass of countless particle of sand multiply a often a there be leave in the forest drop of water in the mighty ocean feather on bird scale on fish hair on animal atom in the vast expanse of the air and imagine that at the end of every million year a little bird come to that mountain and carry away in its beak a tiny grain of that sand
2831,"How many millions upon millions of centuries would pass before that bird had carried away even a square foot of that mountain, how many eons upon eons of ages before it had carried away all?",how many million upon million of century would pass before that bird have carry away even a square foot of that mountain how many eon upon eon of age before it have carry away all
2832,Yet at the end of that immense stretch of time not even one instant of eternity could be said to have ended.,yet at the end of that immense stretch of time not even one instant of eternity can be say to have end
2833,At the end of all those billions and trillions of years eternity would have scarcely begun.,at the end of all that billion and trillion of year eternity would have scarcely begin
2834,"And if that mountain rose again after it had been all carried away, and if the bird came again and carried it all away again grain by grain, and if it so rose and sank as many times as there are stars in the sky, atoms in the air, drops of water in the sea, leaves on the trees, feathers upon birds, scales upon fish, hairs upon animals, at the end of all those innumerable risings and sinkings of that immeasurably vast mountain not one single instant of eternity could be said to have ended; even then, at the end of such a period, after that eon of time the mere thought of which makes our very brain reel dizzily, eternity would scarcely have begun.",and if that mountain rise again after it have be all carry away and if the bird come again and carry it all away again grain by grain and if it so rise and sink a many time a there be star in the sky atom in the air drop of water in the sea leave on the tree feather upon bird scale upon fish hair upon animal at the end of all that innumerable rising and sinkings of that immeasurably vast mountain not one single instant of eternity can be say to have end even then at the end of such a period after that eon of time the mere think of which make our very brain reel dizzily eternity would scarcely have begin
2835,A holy saint (one of our own fathers I believe it was) was once vouchsafed a vision of hell.,a holy saint one of our own father i believe it be be once vouchsafe a vision of hell
2836,"It seemed to him that he stood in the midst of a great hall, dark and silent save for the ticking of a great clock.",it seem to him that he stand in the midst of a great hall dark and silent save for the tick of a great clock
2837,"The ticking went on unceasingly; and it seemed to this saint that the sound of the ticking was the ceaseless repetition of the wordsever, never; ever, never.",the tick go on unceasingly and it seem to this saint that the sound of the tick be the ceaseless repetition of the wordsever never ever never
2838,"Ever to be in hell, never to be in heaven; ever to be shut off from the presence of God, never to enjoy the beatific vision; ever to be eaten with flames, gnawed by vermin, goaded with burning spikes, never to be free from those pains; ever to have the conscience upbraid one, the memory enrage, the mind filled with darkness and despair, never to escape; ever to curse and revile the foul demons who gloat fiendishly over the misery of their dupes, never to behold the shining raiment of the blessed spirits; ever to cry out of the abyss of fire to God for an instant, a single instant, of respite from such awful agony, never to receive, even for an instant, God's pardon; ever to suffer, never to enjoy; ever to be damned, never to be saved; ever, never; ever, never.",ever to be in hell never to be in heaven ever to be shut off from the presence of god never to enjoy the beatific vision ever to be eat with flame gnaw by vermin goad with burn spike never to be free from that pain ever to have the conscience upbraid one the memory enrage the mind fill with darkness and despair never to escape ever to curse and revile the foul demon who gloat fiendishly over the misery of their dupe never to behold the shine raiment of the bless spirit ever to cry out of the abyss of fire to god for a instant a single instant of respite from such awful agony never to receive even for a instant god s pardon ever to suffer never to enjoy ever to be damn never to be save ever never ever never
2839,"O, what a dreadful punishment!",o what a dreadful punishment
2840,"An eternity of endless agony, of endless bodily and spiritual torment, without one ray of hope, without one moment of cessation, of agony limitless in intensity, of torment infinitely varied, of torture that sustains eternally that which it eternally devours, of anguish that everlastingly preys upon the spirit while it racks the flesh, an eternity, every instant of which is itself an eternity of woe.",a eternity of endless agony of endless bodily and spiritual torment without one ray of hope without one moment of cessation of agony limitless in intensity of torment infinitely vary of torture that sustain eternally that which it eternally devour of anguish that everlastingly prey upon the spirit while it rack the flesh a eternity every instant of which be itself a eternity of woe
2841,Such is the terrible punishment decreed for those who die in mortal sin by an almighty and a just God.,such be the terrible punishment decree for that who die in mortal sin by a almighty and a just god
2842,"Yes, a just God!",yes a just god
2843,"Men, reasoning always as men, are astonished that God should mete out an everlasting and infinite punishment in the fires of hell for a single grievous sin.",man reason always a man be astonish that god should mete out a everlasting and infinite punishment in the fire of hell for a single grievous sin
2844,"They reason thus because, blinded by the gross illusion of the flesh and the darkness of human understanding, they are unable to comprehend the hideous malice of mortal sin.",they reason thus because blind by the gross illusion of the flesh and the darkness of human understand they be unable to comprehend the hideous malice of mortal sin
2845,"They reason thus because they are unable to comprehend that even venial sin is of such a foul and hideous nature that even if the omnipotent Creator could end all the evil and misery in the world, the wars, the diseases, the robberies, the crimes, the deaths, the murders, on condition that he allowed a single venial sin to pass unpunished, a single venial sin, a lie, an angry look, a moment of wilful sloth, He, the great omnipotent God could not do so because sin, be it in thought or deed, is a transgression of His law and God would not be God if He did not punish the transgressor.",they reason thus because they be unable to comprehend that even venial sin be of such a foul and hideous nature that even if the omnipotent creator can end all the evil and misery in the world the war the disease the robbery the crime the death the murder on condition that he allow a single venial sin to pass unpunished a single venial sin a lie a angry look a moment of wilful sloth he the great omnipotent god can not do so because sin be it in think or deed be a transgression of his law and god would not be god if he do not punish the transgressor
2846,"A sin, an instant of rebellious pride of the intellect, made Lucifer and a third part of the cohort of angels fall from their glory.",a sin a instant of rebellious pride of the intellect make lucifer and a 3 part of the cohort of angel fall from their glory
2847,"A sin, an instant of folly and weakness, drove Adam and Eve out of Eden and brought death and suffering into the world.",a sin a instant of folly and weakness drive adam and eve out of eden and bring death and suffer into the world
2848,"To retrieve the consequences of that sin the Only Begotten Son of God came down to earth, lived and suffered and died a most painful death, hanging for three hours on the cross.",to retrieve the consequence of that sin the only beget son of god come down to earth live and suffer and die a much painful death hang for three hour on the cross
2849,"O, my dear little brethren in Christ Jesus, will we then offend that good Redeemer and provoke His anger?",o my dear little brother in christ jesus will we then offend that good redeemer and provoke his anger
2850,Will we trample again upon that torn and mangled corpse?,will we trample again upon that tear and mangle corpse
2851,Will we spit upon that face so full of sorrow and love?,will we spit upon that face so full of sorrow and love
2852,"Will we too, like the cruel jews and the brutal soldiers, mock that gentle and compassionate Saviour Who trod alone for our sake the awful wine-press of sorrow?",will we too like the cruel jews and the brutal soldier mock that gentle and compassionate saviour who tread alone for our sake the awful wine press of sorrow
2853,Every word of sin is a wound in His tender side.,every word of sin be a wind in his tender side
2854,Every sinful act is a thorn piercing His head.,every sinful act be a thorn pierce his head
2855,"Every impure thought, deliberately yielded to, is a keen lance transfixing that sacred and loving heart.",every impure think deliberately yield to be a keen lance transfix that sacred and love heart
2856,"No, no.",no no
2857,"It is impossible for any human being to do that which offends so deeply the divine majesty, that which is punished by an eternity of agony, that which crucifies again the Son of God and makes a mockery of Him.",it be impossible for any human be to do that which offend so deeply the divine majesty that which be punish by a eternity of agony that which crucify again the son of god and make a mockery of him
2858,"I pray to God that my poor words may have availed today to confirm in holiness those who are in a state of grace, to strengthen the wavering, to lead back to the state of grace the poor soul that has strayed if any such be among you.",i pray to god that my poor word may have avail today to confirm in holiness that who be in a state of grace to strengthen the waver to lead back to the state of grace the poor soul that have stray if any such be among you
2859,"I pray to God, and do you pray with me, that we may repent of our sins.",i pray to god and do you pray with me that we may repent of our sin
2860,"I will ask you now, all of you, to repeat after me the act of contrition, kneeling here in this humble chapel in the presence of God.",i will ask you now all of you to repeat after me the act of contrition kneel here in this humble chapel in the presence of god
2861,"He is there in the tabernacle burning with love for mankind, ready to comfort the afflicted.",he be there in the tabernacle burn with love for mankind ready to comfort the afflict
2862,Be not afraid.,be not afraid
2863,No matter how many or how foul the sins if you only repent of them they will be forgiven you.,no matt how many or how foul the sin if you only repent of them they will be forgive you
2864,Let no worldly shame hold you back.,let no worldly shame hold you back
2865,God is still the merciful Lord who wishes not the eternal death of the sinner but rather that he be converted and live.,god be still the merciful lord who wish not the eternal death of the sinner but rather that he be convert and live
2866,He calls you to Him.,he call you to him
2867,You are His.,you be his
2868,He made you out of nothing.,he make you out of nothing
2869,He loved you as only a God can love.,he love you a only a god can love
2870,His arms are open to receive you even though you have sinned against Him.,his arm be open to receive you even though you have sin against him
2871,"Come to Him, poor sinner, poor vain and erring sinner.",come to him poor sinner poor vain and err sinner
2872,Now is the acceptable time.,now be the acceptable time
2873,Now is the hour.,now be the hour
2874,"The priest rose and, turning towards the altar, knelt upon the step before the tabernacle in the fallen gloom.",the priest rise and turn towards the altar kneel upon the step before the tabernacle in the fall gloom
2875,He waited till all in the chapel had knelt and every least noise was still.,he wait till all in the chapel have kneel and every little noise be still
2876,"Then, raising his head, he repeated the act of contrition, phrase by phrase, with fervour.",then raise his head he repeat the act of contrition phrase by phrase with fervour
2877,The boys answered him phrase by phrase.,the boy answer him phrase by phrase
2878,"Stephen, his tongue cleaving to his palate, bowed his head, praying with his heart.",stephen his tongue cleave to his palate bow his head pray with his heart
2879,O my God!,o my god
2880,O my God!,o my god
2881,"I am heartily sorry     I am heartily sorry     for having offended Thee     for having offended Thee     and I detest my sins     and I detest my sins     above every other evil     above every other evil     because they displease Thee, my God     because they displease Thee, my God     Who art so deserving     Who art so deserving     of all my love     of all my love     and I firmly purpose     and I firmly purpose     by Thy holy grace     by Thy holy grace     never more to offend Thee     never more to offend Thee     and to amend my life     and to amend my life",i be heartily sorry i be heartily sorry for have offend you for have offend you and i detest my sin and i detest my sin above every other evil above every other evil because they displease you my god because they displease you my god who art so deserve who art so deserve of all my love of all my love and i firmly purpose and i firmly purpose by thy holy grace by thy holy grace never much to offend you never much to offend you and to amend my life and to amend my life
2882,"He went up to his room after dinner in order to be alone with his soul, and at every step his soul seemed to sigh; at every step his soul mounted with his feet, sighing in the ascent, through a region of viscid gloom.",he go up to his room after dinner in order to be alone with his soul and at every step his soul seem to sigh at every step his soul mount with his foot sigh in the ascent through a region of viscid gloom
2883,"He halted on the landing before the door and then, grasping the porcelain knob, opened the door quickly.",he halt on the land before the door and then grasp the porcelain knob open the door quickly
2884,"He waited in fear, his soul pining within him, praying silently that death might not touch his brow as he passed over the threshold, that the fiends that inhabit darkness might not be given power over him.",he wait in fear his soul pine within him pray silently that death may not touch his brow a he pass over the threshold that the fiend that inhabit darkness may not be give power over him
2885,He waited still at the threshold as at the entrance to some dark cave.,he wait still at the threshold a at the entrance to some dark cave
2886,Faces were there; eyes: they waited and watched.,face be there eye they wait and watch
2887,We knew perfectly well of course that though it was bound to come to the light he would find considerable difficulty in endeavouring to try to induce himself to try to endeavour to ascertain the spiritual plenipotentiary and so we knew of course perfectly well,we know perfectly good of course that though it be bind to come to the light he would find considerable difficulty in endeavour to try to induce himself to try to endeavour to ascertain the spiritual plenipotentiary and so we know of course perfectly good
2888,Murmuring faces waited and watched; murmurous voices filled the dark shell of the cave.,murmur face wait and watch murmurous voice fill the dark she will of the cave
2889,"He feared intensely in spirit and in flesh but, raising his head bravely, he strode into the room firmly.",he fear intensely in spirit and in flesh but raise his head bravely he stride into the room firmly
2890,"A doorway, a room, the same room, same window.",a doorway a room the same room same window
2891,He told himself calmly that those words had absolutely no sense which had seemed to rise murmurously from the dark.,he tell himself calmly that that word have absolutely no sense which have seem to rise murmurously from the dark
2892,He told himself that it was simply his room with the door open.,he tell himself that it be simply his room with the door open
2893,"He closed the door and, walking swiftly to the bed, knelt beside it and covered his face with his hands.",he close the door and walk swiftly to the bed kneel beside it and cover his face with his hand
2894,His hands were cold and damp and his limbs ached with chill.,his hand be cold and damp and his limb ache with chill
2895,"Bodily unrest and chill and weariness beset him, routing his thoughts.",bodily unrest and chill and weariness beset him route his thought
2896,Why was he kneeling there like a child saying his evening prayers?,why be he kneel there like a child say his even prayer
2897,"To be alone with his soul, to examine his conscience, to meet his sins face to face, to recall their times and manners and circumstances, to weep over them.",to be alone with his soul to examine his conscience to meet his sin face to face to recall their time and manner and circumstance to weep over them
2898,He could not weep.,he can not weep
2899,He could not summon them to his memory.,he can not summon them to his memory
2900,"He felt only an ache of soul and body, his whole being, memory, will, understanding, flesh, benumbed and weary.",he feel only a ache of soul and body his whole be memory will understand flesh benumbed and weary
2901,"That was the work of devils, to scatter his thoughts and over-cloud his conscience, assailing him at the gates of the cowardly and sin-corrupted flesh: and, praying God timidly to forgive him his weakness, he crawled up on to the bed and, wrapping the blankets closely about him, covered his face again with his hands.",that be the work of devil to scatter his thought and over cloud his conscience assail him at the gate of the cowardly and sin corrupt flesh and pray god timidly to forgive him his weakness he crawl up on to the bed and wrap the blanket closely about him cover his face again with his hand
2902,He had sinned.,he have sin
2903,He had sinned so deeply against heaven and before God that he was not worthy to be called God's child.,he have sin so deeply against heaven and before god that he be not worthy to be call god s child
2904,"Could it be that he, Stephen Dedalus, had done those things?",can it be that he stephen dedalus have do that thing
2905,His conscience sighed in answer.,his conscience sigh in answer
2906,"Yes, he had done them, secretly, filthily, time after time, and, hardened in sinful impenitence, he had dared to wear the mask of holiness before the tabernacle itself while his soul within was a living mass of corruption.",yes he have do them secretly filthily time after time and harden in sinful impenitence he have dare to wear the mask of holiness before the tabernacle itself while his soul within be a live mass of corruption
2907,How came it that God had not struck him dead?,how come it that god have not strike him dead
2908,"The leprous company of his sins closed about him, breathing upon him, bending over him from all sides.",the leprous company of his sin close about him breathe upon him bend over him from all side
2909,"He strove to forget them in an act of prayer, huddling his limbs closer together and binding down his eyelids: but the senses of his soul would not be bound and, though his eyes were shut fast, he saw the places where he had sinned and, though his ears were tightly covered, he heard.",he strive to forget them in a act of prayer huddle his limb close together and bind down his eyelid but the sense of his soul would not be bind and though his eye be shut fast he see the place where he have sin and though his ear be tightly cover he hear
2910,He desired with all his will not to hear or see.,he desire with all his will not to hear or see
2911,He desired till his frame shook under the strain of his desire and until the senses of his soul closed.,he desire till his frame shake under the strain of his desire and until the sense of his soul close
2912,They closed for an instant and then opened.,they close for a instant and then open
2913,He saw.,he see
2914,A field of stiff weeds and thistles and tufted nettle-bunches.,a field of stiff weed and thistle and tufted nettle bunch
2915,Thick among the tufts of rank stiff growth lay battered canisters and clots and coils of solid excrement.,thick among the tuft of rank stiff growth lie batter canister and clot and coil of solid excrement
2916,A faint marshlight struggling upwards from all the ordure through the bristling grey-green weeds.,a faint marshlight struggle upwards from all the ordure through the bristle grey green weed
2917,"An evil smell, faint and foul as the light, curled upwards sluggishly out of the canisters and from the stale crusted dung.",a evil smell faint and foul a the light curl upwards sluggishly out of the canister and from the stale crust dung
2918,"Creatures were in the field: one, three, six: creatures were moving in the field, hither and thither.",creature be in the field one three six creature be move in the field hither and thither
2919,"Goatish creatures with human faces, hornybrowed, lightly bearded and grey as india-rubber.",goatish creature with human face hornybrowed lightly beard and grey a india rubber
2920,"The malice of evil glittered in their hard eyes, as they moved hither and thither, trailing their long tails behind them.",the malice of evil glitter in their hard eye a they move hither and thither trail their long tail behind them
2921,A rictus of cruel malignity lit up greyly their old bony faces.,a rictus of cruel malignity light up greyly their old bony face
2922,"One was clasping about his ribs a torn flannel waistcoat, another complained monotonously as his beard stuck in the tufted weeds.",one be clasp about his rib a tear flannel waistcoat another complain monotonously a his beard stick in the tufted weed
2923,"Soft language issued from their spittleless lips as they swished in slow circles round and round the field, winding hither and thither through the weeds, dragging their long tails amid the rattling canisters.",soft language issue from their spittleless lip a they swish in slow circle round and round the field wind hither and thither through the weed drag their long tail amid the rattle canister
2924,"They moved in slow circles, circling closer and closer to enclose, to enclose, soft language issuing from their lips, their long swishing tails besmeared with stale shite, thrusting upwards their terrific faces...",they move in slow circle circle close and close to enclose to enclose soft language issue from their lip their long swish tail besmeared with stale shite thrust upwards their terrific face
2925,He flung the blankets from him madly to free his face and neck.,he fling the blanket from him madly to free his face and neck
2926,That was his hell.,that be his hell
