,text_raw,text_clean
3767,"Nay, his very soul had waxed old in that service without growing towards light and beauty or spreading abroad a sweet odour of her sanctitya mortified will no more responsive to the thrill of its obedience than was to the thrill of love or combat his ageing body, spare and sinewy, greyed with a silver-pointed down.",nay his very soul have wax old in that service without grow towards light and beauty or spread abroad a sweet odour of her sanctitya mortify will no much responsive to the thrill of its obedience than be to the thrill of love or combat his age body spare and sinewy grey with a silver point down
3768,The dean rested back on his hunkers and watched the sticks catch.,the dean rest back on his hunker and watch the stick catch
3769,"Stephen, to fill the silence, said:",stephen to fill the silence say
3770,I am sure I could not light a fire.,i be sure i can not light a fire
3771,"You are an artist, are you not, Mr Dedalus?",you be a artist be you not mr dedalus
3772,"said the dean, glancing up and blinking his pale eyes.",say the dean glance up and blink his pale eye
3773,The object of the artist is the creation of the beautiful.,the object of the artist be the creation of the beautiful
3774,What the beautiful is is another question.,what the beautiful be be another question
3775,He rubbed his hands slowly and drily over the difficulty.,he rub his hand slowly and drily over the difficulty
3776,Can you solve that question now?,can you solve that question now
3777,he asked.,he ask
3778,"Aquinas, answered Stephen, says pulcra sunt quae visa placent.",aquinas answer stephen say pulcra sunt quae visa placent
3779,"This fire before us, said the dean, will be pleasing to the eye.",this fire before us say the dean will be please to the eye
3780,Will it therefore be beautiful?,will it therefore be beautiful
3781,"In so far as it is apprehended by the sight, which I suppose means here esthetic intellection, it will be beautiful.",in so far a it be apprehend by the sight which i suppose mean here esthetic intellection it will be beautiful
3782,But Aquinas also says Bonum est in quod tendit appetitus.,but aquinas also say bonum est in quod tendit appetitus
3783,In so far as it satisfies the animal craving for warmth fire is a good.,in so far a it satisfy the animal crave for warmth fire be a good
3784,"In hell, however, it is an evil.",in hell however it be a evil
3785,"Quite so, said the dean, you have certainly hit the nail on the head.",quite so say the dean you have certainly hit the nail on the head
3786,"He rose nimbly and went towards the door, set it ajar and said:",he rise nimbly and go towards the door set it ajar and say
3787,A draught is said to be a help in these matters.,a draught be say to be a help in this matter
3788,"As he came back to the hearth, limping slightly but with a brisk step, Stephen saw the silent soul of a jesuit look out at him from the pale loveless eyes.",a he come back to the hearth limp slightly but with a brisk step stephen see the silent soul of a jesuit look out at him from the pale loveless eye
3789,Like Ignatius he was lame but in his eyes burned no spark of Ignatius's enthusiasm.,like ignatius he be lame but in his eye burn no spark of ignatius s enthusiasm
3790,"Even the legendary craft of the company, a craft subtler and more secret than its fabled books of secret subtle wisdom, had not fired his soul with the energy of apostleship.",even the legendary craft of the company a craft subtle and much secret than its fabled book of secret subtle wisdom have not fire his soul with the energy of apostleship
3791,"It seemed as if he used the shifts and lore and cunning of the world, as bidden to do, for the greater glory of God, without joy in their handling or hatred of that in them which was evil but turning them, with a firm gesture of obedience back upon themselves and for all this silent service it seemed as if he loved not at all the master and little, if at all, the ends he served.",it seem a if he use the shift and lore and cunning of the world a bid to do for the great glory of god without joy in their handle or hatred of that in them which be evil but turn them with a firm gesture of obedience back upon themselves and for all this silent service it seem a if he love not at all the master and little if at all the end he serve
3792,"Similiter atque senis baculus, he was, as the founder would have had him, like a staff in an old man's hand, to be leaned on in the road at nightfall or in stress of weather, to lie with a lady's nosegay on a garden seat, to be raised in menace.",similiter atque senis baculus he be a the founder would have have him like a staff in a old man s hand to be lean on in the road at nightfall or in stress of weather to lie with a lady s nosegay on a garden seat to be raise in menace
3793,The dean returned to the hearth and began to stroke his chin.,the dean return to the hearth and begin to stroke his chin
3794,When may we expect to have something from you on the esthetic question?,when may we expect to have something from you on the esthetic question
3795,he asked.,he ask
3796,From me!,from me
3797,said Stephen in astonishment.,say stephen in astonishment
3798,I stumble on an idea once a fortnight if I am lucky.,i stumble on a idea once a fortnight if i be lucky
3799,"These questions are very profound, Mr Dedalus, said the dean.",this question be very profound mr dedalus say the dean
3800,It is like looking down from the cliffs of Moher into the depths.,it be like look down from the cliff of moher into the depth
3801,Many go down into the depths and never come up.,many go down into the depth and never come up
3802,Only the trained diver can go down into those depths and explore them and come to the surface again.,only the train diver can go down into that depth and explore them and come to the surface again
3803,"If you mean speculation, sir, said Stephen, I also am sure that there is no such thing as free thinking inasmuch as all thinking must be bound by its own laws.",if you mean speculation sir say stephen i also be sure that there be no such thing a free think inasmuch a all think must be bind by its own law
3804,For my purpose I can work on at present by the light of one or two ideas of Aristotle and Aquinas.,for my purpose i can work on at present by the light of one or two idea of aristotle and aquinas
3805,I see.,i see
3806,I quite see your point.,i quite see your point
3807,I need them only for my own use and guidance until I have done something for myself by their light.,i need them only for my own use and guidance until i have do something for myself by their light
3808,If the lamp smokes or smells I shall try to trim it.,if the lamp smoke or smell i shall try to trim it
3809,If it does not give light enough I shall sell it and buy another.,if it doe not give light enough i shall sell it and buy another
3810,"Epictetus also had a lamp, said the dean, which was sold for a fancy price after his death.",epictetus also have a lamp say the dean which be sell for a fancy price after his death
3811,It was the lamp he wrote his philosophical dissertations by.,it be the lamp he write his philosophical dissertation by
3812,You know Epictetus?,you know epictetus
3813,"An old gentleman, said Stephen coarsely, who said that the soul is very like a bucketful of water.",a old gentleman say stephen coarse who say that the soul be very like a bucketful of water
3814,"He tells us in his homely way, the dean went on, that he put an iron lamp before a statue of one of the gods and that a thief stole the lamp.",he tell us in his homely way the dean go on that he put a iron lamp before a statue of one of the god and that a thief steal the lamp
3815,What did the philosopher do?,what do the philosopher do
3816,He reflected that it was in the character of a thief to steal and determined to buy an earthen lamp next day instead of the iron lamp.,he reflect that it be in the character of a thief to steal and determine to buy a earthen lamp next day instead of the iron lamp
3817,"A smell of molten tallow came up from the dean's candle butts and fused itself in Stephen's consciousness with the jingle of the words, bucket and lamp and lamp and bucket.",a smell of melt tallow come up from the dean s candle butt and fuse itself in stephen s consciousness with the jingle of the word bucket and lamp and lamp and bucket
3818,"The priest's voice, too, had a hard jingling tone.",the priest s voice too have a hard jingle tone
3819,"Stephen's mind halted by instinct, checked by the strange tone and the imagery and by the priest's face which seemed like an unlit lamp or a reflector hung in a false focus.",stephen s mind halt by instinct check by the strange tone and the imagery and by the priest s face which seem like a unlit lamp or a reflector hang in a false focus
3820,What lay behind it or within it?,what lie behind it or within it
3821,"A dull torpor of the soul or the dullness of the thundercloud, charged with intellection and capable of the gloom of God?",a dull torpor of the soul or the dullness of the thundercloud charge with intellection and capable of the gloom of god
3822,"I meant a different kind of lamp, sir, said Stephen.",i mean a different kind of lamp sir say stephen
3823,"Undoubtedly, said the dean.",undoubtedly say the dean
3824,"One difficulty, said Stephen, in esthetic discussion is to know whether words are being used according to the literary tradition or according to the tradition of the marketplace.",one difficulty say stephen in esthetic discussion be to know whether word be be use accord to the literary tradition or accord to the tradition of the marketplace
3825,I remember a sentence of Newman's in which he says of the Blessed Virgin that she was detained in the full company of the saints.,i remember a sentence of newman s in which he say of the bless virgin that she be detain in the full company of the saint
3826,The use of the word in the marketplace is quite different.,the use of the word in the marketplace be quite different
3827,I hope I am not detaining you.,i hope i be not detain you
3828,"Not in the least, said the dean politely.",not in the little say the dean politely
3829,"No, no, said Stephen, smiling, I mean...",no no say stephen smile i mean
3830,"Yes, yes; I see, said the dean quickly, I quite catch the point: detain.",yes yes i see say the dean quickly i quite catch the point detain
3831,He thrust forward his under jaw and uttered a dry short cough.,he thrust forward his under jaw and utter a dry short cough
3832,"To return to the lamp, he said, the feeding of it is also a nice problem.",to return to the lamp he say the feed of it be also a nice problem
3833,"You must choose the pure oil and you must be careful when you pour it in not to overflow it, not to pour in more than the funnel can hold.",you must choose the pure oil and you must be careful when you pour it in not to overflow it not to pour in much than the funnel can hold
3834,What funnel?,what funnel
3835,asked Stephen.,ask stephen
3836,The funnel through which you pour the oil into your lamp.,the funnel through which you pour the oil into your lamp
3837,That?,that
3838,said Stephen.,say stephen
3839,Is that called a funnel?,be that call a funnel
3840,Is it not a tundish?,be it not a tundish
3841,What is a tundish?,what be a tundish
3842,That.,that
3843,The...funnel.,the funnel
3844,Is that called a tundish in Ireland?,be that call a tundish in ireland
3845,asked the dean.,ask the dean
3846,I never heard the word in my life.,i never hear the word in my life
3847,"It is called a tundish in Lower Drumcondra, said Stephen, laughing, where they speak the best English.",it be call a tundish in low drumcondra say stephen laugh where they speak the well english
3848,"A tundish, said the dean reflectively.",a tundish say the dean reflectively
3849,That is a most interesting word.,that be a much interest word
3850,I must look that word up.,i must look that word up
3851,Upon my word I must.,upon my word i must
3852,His courtesy of manner rang a little false and Stephen looked at the English convert with the same eyes as the elder brother in the parable may have turned on the prodigal.,his courtesy of manner ring a little false and stephen look at the english convert with the same eye a the old brother in the parable may have turn on the prodigal
3853,"A humble follower in the wake of clamorous conversions, a poor Englishman in Ireland, he seemed to have entered on the stage of jesuit history when that strange play of intrigue and suffering and envy and struggle and indignity had been all but given througha late-comer, a tardy spirit.",a humble follower in the wake of clamorous conversion a poor englishman in ireland he seem to have enter on the stage of jesuit history when that strange play of intrigue and suffer and envy and struggle and indignity have be all but give througha late comer a tardy spirit
3854,From what had he set out?,from what have he set out
3855,"Perhaps he had been born and bred among serious dissenters, seeing salvation in Jesus only and abhorring the vain pomps of the establishment.",perhaps he have be bear and breed among serious dissenter see salvation in jesus only and abhor the vain pomp of the establishment
3856,"Had he felt the need of an implicit faith amid the welter of sectarianism and the jargon of its turbulent schisms, six principle men, peculiar people, seed and snake baptists, supralapsarian dogmatists?",have he feel the need of a implicit faith amid the welter of sectarianism and the jargon of its turbulent schism six principle man peculiar people seed and snake baptists supralapsarian dogmatist
3857,Had he found the true church all of a sudden in winding up to the end like a reel of cotton some fine-spun line of reasoning upon insufflation on the imposition of hands or the procession of the Holy Ghost?,have he find the true church all of a sudden in wind up to the end like a reel of cotton some fine spin line of reason upon insufflation on the imposition of hand or the procession of the holy ghost
3858,"Or had Lord Christ touched him and bidden him follow, like that disciple who had sat at the receipt of custom, as he sat by the door of some zinc-roofed chapel, yawning and telling over his church pence?",or have lord christ touch him and bid him follow like that disciple who have sit at the receipt of custom a he sit by the door of some zinc roof chapel yawn and tell over his church penny
3859,The dean repeated the word yet again.,the dean repeat the word yet again
3860,Tundish!,tundish
3861,"Well now, that is interesting!",good now that be interest
3862,The question you asked me a moment ago seems to me more interesting.,the question you ask me a moment ago seem to me much interest
3863,"What is that beauty which the artist struggles to express from lumps of earth, said Stephen coldly.",what be that beauty which the artist struggle to express from lump of earth say stephen coldly
3864,The little word seemed to have turned a rapier point of his sensitiveness against this courteous and vigilant foe.,the little word seem to have turn a rapier point of his sensitiveness against this courteous and vigilant foe
3865,He felt with a smart of dejection that the man to whom he was speaking was a countryman of Ben Jonson.,he feel with a smart of dejection that the man to whom he be speak be a countryman of ben jonson
3866,He thought:,he think
3867,The language in which we are speaking is his before it is mine.,the language in which we be speak be his before it be mine
3868,"How different are the words home, Christ, ale, master, on his lips and on mine!",how different be the word home christ ale master on his lip and on mine
3869,I cannot speak or write these words without unrest of spirit.,i can not speak or write this word without unrest of spirit
3870,"His language, so familiar and so foreign, will always be for me an acquired speech.",his language so familiar and so foreign will always be for me a acquire speech
3871,I have not made or accepted its words.,i have not make or accept its word
3872,My voice holds them at bay.,my voice hold them at bay
3873,My soul frets in the shadow of his language.,my soul fret in the shadow of his language
3874,"And to distinguish between the beautiful and the sublime, the dean added, to distinguish between moral beauty and material beauty.",and to distinguish between the beautiful and the sublime the dean add to distinguish between moral beauty and material beauty
3875,And to inquire what kind of beauty is proper to each of the various arts.,and to inquire what kind of beauty be proper to each of the various art
3876,These are some interesting points we might take up.,this be some interest point we may take up
3877,"Stephen, disheartened suddenly by the dean's firm, dry tone, was silent; and through the silence a distant noise of many boots and confused voices came up the staircase.",stephen dishearten suddenly by the dean s firm dry tone be silent and through the silence a distant noise of many boot and confuse voice come up the staircase
3878,"In pursuing these speculations, said the dean conclusively, there is, however, the danger of perishing of inanition.",in pursue this speculation say the dean conclusively there be however the danger of perish of inanition
3879,First you must take your degree.,﻿1 you must take your degree
3880,Set that before you as your first aim.,set that before you a your ﻿1 aim
3881,"Then, little by little, you will see your way.",then little by little you will see your way
3882,"I mean in every sense, your way in life and in thinking.",i mean in every sense your way in life and in think
3883,It may be uphill pedalling at first.,it may be uphill pedal at ﻿1
3884,Take Mr Moonan.,take mr moonan
3885,He was a long time before he got to the top.,he be a long time before he get to the top
3886,But he got there.,but he get there
3887,"I may not have his talent, said Stephen quietly.",i may not have his talent say stephen quietly
3888,"You never know, said the dean brightly.",you never know say the dean brightly
3889,We never can say what is in us.,we never can say what be in us
3890,I most certainly should not be despondent.,i much certainly should not be despondent
3891,Per aspera ad astra.,per aspera ad astra
3892,He left the hearth quickly and went towards the landing to oversee the arrival of the first arts' class.,he leave the hearth quickly and go towards the land to oversee the arrival of the ﻿1 art class
3893,Leaning against the fireplace Stephen heard him greet briskly and impartially every Student of the class and could almost see the frank smiles of the coarser students.,lean against the fireplace stephen hear him greet briskly and impartially every student of the class and can almost see the frank smile of the coarse student
3894,"A desolating pity began to fall like dew upon his easily embittered heart for this faithful serving-man of the knightly Loyola, for this half-brother of the clergy, more venal than they in speech, more steadfast of soul than they, one whom he would never call his ghostly father; and he thought how this man and his companions had earned the name of worldlings at the hands not of the unworldly only but of the worldly also for having pleaded, during all their history, at the bar of God's justice for the souls of the lax and the lukewarm and the prudent.",a desolate pity begin to fall like dew upon his easily embitter heart for this faithful serve man of the knightly loyola for this half brother of the clergy much venal than they in speech much steadfast of soul than they one whom he would never call his ghostly father and he think how this man and his companion have earn the name of worldlings at the hand not of the unworldly only but of the worldly also for have plead during all their history at the bar of god s justice for the soul of the lax and the lukewarm and the prudent
3895,The entry of the professor was signalled by a few rounds of Kentish fire from the heavy boots of those students who sat on the highest tier of the gloomy theatre under the grey cobwebbed windows.,the entry of the professor be signal by a few round of kentish fire from the heavy boot of that student who sit on the high tier of the gloomy theatre under the grey cobwebbed window
3896,The calling of the roll began and the responses to the names were given out in all tones until the name of Peter Byrne was reached.,the call of the roll begin and the response to the name be give out in all tone until the name of peter byrne be reach
3897,"A deep bass note in response came from the upper tier, followed by coughs of protest along the other benches.",a deep bass note in response come from the upper tier follow by cough of protest along the other bench
3898,The professor paused in his reading and called the next name:,the professor pause in his read and call the next name
3899,No answer.,no answer
3900,Mr Cranly!,mr cranly
3901,A smile flew across Stephen's face as he thought of his friend's studies.,a smile fly across stephen s face a he think of his friend s study
3902,Try Leopardstown!,try leopardstown
3903,Said a voice from the bench behind.,say a voice from the bench behind
3904,"Stephen glanced up quickly but Moynihan's snoutish face, outlined on the grey light, was impassive.",stephen glance up quickly but moynihan s snoutish face outline on the grey light be impassive
3905,A formula was given out.,a formula be give out
3906,Amid the rustling of the notebooks Stephen turned back again and said:,amid the rustle of the notebook stephen turn back again and say
3907,Give me some paper for God's sake.,give me some paper for god s sake
3908,Are you as bad as that?,be you a bad a that
3909,asked Moynihan with a broad grin.,ask moynihan with a broad grin
3910,"He tore a sheet from his scribbler and passed it down, whispering:",he tear a sheet from his scribbler and pass it down whisper
3911,In case of necessity any layman or woman can do it.,in case of necessity any layman or woman can do it
3912,"The formula which he wrote obediently on the sheet of paper, the coiling and uncoiling calculations of the professor, the spectre-like symbols of force and velocity fascinated and jaded Stephen's mind.",the formula which he write obediently on the sheet of paper the coil and uncoil calculation of the professor the spectre like symbol of force and velocity fascinate and jaded stephen s mind
3913,He had heard some say that the old professor was an atheist freemason.,he have hear some say that the old professor be a atheist freemason
3914,O the grey dull day!,o the grey dull day
3915,"It seemed a limbo of painless patient consciousness through which souls of mathematicians might wander, projecting long slender fabrics from plane to plane of ever rarer and paler twilight, radiating swift eddies to the last verges of a universe ever vaster, farther and more impalpable.",it seem a limbo of painless patient consciousness through which soul of mathematician may wander project long slender fabric from plane to plane of ever rare and pale twilight radiate swift eddy to the last verge of a universe ever vast far and much impalpable
3916,So we must distinguish between elliptical and ellipsoidal.,so we must distinguish between elliptical and ellipsoidal
3917,Perhaps some of you gentlemen may be familiar with the works of Mr W. S. Gilbert.,perhaps some of you gentleman may be familiar with the work of mr w s gilbert
3918,In one of his songs he speaks of the billiard sharp who is condemned to play:,in one of his song he speak of the billiard sharp who be condemn to play
3919,On a cloth untrue     With a twisted cue     And elliptical billiard balls.,on a cloth untrue with a twist cue and elliptical billiard ball
3920,He means a ball having the form of the ellipsoid of the principal axes of which I spoke a moment ago.,he mean a ball have the form of the ellipsoid of the principal axis of which i speak a moment ago
3921,Moynihan leaned down towards Stephen's ear and murmured:,moynihan lean down towards stephen s ear and murmur
3922,What price ellipsoidal balls!,what price ellipsoidal ball
3923,"chase me, ladies, I'm in the cavalry!",chase me lady i be in the cavalry
3924,"His fellow student's rude humour ran like a gust through the cloister of Stephen's mind, shaking into gay life limp priestly vestments that hung upon the walls, setting them to sway and caper in a sabbath of misrule.",his fellow student s rude humour run like a gust through the cloister of stephen s mind shake into gay life limp priestly vestment that hang upon the wall set them to sway and caper in a sabbath of misrule
3925,"The forms of the community emerged from the gust-blown vestments, the dean of studies, the portly florid bursar with his cap of grey hair, the president, the little priest with feathery hair who wrote devout verses, the squat peasant form of the professor of economics, the tall form of the young professor of mental science discussing on the landing a case of conscience with his class like a giraffe cropping high leafage among a herd of antelopes, the grave troubled prefect of the sodality, the plump round-headed professor of Italian with his rogue's eyes.",the form of the community emerge from the gust blow vestment the dean of study the portly florid bursar with his cap of grey hair the president the little priest with feathery hair who write devout verse the squat peasant form of the professor of economics the tall form of the young professor of mental science discuss on the land a case of conscience with his class like a giraffe crop high leafage among a herd of antelope the grave trouble prefect of the sodality the plump round head professor of italian with his rogue s eye
