,text_raw,text_clean
1680,"We were chatting, you know, and one word borrowed another.",we be chat you know and one word borrow another
1681,"And, by the way, who do you think he told me will get that job in the corporation?",and by the way who do you think he tell me will get that job in the corporation
1682,But I'll tell you that after.,but i will tell you that after
1683,"Well, as I was saying, we were chatting away quite friendly and he asked me did our friend here wear glasses still, and then he told me the whole story.",good a i be say we be chat away quite friendly and he ask me do our friend here wear glass still and then he tell me the whole story
1684,"And was he annoyed, Simon?",and be he annoy simon
1685,Annoyed?,annoy
1686,Not he!,not he
1687,Manly little chap!,manly little chap
1688,he said.,he say
1689,Mr Dedalus imitated the mincing nasal tone of the provincial.,mr dedalus imitate the mince nasal tone of the provincial
1690,"Father Dolan and I, when I told them all at dinner about it, Father Dolan and I had a great laugh over it.",father dolan and i when i tell them all at dinner about it father dolan and i have a great laugh over it
1691,"You better mind yourself Father Dolan, said I, or young Dedalus will send you up for twice nine.",you well mind yourself father dolan say i or young dedalus will send you up for twice nine
1692,We had a famous laugh together over it.,we have a famous laugh together over it
1693,Mr Dedalus turned to his wife and interjected in his natural voice:,mr dedalus turn to his wife and interject in his natural voice
1694,Shows you the spirit in which they take the boys there.,show you the spirit in which they take the boy there
1695,"O, a jesuit for your life, for diplomacy!",o a jesuit for your life for diplomacy
1696,He reassumed the provincial's voice and repeated:,he reassumed the provincial s voice and repeat
1697,I told them all at dinner about it and Father Dolan and I and all of us we had a hearty laugh together over it.,i tell them all at dinner about it and father dolan and i and all of us we have a hearty laugh together over it
1698,The night of the Whitsuntide play had come and Stephen from the window of the dressing-room looked out on the small grass-plot across which lines of Chinese lanterns were stretched.,the night of the whitsuntide play have come and stephen from the window of the dress room look out on the small grass plot across which line of chinese lantern be stretch
1699,He watched the visitors come down the steps from the house and pass into the theatre.,he watch the visitor come down the step from the house and pass into the theatre
1700,"Stewards in evening dress, old Belvedereans, loitered in groups about the entrance to the theatre and ushered in the visitors with ceremony.",steward in even dress old belvedereans loiter in group about the entrance to the theatre and usher in the visitor with ceremony
1701,Under the sudden glow of a lantern he could recognize the smiling face of a priest.,under the sudden glow of a lantern he can recognize the smile face of a priest
1702,The Blessed Sacrament had been removed from the tabernacle and the first benches had been driven back so as to leave the dais of the altar and the space before it free.,the bless sacrament have be remove from the tabernacle and the ﻿1 bench have be drive back so a to leave the dais of the altar and the space before it free
1703,Against the walls stood companies of barbells and Indian clubs; the dumbbells were piled in one corner: and in the midst of countless hillocks of gymnasium shoes and sweaters and singlets in untidy brown parcels there stood the stout leather-jacketed vaulting horse waiting its turn to be carried up on the stage and set in the middle of the winning team at the end of the gymnastic display.,against the wall stand company of barbell and indian club the dumbbell be pile in one corner and in the midst of countless hillock of gymnasium shoe and sweater and singlet in untidy brown parcel there stand the stout leather jacket vault horse wait its turn to be carry up on the stage and set in the middle of the win team at the end of the gymnastic display
1704,"Stephen, though in deference to his reputation for essay writing he had been elected secretary to the gymnasium, had had no part in the first section of the programme but in the play which formed the second section he had the chief part, that of a farcical pedagogue.",stephen though in deference to his reputation for essay write he have be elect secretary to the gymnasium have have no part in the ﻿1 section of the programme but in the play which form the 2 section he have the chief part that of a farcical pedagogue
1705,He had been cast for it on account of his stature and grave manners for he was now at the end of his second year at Belvedere and in number two.,he have be cast for it on account of his stature and grave manner for he be now at the end of his 2 year at belvedere and in numb two
1706,"A score of the younger boys in white knickers and singlets came pattering down from the stage, through the vestry and to the chapel.",a score of the young boy in white knickers and singlet come patter down from the stage through the vestry and to the chapel
1707,The vestry and chapel were peopled with eager masters and boys.,the vestry and chapel be people with eager master and boy
1708,The plump bald sergeant major was testing with his foot the springboard of the vaulting horse.,the plump bald sergeant major be test with his foot the springboard of the vault horse
1709,"The lean young man in a long overcoat, who was to give a special display of intricate club swinging, stood near watching with interest, his silver-coated clubs peeping out of his deep side-pockets.",the lean young man in a long overcoat who be to give a special display of intricate club swinge stand near watch with interest his silver coat club peep out of his deep side pocket
1710,"The hollow rattle of the wooden dumbbells was heard as another team made ready to go up on the stage: and in another moment the excited prefect was hustling the boys through the vestry like a flock of geese, flapping the wings of his soutane nervously and crying to the laggards to make haste.",the hollow rattle of the wooden dumbbell be hear a another team make ready to go up on the stage and in another moment the excite prefect be hustle the boy through the vestry like a flock of goose flap the wing of his soutane nervously and cry to the laggard to make haste
1711,"A little troop of Neapolitan peasants were practising their steps at the end of the chapel, some circling their arms above their heads, some swaying their baskets of paper violets and curtsying.",a little troop of neapolitan peasant be practise their step at the end of the chapel some circle their arm above their head some sway their basket of paper violet and curtsy
1712,In a dark corner of the chapel at the gospel side of the altar a stout old lady knelt amid her copious black skirts.,in a dark corner of the chapel at the gospel side of the altar a stout old lady kneel amid her copious black skirt
1713,"When she stood up a pink-dressed figure, wearing a curly golden wig and an old-fashioned straw sunbonnet, with black pencilled eyebrows and cheeks delicately rouged and powdered, was discovered.",when she stand up a pink dress figure wear a curly golden wig and a old fashion straw sunbonnet with black pencil eyebrow and cheek delicately rouge and powder be discover
1714,A low murmur of curiosity ran round the chapel at the discovery of this girlish figure.,a low murmur of curiosity run round the chapel at the discovery of this girlish figure
1715,"One of the prefects, smiling and nodding his head, approached the dark corner and, having bowed to the stout old lady, said pleasantly:",one of the prefect smile and nod his head approach the dark corner and have bow to the stout old lady say pleasantly
1716,"Is this a beautiful young lady or a doll that you have here, Mrs Tallon?",be this a beautiful young lady or a doll that you have here mrs tallon
1717,"Then, bending down to peer at the smiling painted face under the leaf of the bonnet, he exclaimed:",then bend down to peer at the smile paint face under the leaf of the bonnet he exclaim
1718,Upon my word I believe it's little Bertie Tallon after all!,upon my word i believe it be little bertie tallon after all
1719,Stephen at his post by the window heard the old lady and the priest laugh together and heard the boys' murmurs of admiration behind him as they passed forward to see the little boy who had to dance the sunbonnet dance by himself.,stephen at his post by the window hear the old lady and the priest laugh together and hear the boy murmur of admiration behind him a they pass forward to see the little boy who have to dance the sunbonnet dance by himself
1720,A movement of impatience escaped him.,a movement of impatience escape him
1721,"He let the edge of the blind fall and, stepping down from the bench on which he had been standing, walked out of the chapel.",he let the edge of the blind fall and step down from the bench on which he have be stand walk out of the chapel
1722,He passed out of the schoolhouse and halted under the shed that flanked the garden.,he pass out of the schoolhouse and halt under the she would that flank the garden
1723,From the theatre opposite came the muffled noise of the audience and sudden brazen clashes of the soldiers' band.,from the theatre opposite come the muffle noise of the audience and sudden brazen clash of the soldier band
1724,"The light spread upwards from the glass roof making the theatre seem a festive ark, anchored among the hulks of houses, her frail cables of lanterns looping her to her moorings.",the light spread upwards from the glass roof make the theatre seem a festive ark anchor among the hulk of house her frail cable of lantern loop her to her mooring
1725,A side door of the theatre opened suddenly and a shaft of light flew across the grass plots.,a side door of the theatre open suddenly and a shaft of light fly across the grass plot
1726,"A sudden burst of music issued from the ark, the prelude of a waltz: and when the side door closed again the listener could hear the faint rhythm of the music.",a sudden burst of music issue from the ark the prelude of a waltz and when the side door close again the listener can hear the faint rhythm of the music
1727,"The sentiment of the opening bars, their languor and supple movement, evoked the incommunicable emotion which had been the cause of all his day's unrest and of his impatient movement of a moment before.",the sentiment of the open bar their languor and supple movement evoke the incommunicable emotion which have be the because of all his day s unrest and of his impatient movement of a moment before
1728,"His unrest issued from him like a wave of sound: and on the tide of flowing music the ark was journeying, trailing her cables of lanterns in her wake.",his unrest issue from him like a wave of sound and on the tide of flow music the ark be journey trail her cable of lantern in her wake
1729,Then a noise like dwarf artillery broke the movement.,then a noise like dwarf artillery break the movement
1730,It was the clapping that greeted the entry of the dumbbell team on the stage.,it be the clap that greet the entry of the dumbbell team on the stage
1731,At the far end of the shed near the street a speck of pink light showed in the darkness and as he walked towards it he became aware of a faint aromatic odour.,at the far end of the she would near the street a speck of pink light show in the darkness and a he walk towards it he become aware of a faint aromatic odour
1732,"Two boys were standing in the shelter of a doorway, smoking, and before he reached them he had recognised Heron by his voice.",two boy be stand in the shelter of a doorway smoke and before he reach them he have recognise heron by his voice
1733,Here comes the noble Dedalus!,here come the noble dedalus
1734,cried a high throaty voice.,cry a high throaty voice
1735,Welcome to our trusty friend!,welcome to our trusty friend
1736,This welcome ended in a soft peal of mirthless laughter as Heron salaamed and then began to poke the ground with his cane.,this welcome end in a soft peal of mirthless laughter a heron salaam and then begin to poke the grind with his cane
1737,"Here I am, said Stephen, halting and glancing from Heron to his friend.",here i be say stephen halt and glance from heron to his friend
1738,"The latter was a stranger to him but in the darkness, by the aid of the glowing cigarette tips, he could make out a pale dandyish face over which a smile was travelling slowly, a tall overcoated figure and a hard hat.",the latter be a strange to him but in the darkness by the aid of the glow cigarette tip he can make out a pale dandyish face over which a smile be travel slowly a tall overcoated figure and a hard hat
1739,Heron did not trouble himself about an introduction but said instead:,heron do not trouble himself about a introduction but say instead
1740,I was just telling my friend Wallis what a lark it would be tonight if you took off the rector in the part of the schoolmaster.,i be just tell my friend wallis what a lark it would be tonight if you take off the rector in the part of the schoolmaster
1741,It would be a ripping good joke.,it would be a rip good joke
1742,"Heron made a poor attempt to imitate for his friend Wallis the rector's pedantic bass and then, laughing at his failure, asked Stephen to do it.",heron make a poor attempt to imitate for his friend wallis the rector s pedantic bass and then laugh at his failure ask stephen to do it
1743,"Go on, Dedalus, he urged, you can take him off rippingly.",go on dedalus he urge you can take him off rippingly
1744,He that will not hear the churcha let him be to Theea as the heathena and the publicana.,he that will not hear the churcha let him be to theea a the heathena and the publicana
1745,The imitation was prevented by a mild expression of anger from Wallis in whose mouthpiece the cigarette had become too tightly wedged.,the imitation be prevent by a mild expression of anger from wallis in whose mouthpiece the cigarette have become too tightly wedge
1746,"Damn this blankety blank holder, he said, taking it from his mouth and smiling and frowning upon it tolerantly.",damn this blankety blank holder he say take it from his mouth and smile and frown upon it tolerantly
1747,It's always getting stuck like that.,it be always get stick like that
1748,Do you use a holder?,do you use a holder
1749,"I don't smoke, answered Stephen.",i do not smoke answer stephen
1750,"No, said Heron, Dedalus is a model youth.",no say heron dedalus be a model youth
1751,He doesn't smoke and he doesn't go to bazaars and he doesn't flirt and he doesn't damn anything or damn all.,he doe not smoke and he doe not go to bazaar and he doe not flirt and he doe not damn anything or damn all
1752,"Stephen shook his head and smiled in his rival's flushed and mobile face, beaked like a bird's.",stephen shake his head and smile in his rival s flush and mobile face beaked like a bird s
1753,He had often thought it strange that Vincent Heron had a bird's face as well as a bird's name.,he have often think it strange that vincent heron have a bird s face a good a a bird s name
1754,A shock of pale hair lay on the forehead like a ruffled crest: the forehead was narrow and bony and a thin hooked nose stood out between the close-set prominent eyes which were light and inexpressive.,a shock of pale hair lie on the forehead like a ruffle crest the forehead be narrow and bony and a thin hook nose stand out between the close set prominent eye which be light and inexpressive
1755,The rivals were school friends.,the rival be school friend
1756,"They sat together in class, knelt together in the chapel, talked together after beads over their lunches.",they sit together in class kneel together in the chapel talk together after bead over their lunch
1757,"As the fellows in number one were undistinguished dullards, Stephen and Heron had been during the year the virtual heads of the school.",a the fellow in numb one be undistinguished dullard stephen and heron have be during the year the virtual head of the school
1758,It was they who went up to the rector together to ask for a free day or to get a fellow off.,it be they who go up to the rector together to ask for a free day or to get a fellow off
1759,"O by the way, said Heron suddenly, I saw your governor going in.",o by the way say heron suddenly i see your governor go in
1760,The smile waned on Stephen's face.,the smile wane on stephen s face
1761,Any allusion made to his father by a fellow or by a master put his calm to rout in a moment.,any allusion make to his father by a fellow or by a master put his calm to rout in a moment
1762,He waited in timorous silence to hear what Heron might say next.,he wait in timorous silence to hear what heron may say next
1763,"Heron, however, nudged him expressively with his elbow and said:",heron however nudge him expressively with his elbow and say
1764,You're a sly dog.,you be a sly dog
1765,Why so?,why so
1766,said Stephen.,say stephen
1767,You'd think butter wouldn't melt in your mouth said Heron.,you would think butter would not melt in your mouth say heron
1768,But I'm afraid you're a sly dog.,but i be afraid you be a sly dog
1769,Might I ask you what you are talking about?,may i ask you what you be talk about
1770,said Stephen urbanely.,say stephen urbanely
1771,"Indeed you might, answered Heron.",indeed you may answer heron
1772,"We saw her, Wallis, didn't we?",we see her wallis do not we
1773,And deucedly pretty she is too.,and deucedly pretty she be too
1774,And inquisitive!,and inquisitive
1775,"And what part does Stephen take, Mr Dedalus?",and what part doe stephen take mr dedalus
1776,"and will Stephen not sing, Mr Dedalus?",and will stephen not sing mr dedalus
1777,Your governor was staring at her through that eyeglass of his for all he was worth so that I think the old man has found you out too.,your governor be stare at her through that eyeglass of his for all he be worth so that i think the old man have find you out too
1778,"I wouldn't care a bit, by Jove.",i would not care a bite by jove
1779,"She's ripping, isn't she, Wallis?",she be rip be not she wallis
1780,"Not half bad, answered Wallis quietly as he placed his holder once more in a corner of his mouth.",not half bad answer wallis quietly a he place his holder once much in a corner of his mouth
1781,A shaft of momentary anger flew through Stephen's mind at these indelicate allusions in the hearing of a stranger.,a shaft of momentary anger fly through stephen s mind at this indelicate allusion in the hear of a strange
1782,For him there was nothing amusing in a girl's interest and regard.,for him there be nothing amuse in a girl s interest and regard
1783,"All day he had thought of nothing but their leave-taking on the steps of the tram at Harold's Cross, the stream of moody emotions it had made to course through him and the poem he had written about it.",all day he have think of nothing but their leave take on the step of the tram at harold s cross the stream of moody emotion it have make to course through him and the poem he have write about it
1784,All day he had imagined a new meeting with her for he knew that she was to come to the play.,all day he have imagine a new meet with her for he know that she be to come to the play
1785,"The old restless moodiness had again filled his breast as it had done on the night of the party, but had not found an outlet in verse.",the old restless moodiness have again fill his breast a it have do on the night of the party but have not find a outlet in verse
1786,"The growth and knowledge of two years of boyhood stood between then and now, forbidding such an outlet: and all day the stream of gloomy tenderness within him had started forth and returned upon itself in dark courses and eddies, wearying him in the end until the pleasantry of the prefect and the painted little boy had drawn from him a movement of impatience.",the growth and knowledge of two year of boyhood stand between then and now forbid such a outlet and all day the stream of gloomy tenderness within him have start forth and return upon itself in dark course and eddy weary him in the end until the pleasantry of the prefect and the paint little boy have draw from him a movement of impatience
1787,"So you may as well admit, Heron went on, that we've fairly found you out this time.",so you may a good admit heron go on that we have fairly find you out this time
1788,"You can't play the saint on me any more, that's one sure five.",you can not play the saint on me any much that be one sure five
1789,"A soft peal of mirthless laughter escaped from his lips and, bending down as before, he struck Stephen lightly across the calf of the leg with his cane, as if in jesting reproof.",a soft peal of mirthless laughter escape from his lip and bend down a before he strike stephen lightly across the calf of the leg with his cane a if in jest reproof
1790,Stephen's moment of anger had already passed.,stephen s moment of anger have already pass
1791,"He was neither flattered nor confused, but simply wished the banter to end.",he be neither flatter nor confuse but simply wish the banter to end
1792,He scarcely resented what had seemed to him a silly indelicateness for he knew that the adventure in his mind stood in no danger from these words: and his face mirrored his rival's false smile.,he scarcely resent what have seem to him a silly indelicateness for he know that the adventure in his mind stand in no danger from this word and his face mirror his rival s false smile
1793,Admit!,admit
1794,"repeated Heron, striking him again with his cane across the calf of the leg.",repeat heron strike him again with his cane across the calf of the leg
1795,The stroke was playful but not so lightly given as the first one had been.,the stroke be playful but not so lightly give a the ﻿1 one have be
1796,"Stephen felt the skin tingle and glow slightly and almost painlessly; and, bowing submissively, as if to meet his companion's jesting mood, began to recite the Confiteor.",stephen feel the skin tingle and glow slightly and almost painlessly and bow submissively a if to meet his companion s jest mood begin to recite the confiteor
1797,"The episode ended well, for both Heron and Wallis laughed indulgently at the irreverence.",the episode end good for both heron and wallis laugh indulgently at the irreverence
1798,"The confession came only from Stephen's lips and, while they spoke the words, a sudden memory had carried him to another scene called up, as if by magic, at the moment when he had noted the faint cruel dimples at the corners of Heron's smiling lips and had felt the familiar stroke of the cane against his calf and had heard the familiar word of admonition:",the confession come only from stephen s lip and while they speak the word a sudden memory have carry him to another scene call up a if by magic at the moment when he have note the faint cruel dimple at the corner of heron s smile lip and have feel the familiar stroke of the cane against his calf and have hear the familiar word of admonition
1799,It was towards the close of his first term in the college when he was in number six.,it be towards the close of his ﻿1 term in the college when he be in numb six
1800,His sensitive nature was still smarting under the lashes of an undivined and squalid way of life.,his sensitive nature be still smart under the lash of a undivined and squalid way of life
1801,His soul was still disquieted and cast down by the dull phenomenon of Dublin.,his soul be still disquiet and cast down by the dull phenomenon of dublin
1802,"He had emerged from a two years' spell of revery to find himself in the midst of a new scene, every event and figure of which affected him intimately, disheartened him or allured and, whether alluring or disheartening, filled him always with unrest and bitter thoughts.",he have emerge from a two year spell of revery to find himself in the midst of a new scene every event and figure of which affect him intimately dishearten him or allure and whether allure or dishearten fill him always with unrest and bitter thought
1803,All the leisure which his school life left him was passed in the company of subversive writers whose jibes and violence of speech set up a ferment in his brain before they passed out of it into his crude writings.,all the leisure which his school life leave him be pass in the company of subversive writer whose jibe and violence of speech set up a ferment in his brain before they pass out of it into his crude writing
1804,"The essay was for him the chief labour of his week and every Tuesday, as he marched from home to the school, he read his fate in the incidents of the way, pitting himself against some figure ahead of him and quickening his pace to outstrip it before a certain goal was reached or planting his steps scrupulously in the spaces of the patchwork of the pathway and telling himself that he would be first and not first in the weekly essay.",the essay be for him the chief labour of his week and every tuesday a he march from home to the school he read his fate in the incident of the way pit himself against some figure ahead of him and quicken his pace to outstrip it before a certain goal be reach or plant his step scrupulously in the space of the patchwork of the pathway and tell himself that he would be ﻿1 and not ﻿1 in the weekly essay
1805,On a certain Tuesday the course of his triumphs was rudely broken.,on a certain tuesday the course of his triumph be rudely break
