,text_raw,text_clean
1686,"There in the grey room, with the pictures on the wall, and the valuable furniture, under the ground glass skylight, they learnt the extent of their transgressions; huddled up in arm-chairs, they watched him go through, for their benefit, a curious exercise with the arms, which he shot out, brought sharply back to his hip, to prove (if the patient was obstinate) that Sir William was master of his own actions, which the patient was not.",there in the grey room with the picture on the wall and the valuable furniture under the grind glass skylight they learn the extent of their transgression huddle up in arm chair they watch him go through for their benefit a curious exercise with the arm which he shoot out bring sharply back to his hip to prove if the patient be obstinate that sir william be master of his own action which the patient be not
1687,"There some weakly broke down; sobbed, submitted; others, inspired by Heaven knows what intemperate madness, called Sir William to his face a damnable humbug; questioned, even more impiously, life itself.",there some weakly break down sob submit other inspire by heaven know what intemperate madness call sir william to his face a damnable humbug question even much impiously life itself
1688,Why live?,why live
1689,they demanded.,they demand
1690,Sir William replied that life was good.,sir william reply that life be good
1691,"Certainly Lady Bradshaw in ostrich feathers hung over the mantelpiece, and as for his income it was quite twelve thousand a year.",certainly lady bradshaw in ostrich feather hang over the mantelpiece and a for his income it be quite twelve thousand a year
1692,"But to us, they protested, life has given no such bounty.",but to us they protest life have give no such bounty
1693,He acquiesced.,he acquiesce
1694,They lacked a sense of proportion.,they lack a sense of proportion
1695,"And perhaps, after all, there is no God?",and perhaps after all there be no god
1696,He shrugged his shoulders.,he shrug his shoulder
1697,"In short, this living or not living is an affair of our own?",in short this live or not live be a affair of our own
1698,But there they were mistaken.,but there they be mistake
1699,"Sir William had a friend in Surrey where they taught, what Sir William frankly admitted was a difficult art--a sense of proportion.",sir william have a friend in surrey where they teach what sir william frankly admit be a difficult art a sense of proportion
1700,"There were, moreover, family affection; honour; courage; and a brilliant career.",there be moreover family affection honour courage and a brilliant career
1701,All of these had in Sir William a resolute champion.,all of this have in sir william a resolute champion
1702,"If they failed him, he had to support police and the good of society, which, he remarked very quietly, would take care, down in Surrey, that these unsocial impulses, bred more than anything by the lack of good blood, were held in control.",if they fail him he have to support police and the good of society which he remark very quietly would take care down in surrey that this unsocial impulse breed much than anything by the lack of good blood be hold in control
1703,"And then stole out from her hiding-place and mounted her throne that Goddess whose lust is to override opposition, to stamp indelibly in the sanctuaries of others the image of herself.",and then steal out from her hide place and mount her throne that goddess whose lust be to override opposition to stamp indelibly in the sanctuary of other the image of herself
1704,"Naked, defenceless, the exhausted, the friendless received the impress of Sir William's will.",naked defenceless the exhaust the friendless receive the impress of sir william s will
1705,He swooped; he devoured.,he swoop he devour
1706,He shut people up.,he shut people up
1707,It was this combination of decision and humanity that endeared Sir William so greatly to the relations of his victims.,it be this combination of decision and humanity that endear sir william so greatly to the relation of his victim
1708,"But Rezia Warren Smith cried, walking down Harley Street, that she did not like that man.",but rezia warren smith cry walk down harley street that she do not like that man
1709,"Shredding and slicing, dividing and subdividing, the clocks of Harley Street nibbled at the June day, counselled submission, upheld authority, and pointed out in chorus the supreme advantages of a sense of proportion, until the mound of time was so far diminished that a commercial clock, suspended above a shop in Oxford Street, announced, genially and fraternally, as if it were a pleasure to Messrs. Rigby and Lowndes to give the information gratis, that it was half-past one.",shred and slice divide and subdivide the clock of harley street nibble at the june day counsel submission uphold authority and point out in chorus the supreme advantage of a sense of proportion until the mound of time be so far diminish that a commercial clock suspend above a shop in oxford street announce genially and fraternally a if it be a pleasure to messrs rigby and lowndes to give the information gratis that it be half past one
1710,"Looking up, it appeared that each letter of their names stood for one of the hours; subconsciously one was grateful to Rigby and Lowndes for giving one time ratified by Greenwich; and this gratitude (so Hugh Whitbread ruminated, dallying there in front of the shop window), naturally took the form later of buying off Rigby and Lowndes socks or shoes.",look up it appear that each letter of their name stand for one of the hour subconsciously one be grateful to rigby and lowndes for give one time ratify by greenwich and this gratitude so hugh whitbread ruminate dally there in front of the shop window naturally take the form late of buy off rigby and lowndes sock or shoe
1711,So he ruminated.,so he ruminate
1712,It was his habit.,it be his habit
1713,He did not go deeply.,he do not go deeply
1714,"He brushed surfaces; the dead languages, the living, life in Constantinople, Paris, Rome; riding, shooting, tennis, it had been once.",he brush surface the dead language the live life in constantinople paris rome ride shoot tennis it have be once
1715,"The malicious asserted that he now kept guard at Buckingham Palace, dressed in silk stockings and knee-breeches, over what nobody knew.",the malicious assert that he now keep guard at buckingham palace dress in silk stocking and knee breech over what nobody know
1716,But he did it extremely efficiently.,but he do it extremely efficiently
1717,He had been afloat on the cream of English society for fifty-five years.,he have be afloat on the cream of english society for fifty five year
1718,He had known Prime Ministers.,he have know prime minister
1719,His affections were understood to be deep.,his affection be understand to be deep
1720,"And if it were true that he had not taken part in any of the great movements of the time or held important office, one or two humble reforms stood to his credit; an improvement in public shelters was one; the protection of owls in Norfolk another; servant girls had reason to be grateful to him; and his name at the end of letters to the Times, asking for funds, appealing to the public to protect, to preserve, to clear up litter, to abate smoke, and stamp out immorality in parks, commanded respect.",and if it be true that he have not take part in any of the great movement of the time or hold important office one or two humble reform stand to his credit a improvement in public shelter be one the protection of owl in norfolk another servant girl have reason to be grateful to him and his name at the end of letter to the time ask for fund appeal to the public to protect to preserve to clear up litter to abate smoke and stamp out immorality in park command respect
1721,"A magnificent figure he cut too, pausing for a moment (as the sound of the half hour died away) to look critically, magisterially, at socks and shoes; impeccable, substantial, as if he beheld the world from a certain eminence, and dressed to match; but realised the obligations which size, wealth, health, entail, and observed punctiliously even when not absolutely necessary, little courtesies, old-fashioned ceremonies which gave a quality to his manner, something to imitate, something to remember him by, for he would never lunch, for example, with Lady Bruton, whom he had known these twenty years, without bringing her in his outstretched hand a bunch of carnations and asking Miss Brush, Lady Bruton's secretary, after her brother in South Africa, which, for some reason, Miss Brush, deficient though she was in every attribute of female charm, so much resented that she said ""Thank you, he's doing very well in South Africa,"" when, for half a dozen years, he had been doing badly in Portsmouth.",a magnificent figure he cut too pause for a moment a the sound of the half hour die away to look critically magisterially at sock and shoe impeccable substantial a if he behold the world from a certain eminence and dress to match but realise the obligation which size wealth health entail and observe punctiliously even when not absolutely necessary little courtesy old fashion ceremony which give a quality to his manner something to imitate something to remember him by for he would never lunch for example with lady bruton whom he have know this twenty year without bring her in his outstretch hand a bunch of carnation and ask miss brush lady bruton s secretary after her brother in south africa which for some reason miss brush deficient though she be in every attribute of female charm so much resent that she say thank you he be do very good in south africa when for half a dozen year he have be do badly in portsmouth
1722,"Lady Bruton herself preferred Richard Dalloway, who arrived at the next moment.",lady bruton herself prefer richard dalloway who arrive at the next moment
1723,Indeed they met on the doorstep.,indeed they meet on the doorstep
1724,Lady Bruton preferred Richard Dalloway of course.,lady bruton prefer richard dalloway of course
1725,He was made of much finer material.,he be make of much fine material
1726,But she wouldn't let them run down her poor dear Hugh.,but she would not let them run down her poor dear hugh
1727,She could never forget his kindness--he had been really remarkably kind--she forgot precisely upon what occasion.,she can never forget his kindness he have be really remarkably kind she forget precisely upon what occasion
1728,But he had been--remarkably kind.,but he have be remarkably kind
1729,"Anyhow, the difference between one man and another does not amount to much.",anyhow the difference between one man and another doe not amount to much
1730,"She had never seen the sense of cutting people up, as Clarissa Dalloway did--cutting them up and sticking them together again; not at any rate when one was sixty-two.",she have never see the sense of cut people up a clarissa dalloway do cut them up and stick them together again not at any rate when one be sixty two
1731,She took Hugh's carnations with her angular grim smile.,she take hugh s carnation with her angular grim smile
1732,"There was nobody else coming, she said.",there be nobody else come she say
1733,"She had got them there on false pretences, to help her out of a difficulty--",she have get them there on false pretence to help her out of a difficulty
1734,"""But let us eat first,"" she said.",but let us eat ﻿1 she say
1735,"And so there began a soundless and exquisite passing to and fro through swing doors of aproned white-capped maids, handmaidens not of necessity, but adepts in a mystery or grand deception practised by hostesses in Mayfair from one-thirty to two, when, with a wave of the hand, the traffic ceases, and there rises instead this profound illusion in the first place about the food--how it is not paid for; and then that the table spreads itself voluntarily with glass and silver, little mats, saucers of red fruit; films of brown cream mask turbot; in casseroles severed chickens swim; coloured, undomestic, the fire burns; and with the wine and the coffee (not paid for) rise jocund visions before musing eyes; gently speculative eyes; eyes to whom life appears musical, mysterious; eyes now kindled to observe genially the beauty of the red carnations which Lady Bruton (whose movements were always angular) had laid beside her plate, so that Hugh Whitbread, feeling at peace with the entire universe and at the same time completely sure of his standing, said, resting his fork,",and so there begin a soundless and exquisite pass to and fro through swing door of aproned white cap maid handmaiden not of necessity but adept in a mystery or grand deception practise by hostess in mayfair from one thirty to two when with a wave of the hand the traffic cease and there rise instead this profound illusion in the ﻿1 place about the food how it be not pay for and then that the table spread itself voluntarily with glass and silver little mat saucer of red fruit film of brown cream mask turbot in casserole sever chicken swim colour undomestic the fire burn and with the wine and the coffee not pay for rise jocund vision before muse eye gently speculative eye eye to whom life appear musical mysterious eye now kindle to observe genially the beauty of the red carnation which lady bruton whose movement be always angular have lay beside her plate so that hugh whitbread feel at peace with the entire universe and at the same time completely sure of his stand say rest his fork
1736,"""Wouldn't they look charming against your lace?""",would not they look charm against your lace
1737,Miss Brush resented this familiarity intensely.,miss brush resent this familiarity intensely
1738,She thought him an underbred fellow.,she think him a underbred fellow
1739,She made Lady Bruton laugh.,she make lady bruton laugh
1740,"Lady Bruton raised the carnations, holding them rather stiffly with much the same attitude with which the General held the scroll in the picture behind her; she remained fixed, tranced.",lady bruton raise the carnation hold them rather stiffly with much the same attitude with which the general hold the scroll in the picture behind her she remain fix tranced
1741,"Which was she now, the General's great-grand-daughter?",which be she now the general s great grand daughter
1742,great-great-grand-daughter?,great great grand daughter
1743,Richard Dalloway asked himself.,richard dalloway ask himself
1744,"Sir Roderick, Sir Miles, Sir Talbot--that was it.",sir roderick sir mile sir talbot that be it
1745,It was remarkable how in that family the likeness persisted in the women.,it be remarkable how in that family the likeness persist in the woman
1746,She should have been a general of dragoons herself.,she should have be a general of dragoon herself
1747,"And Richard would have served under her, cheerfully; he had the greatest respect for her; he cherished these romantic views about well-set-up old women of pedigree, and would have liked, in his good-humoured way, to bring some young hot-heads of his acquaintance to lunch with her; as if a type like hers could be bred of amiable tea-drinking enthusiasts!",and richard would have serve under her cheerfully he have the great respect for her he cherish this romantic view about good set up old woman of pedigree and would have like in his good humour way to bring some young hot head of his acquaintance to lunch with her a if a type like hers can be breed of amiable tea drink enthusiast
1748,He knew her country.,he know her country
1749,He knew her people.,he know her people
1750,"There was a vine, still bearing, which either Lovelace or Herrick--she never read a word poetry of herself, but so the story ran--had sat under.",there be a vine still bear which either lovelace or herrick she never read a word poetry of herself but so the story run have sit under
1751,"Better wait to put before them the question that bothered her (about making an appeal to the public; if so, in what terms and so on), better wait until they have had their coffee, Lady Bruton thought; and so laid the carnations down beside her plate.",well wait to put before them the question that bother her about make a appeal to the public if so in what term and so on well wait until they have have their coffee lady bruton think and so lay the carnation down beside her plate
1752,"""How's Clarissa?""",how be clarissa
1753,she asked abruptly.,she ask abruptly
1754,Clarissa always said that Lady Bruton did not like her.,clarissa always say that lady bruton do not like her
1755,"Indeed, Lady Bruton had the reputation of being more interested in politics than people; of talking like a man; of having had a finger in some notorious intrigue of the eighties, which was now beginning to be mentioned in memoirs.",indeed lady bruton have the reputation of be much interest in politic than people of talk like a man of have have a finger in some notorious intrigue of the eighty which be now begin to be mention in memoir
1756,"Certainly there was an alcove in her drawing-room, and a table in that alcove, and a photograph upon that table of General Sir Talbot Moore, now deceased, who had written there (one evening in the eighties) in Lady Bruton's presence, with her cognisance, perhaps advice, a telegram ordering the British troops to advance upon an historical occasion.",certainly there be a alcove in her draw room and a table in that alcove and a photograph upon that table of general sir talbot moore now decease who have write there one even in the eighty in lady bruton s presence with her cognisance perhaps advice a telegram order the british troop to advance upon a historical occasion
1757,(She kept the pen and told the story.),she keep the pen and tell the story
1758,"Thus, when she said in her offhand way ""How's Clarissa?""",thus when she say in her offhand way how be clarissa
1759,"husbands had difficulty in persuading their wives and indeed, however devoted, were secretly doubtful themselves, of her interest in women who often got in their husbands' way, prevented them from accepting posts abroad, and had to be taken to the seaside in the middle of the session to recover from influenza.",husband have difficulty in persuade their wife and indeed however devote be secretly doubtful themselves of her interest in woman who often get in their husband way prevent them from accept post abroad and have to be take to the seaside in the middle of the session to recover from influenza
1760,"Nevertheless her inquiry, ""How's Clarissa?""",nevertheless her inquiry how be clarissa
1761,"was known by women infallibly, to be a signal from a well-wisher, from an almost silent companion, whose utterances (half a dozen perhaps in the course of a lifetime) signified recognition of some feminine comradeship which went beneath masculine lunch parties and united Lady Bruton and Mrs. Dalloway, who seldom met, and appeared when they did meet indifferent and even hostile, in a singular bond.",be know by woman infallibly to be a signal from a good wisher from a almost silent companion whose utterance half a dozen perhaps in the course of a lifetime signify recognition of some feminine comradeship which go beneath masculine lunch party and unite lady bruton and mrs dalloway who seldom meet and appear when they do meet indifferent and even hostile in a singular bond
1762,"""I met Clarissa in the Park this morning,"" said Hugh Whitbread, diving into the casserole, anxious to pay himself this little tribute, for he had only to come to London and he met everybody at once; but greedy, one of the greediest men she had ever known, Milly Brush thought, who observed men with unflinching rectitude, and was capable of everlasting devotion, to her own sex in particular, being knobbed, scraped, angular, and entirely without feminine charm.",i meet clarissa in the park this morning say hugh whitbread dive into the casserole anxious to pay himself this little tribute for he have only to come to london and he meet everybody at once but greedy one of the greedy man she have ever know milly brush think who observe man with unflinching rectitude and be capable of everlasting devotion to her own sex in particular be knob scrape angular and entirely without feminine charm
1763,"""D'you know who's in town?""",have you know who be in town
1764,said Lady Bruton suddenly bethinking her.,say lady bruton suddenly bethink her
1765,"""Our old friend, Peter Walsh.""",our old friend peter walsh
1766,They all smiled.,they all smile
1767,Peter Walsh!,peter walsh
1768,"And Mr. Dalloway was genuinely glad, Milly Brush thought; and Mr. Whitbread thought only of his chicken.",and mr dalloway be genuinely glad milly brush think and mr whitbread think only of his chicken
1769,Peter Walsh!,peter walsh
1770,"All three, Lady Bruton, Hugh Whitbread, and Richard Dalloway, remembered the same thing--how passionately Peter had been in love; been rejected; gone to India; come a cropper; made a mess of things; and Richard Dalloway had a very great liking for the dear old fellow too.",all three lady bruton hugh whitbread and richard dalloway remember the same thing how passionately peter have be in love be reject go to india come a cropper make a mess of thing and richard dalloway have a very great like for the dear old fellow too
1771,"Milly Brush saw that; saw a depth in the brown of his eyes; saw him hesitate; consider; which interested her, as Mr. Dalloway always interested her, for what was he thinking, she wondered, about Peter Walsh?",milly brush see that see a depth in the brown of his eye see him hesitate consider which interest her a mr dalloway always interest her for what be he think she wonder about peter walsh
1772,"That Peter Walsh had been in love with Clarissa; that he would go back directly after lunch and find Clarissa; that he would tell her, in so many words, that he loved her.",that peter walsh have be in love with clarissa that he would go back directly after lunch and find clarissa that he would tell her in so many word that he love her
1773,"Yes, he would say that.",yes he would say that
1774,Milly Brush once might almost have fallen in love with these silences; and Mr. Dalloway was always so dependable; such a gentleman too.,milly brush once may almost have fall in love with this silence and mr dalloway be always so dependable such a gentleman too
1775,"Now, being forty, Lady Bruton had only to nod, or turn her head a little abruptly, and Milly Brush took the signal, however deeply she might be sunk in these reflections of a detached spirit, of an uncorrupted soul whom life could not bamboozle, because life had not offered her a trinket of the slightest value; not a curl, smile, lip, cheek, nose; nothing whatever; Lady Bruton had only to nod, and Perkins was instructed to quicken the coffee.",now be forty lady bruton have only to nod or turn her head a little abruptly and milly brush take the signal however deeply she may be sink in this reflection of a detach spirit of a uncorrupted soul whom life can not bamboozle because life have not offer her a trinket of the slight value not a curl smile lip cheek nose nothing whatever lady bruton have only to nod and perkins be instruct to quicken the coffee
1776,"""Yes; Peter Walsh has come back,"" said Lady Bruton.",yes peter walsh have come back say lady bruton
1777,It was vaguely flattering to them all.,it be vague flatter to them all
1778,"He had come back, battered, unsuccessful, to their secure shores.",he have come back batter unsuccessful to their secure shore
1779,"But to help him, they reflected, was impossible; there was some flaw in his character.",but to help him they reflect be impossible there be some flaw in his character
1780,Hugh Whitbread said one might of course mention his name to So-and-so.,hugh whitbread say one may of course mention his name to so and so
1781,"He wrinkled lugubriously, consequentially, at the thought of the letters he would write to the heads of Government offices about ""my old friend, Peter Walsh,"" and so on.",he wrinkle lugubriously consequentially at the think of the letter he would write to the head of government office about my old friend peter walsh and so on
1782,"But it wouldn't lead to anything--not to anything permanent, because of his character.",but it would not lead to anything not to anything permanent because of his character
1783,"""In trouble with some woman,"" said Lady Bruton.",in trouble with some woman say lady bruton
1784,They had all guessed that that was at the bottom of it.,they have all guess that that be at the bottom of it
1785,"""However,"" said Lady Bruton, anxious to leave the subject, ""we shall hear the whole story from Peter himself.""",however say lady bruton anxious to leave the subject we shall hear the whole story from peter himself
1786,(The coffee was very slow in coming.),the coffee be very slow in come
1787,"""The address?""",the address
