,text_raw,text_clean
0,Mrs. Dalloway said she would buy the flowers herself.,mrs dalloway say she would buy the flower herself
1,For Lucy had her work cut out for her.,for lucy have her work cut out for her
2,The doors would be taken off their hinges; Rumpelmayer's men were coming.,the door would be take off their hinge rumpelmayer s man be come
3,"And then, thought Clarissa Dalloway, what a morning--fresh as if issued to children on a beach.",and then think clarissa dalloway what a morning fresh a if issue to child on a beach
4,What a lark!,what a lark
5,What a plunge!,what a plunge
6,"For so it had always seemed to her, when, with a little squeak of the hinges, which she could hear now, she had burst open the French windows and plunged at Bourton into the open air.",for so it have always seem to her when with a little squeak of the hinge which she can hear now she have burst open the french window and plunge at bourton into the open air
7,"How fresh, how calm, stiller than this of course, the air was in the early morning; like the flap of a wave; the kiss of a wave; chill and sharp and yet (for a girl of eighteen as she then was) solemn, feeling as she did, standing there at the open window, that something awful was about to happen; looking at the flowers, at the trees with the smoke winding off them and the rooks rising, falling; standing and looking until Peter Walsh said, ""Musing among the vegetables?""",how fresh how calm still than this of course the air be in the early morning like the flap of a wave the kiss of a wave chill and sharp and yet for a girl of eighteen a she then be solemn feel a she do stand there at the open window that something awful be about to happen look at the flower at the tree with the smoke wind off them and the rook rise fall stand and look until peter walsh say muse among the vegetable
8,"--was that it?--""I prefer men to cauliflowers""--was that it?",be that it i prefer man to cauliflower be that it
9,He must have said it at breakfast one morning when she had gone out on to the terrace--Peter Walsh.,he must have say it at breakfast one morning when she have go out on to the terrace peter walsh
10,"He would be back from India one of these days, June or July, she forgot which, for his letters were awfully dull; it was his sayings one remembered; his eyes, his pocket-knife, his smile, his grumpiness and, when millions of things had utterly vanished--how strange it was!--a few sayings like this about cabbages.",he would be back from india one of this day june or july she forget which for his letter be awfully dull it be his saying one remember his eye his pocket knife his smile his grumpiness and when million of thing have utterly vanish how strange it be a few saying like this about cabbage
11,"She stiffened a little on the kerb, waiting for Durtnall's van to pass.",she stiffen a little on the kerb wait for durtnall s van to pass
12,"A charming woman, Scrope Purvis thought her (knowing her as one does know people who live next door to one in Westminster); a touch of the bird about her, of the jay, blue-green, light, vivacious, though she was over fifty, and grown very white since her illness.",a charm woman scrope purvis think her know her a one doe know people who live next door to one in westminster a touch of the bird about her of the jay blue green light vivacious though she be over fifty and grow very white since her illness
13,"There she perched, never seeing him, waiting to cross, very upright.",there she perch never see him wait to cross very upright
14,For having lived in Westminster--how many years now?,for have live in westminster how many year now
15,"over twenty,--one feels even in the midst of the traffic, or waking at night, Clarissa was positive, a particular hush, or solemnity; an indescribable pause; a suspense (but that might be her heart, affected, they said, by influenza) before Big Ben strikes.",over twenty one feel even in the midst of the traffic or wake at night clarissa be positive a particular hush or solemnity a indescribable pause a suspense but that may be her heart affect they say by influenza before big ben strike
16,There!,there
17,Out it boomed.,out it boom
18,"First a warning, musical; then the hour, irrevocable.",﻿1 a warn musical then the hour irrevocable
19,The leaden circles dissolved in the air.,the leaden circle dissolve in the air
20,"Such fools we are, she thought, crossing Victoria Street.",such fool we be she think cross victoria street
21,"For Heaven only knows why one loves it so, how one sees it so, making it up, building it round one, tumbling it, creating it every moment afresh; but the veriest frumps, the most dejected of miseries sitting on doorsteps (drink their downfall) do the same; can't be dealt with, she felt positive, by Acts of Parliament for that very reason: they love life.",for heaven only know why one love it so how one see it so make it up build it round one tumble it create it every moment afresh but the veriest frump the much deject of misery sit on doorstep drink their downfall do the same can not be deal with she feel positive by act of parliament for that very reason they love life
22,"In people's eyes, in the swing, tramp, and trudge; in the bellow and the uproar; the carriages, motor cars, omnibuses, vans, sandwich men shuffling and swinging; brass bands; barrel organs; in the triumph and the jingle and the strange high singing of some aeroplane overhead was what she loved; life; London; this moment of June.",in people s eye in the swing tramp and trudge in the bellow and the uproar the carriage motor car omnibus van sandwich man shuffle and swinge brass band barrel organ in the triumph and the jingle and the strange high singe of some aeroplane overhead be what she love life london this moment of june
23,For it was the middle of June.,for it be the middle of june
24,"The War was over, except for some one like Mrs. Foxcroft at the Embassy last night eating her heart out because that nice boy was killed and now the old Manor House must go to a cousin; or Lady Bexborough who opened a bazaar, they said, with the telegram in her hand, John, her favourite, killed; but it was over; thank Heaven--over.",the war be over except for some one like mrs foxcroft at the embassy last night eat her heart out because that nice boy be kill and now the old manor house must go to a cousin or lady bexborough who open a bazaar they say with the telegram in her hand john her favourite kill but it be over thank heaven over
25,It was June.,it be june
26,The King and Queen were at the Palace.,the king and queen be at the palace
27,"And everywhere, though it was still so early, there was a beating, a stirring of galloping ponies, tapping of cricket bats; Lords, Ascot, Ranelagh and all the rest of it; wrapped in the soft mesh of the grey-blue morning air, which, as the day wore on, would unwind them, and set down on their lawns and pitches the bouncing ponies, whose forefeet just struck the ground and up they sprung, the whirling young men, and laughing girls in their transparent muslins who, even now, after dancing all night, were taking their absurd woolly dogs for a run; and even now, at this hour, discreet old dowagers were shooting out in their motor cars on errands of mystery; and the shopkeepers were fidgeting in their windows with their paste and diamonds, their lovely old sea-green brooches in eighteenth-century settings to tempt Americans (but one must economise, not buy things rashly for Elizabeth), and she, too, loving it as she did with an absurd and faithful passion, being part of it, since her people were courtiers once in the time of the Georges, she, too, was going that very night to kindle and illuminate; to give her party.",and everywhere though it be still so early there be a beat a stir of gallop pony tap of cricket bat lord ascot ranelagh and all the rest of it wrap in the soft mesh of the grey blue morning air which a the day wear on would unwind them and set down on their lawn and pitch the bounce pony whose forefoot just strike the grind and up they spring the whirl young man and laugh girl in their transparent muslins who even now after dance all night be take their absurd woolly dog for a run and even now at this hour discreet old dowager be shoot out in their motor car on errand of mystery and the shopkeeper be fidget in their window with their paste and diamond their lovely old sea green brooch in 18 century setting to tempt americans but one must economise not buy thing rashly for elizabeth and she too love it a she do with a absurd and faithful passion be part of it since her people be courtier once in the time of the georges she too be go that very night to kindle and illuminate to give her party
28,"But how strange, on entering the Park, the silence; the mist; the hum; the slow-swimming happy ducks; the pouched birds waddling; and who should be coming along with his back against the Government buildings, most appropriately, carrying a despatch box stamped with the Royal Arms, who but Hugh Whitbread; her old friend Hugh--the admirable Hugh!",but how strange on enter the park the silence the mist the hum the slow swim happy duck the pouch bird waddle and who should be come along with his back against the government building much appropriately carry a despatch box stamp with the royal arm who but hugh whitbread her old friend hugh the admirable hugh
29,"""Good-morning to you, Clarissa!""",good morning to you clarissa
30,"said Hugh, rather extravagantly, for they had known each other as children.",say hugh rather extravagantly for they have know each other a child
31,"""Where are you off to?""",where be you off to
32,"""I love walking in London,"" said Mrs. Dalloway.",i love walk in london say mrs dalloway
33,"""Really it's better than walking in the country.""",really it be well than walk in the country
34,They had just come up--unfortunately--to see doctors.,they have just come up unfortunately to see doctor
35,"Other people came to see pictures; go to the opera; take their daughters out; the Whitbreads came ""to see doctors.""",other people come to see picture go to the opus take their daughter out the whitbreads come to see doctor
36,Times without number Clarissa had visited Evelyn Whitbread in a nursing home.,time without numb clarissa have visit evelyn whitbread in a nurse home
37,Was Evelyn ill again?,be evelyn ill again
38,"Evelyn was a good deal out of sorts, said Hugh, intimating by a kind of pout or swell of his very well-covered, manly, extremely handsome, perfectly upholstered body (he was almost too well dressed always, but presumably had to be, with his little job at Court) that his wife had some internal ailment, nothing serious, which, as an old friend, Clarissa Dalloway would quite understand without requiring him to specify.",evelyn be a good deal out of sort say hugh intimate by a kind of pout or swell of his very good cover manly extremely handsome perfectly upholster body he be almost too good dress always but presumably have to be with his little job at court that his wife have some internal ailment nothing serious which a a old friend clarissa dalloway would quite understand without require him to specify
39,"Ah yes, she did of course; what a nuisance; and felt very sisterly and oddly conscious at the same time of her hat.",ah yes she do of course what a nuisance and feel very sisterly and oddly conscious at the same time of her hat
40,"Not the right hat for the early morning, was that it?",not the right hat for the early morning be that it
41,"For Hugh always made her feel, as he bustled on, raising his hat rather extravagantly and assuring her that she might be a girl of eighteen, and of course he was coming to her party to-night, Evelyn absolutely insisted, only a little late he might be after the party at the Palace to which he had to take one of Jim's boys,--she always felt a little skimpy beside Hugh; schoolgirlish; but attached to him, partly from having known him always, but she did think him a good sort in his own way, though Richard was nearly driven mad by him, and as for Peter Walsh, he had never to this day forgiven her for liking him.",for hugh always make her feel a he bustle on raise his hat rather extravagantly and assure her that she may be a girl of eighteen and of course he be come to her party to night evelyn absolutely insist only a little late he may be after the party at the palace to which he have to take one of jim s boy she always feel a little skimpy beside hugh schoolgirlish but attach to him partly from have know him always but she do think him a good sort in his own way though richard be nearly drive mad by him and a for peter walsh he have never to this day forgive her for like him
42,"She could remember scene after scene at Bourton--Peter furious; Hugh not, of course, his match in any way, but still not a positive imbecile as Peter made out; not a mere barber's block.",she can remember scene after scene at bourton peter furious hugh not of course his match in any way but still not a positive imbecile a peter make out not a mere barber s block
43,"When his old mother wanted him to give up shooting or to take her to Bath he did it, without a word; he was really unselfish, and as for saying, as Peter did, that he had no heart, no brain, nothing but the manners and breeding of an English gentleman, that was only her dear Peter at his worst; and he could be intolerable; he could be impossible; but adorable to walk with on a morning like this.",when his old mother want him to give up shoot or to take her to bath he do it without a word he be really unselfish and a for say a peter do that he have no heart no brain nothing but the manner and breed of a english gentleman that be only her dear peter at his wrong and he can be intolerable he can be impossible but adorable to walk with on a morning like this
44,(June had drawn out every leaf on the trees.,june have draw out every leaf on the tree
45,The mothers of Pimlico gave suck to their young.,the mother of pimlico give suck to their young
46,Messages were passing from the Fleet to the Admiralty.,message be pass from the fleet to the admiralty
47,"Arlington Street and Piccadilly seemed to chafe the very air in the Park and lift its leaves hotly, brilliantly, on waves of that divine vitality which Clarissa loved.",arlington street and piccadilly seem to chafe the very air in the park and lift its leave hotly brilliantly on wave of that divine vitality which clarissa love
48,"To dance, to ride, she had adored all that.)",to dance to ride she have adore all that
49,"For they might be parted for hundreds of years, she and Peter; she never wrote a letter and his were dry sticks; but suddenly it would come over her, If he were with me now what would he say?--some days, some sights bringing him back to her calmly, without the old bitterness; which perhaps was the reward of having cared for people; they came back in the middle of St. James's Park on a fine morning--indeed they did.",for they may be part for hundred of year she and peter she never write a letter and his be dry stick but suddenly it would come over her if he be with me now what would he say some day some sight bring him back to her calmly without the old bitterness which perhaps be the reward of have care for people they come back in the middle of st james s park on a fine morning indeed they do
50,"But Peter--however beautiful the day might be, and the trees and the grass, and the little girl in pink--Peter never saw a thing of all that.",but peter however beautiful the day may be and the tree and the grass and the little girl in pink peter never see a thing of all that
51,"He would put on his spectacles, if she told him to; he would look.",he would put on his spectacle if she tell him to he would look
52,"It was the state of the world that interested him; Wagner, Pope's poetry, people's characters eternally, and the defects of her own soul.",it be the state of the world that interest him wagner pope s poetry people s character eternally and the defect of her own soul
53,How he scolded her!,how he scold her
54,How they argued!,how they argue
55,"She would marry a Prime Minister and stand at the top of a staircase; the perfect hostess he called her (she had cried over it in her bedroom), she had the makings of the perfect hostess, he said.",she would marry a prime minister and stand at the top of a staircase the perfect hostess he call her she have cry over it in her bedroom she have the making of the perfect hostess he say
56,"So she would still find herself arguing in St. James's Park, still making out that she had been right--and she had too--not to marry him.",so she would still find herself argue in st james s park still make out that she have be right and she have too not to marry him
57,"For in marriage a little licence, a little independence there must be between people living together day in day out in the same house; which Richard gave her, and she him.",for in marriage a little licence a little independence there must be between people live together day in day out in the same house which richard give her and she him
58,(Where was he this morning for instance?,where be he this morning for instance
59,"Some committee, she never asked what.)",some committee she never ask what
60,But with Peter everything had to be shared; everything gone into.,but with peter everything have to be share everything go into
61,"And it was intolerable, and when it came to that scene in the little garden by the fountain, she had to break with him or they would have been destroyed, both of them ruined, she was convinced; though she had borne about with her for years like an arrow sticking in her heart the grief, the anguish; and then the horror of the moment when some one told her at a concert that he had married a woman met on the boat going to India!",and it be intolerable and when it come to that scene in the little garden by the fountain she have to break with him or they would have be destroy both of them ruin she be convince though she have bear about with her for year like a arrow stick in her heart the grief the anguish and then the horror of the moment when some one tell her at a concert that he have marry a woman meet on the boat go to india
62,Never should she forget all that!,never should she forget all that
63,"Cold, heartless, a prude, he called her.",cold heartless a prude he call her
64,Never could she understand how he cared.,never can she understand how he care
65,"But those Indian women did presumably--silly, pretty, flimsy nincompoops.",but that indian woman do presumably silly pretty flimsy nincompoop
66,And she wasted her pity.,and she waste her pity
67,"For he was quite happy, he assured her--perfectly happy, though he had never done a thing that they talked of; his whole life had been a failure.",for he be quite happy he assure her perfectly happy though he have never do a thing that they talk of his whole life have be a failure
68,It made her angry still.,it make her angry still
69,She had reached the Park gates.,she have reach the park gate
70,"She stood for a moment, looking at the omnibuses in Piccadilly.",she stand for a moment look at the omnibus in piccadilly
71,She would not say of any one in the world now that they were this or were that.,she would not say of any one in the world now that they be this or be that
72,She felt very young; at the same time unspeakably aged.,she feel very young at the same time unspeakably age
73,"She sliced like a knife through everything; at the same time was outside, looking on.",she slice like a knife through everything at the same time be outside look on
74,"She had a perpetual sense, as she watched the taxi cabs, of being out, out, far out to sea and alone; she always had the feeling that it was very, very dangerous to live even one day.",she have a perpetual sense a she watch the taxi cab of be out out far out to sea and alone she always have the feel that it be very very dangerous to live even one day
75,"Not that she thought herself clever, or much out of the ordinary.",not that she think herself clever or much out of the ordinary
76,How she had got through life on the few twigs of knowledge Frulein Daniels gave them she could not think.,how she have get through life on the few twig of knowledge frulein daniels give them she can not think
77,"She knew nothing; no language, no history; she scarcely read a book now, except memoirs in bed; and yet to her it was absolutely absorbing; all this; the cabs passing; and she would not say of Peter, she would not say of herself, I am this, I am that.",she know nothing no language no history she scarcely read a book now except memoir in bed and yet to her it be absolutely absorb all this the cab pass and she would not say of peter she would not say of herself i be this i be that
78,"Her only gift was knowing people almost by instinct, she thought, walking on.",her only gift be know people almost by instinct she think walk on
79,"If you put her in a room with some one, up went her back like a cat's; or she purred.",if you put her in a room with some one up go her back like a cat s or she purr
80,"Devonshire House, Bath House, the house with the china cockatoo, she had seen them all lit up once; and remembered Sylvia, Fred, Sally Seton--such hosts of people; and dancing all night; and the waggons plodding past to market; and driving home across the Park.",devonshire house bath house the house with the china cockatoo she have see them all light up once and remember sylvia fred sally seton such host of people and dance all night and the waggon plod past to market and drive home across the park
81,She remembered once throwing a shilling into the Serpentine.,she remember once throw a shilling into the serpentine
82,"But every one remembered; what she loved was this, here, now, in front of her; the fat lady in the cab.",but every one remember what she love be this here now in front of her the fat lady in the cab
83,"Did it matter then, she asked herself, walking towards Bond Street, did it matter that she must inevitably cease completely; all this must go on without her; did she resent it; or did it not become consoling to believe that death ended absolutely?",do it matt then she ask herself walk towards bond street do it matt that she must inevitably cease completely all this must go on without her do she resend it or do it not become console to believe that death end absolutely
84,"but that somehow in the streets of London, on the ebb and flow of things, here, there, she survived, Peter survived, lived in each other, she being part, she was positive, of the trees at home; of the house there, ugly, rambling all to bits and pieces as it was; part of people she had never met; being laid out like a mist between the people she knew best, who lifted her on their branches as she had seen the trees lift the mist, but it spread ever so far, her life, herself.",but that somehow in the street of london on the ebb and flow of thing here there she survive peter survive live in each other she be part she be positive of the tree at home of the house there ugly ramble all to bit and piece a it be part of people she have never meet be lay out like a mist between the people she know well who lift her on their branch a she have see the tree lift the mist but it spread ever so far her life herself
85,But what was she dreaming as she looked into Hatchards' shop window?,but what be she dream a she look into hatchards shop window
86,What was she trying to recover?,what be she try to recover
87,"What image of white dawn in the country, as she read in the book spread open:",what image of white dawn in the country a she read in the book spread open
88,Fear no more the heat o' the sun     Nor the furious winter's rages.,fear no much the heat of the sun nor the furious winter s rage
89,"This late age of the world's experience had bred in them all, all men and women, a well of tears.",this late age of the world s experience have breed in them all all man and woman a good of tear
90,Tears and sorrows; courage and endurance; a perfectly upright and stoical bearing.,tear and sorrow courage and endurance a perfectly upright and stoic bear
91,"Think, for example, of the woman she admired most, Lady Bexborough, opening the bazaar.",think for example of the woman she admire much lady bexborough open the bazaar
92,"There were Jorrocks' Jaunts and Jollities; there were Soapy Sponge and Mrs. Asquith's Memoirs and Big Game Shooting in Nigeria, all spread open.",there be jorrocks jaunt and jollities there be soapy sponge and mrs asquith s memoir and big game shoot in nigeria all spread open
93,Ever so many books there were; but none that seemed exactly right to take to Evelyn Whitbread in her nursing home.,ever so many book there be but none that seem exactly right to take to evelyn whitbread in her nurse home
94,"Nothing that would serve to amuse her and make that indescribably dried-up little woman look, as Clarissa came in, just for a moment cordial; before they settled down for the usual interminable talk of women's ailments.",nothing that would serve to amuse her and make that indescribably dry up little woman look a clarissa come in just for a moment cordial before they settle down for the usual interminable talk of woman s ailment
95,"How much she wanted it--that people should look pleased as she came in, Clarissa thought and turned and walked back towards Bond Street, annoyed, because it was silly to have other reasons for doing things.",how much she want it that people should look please a she come in clarissa think and turn and walk back towards bond street annoy because it be silly to have other reason for do thing
