,text_raw,text_clean
2494,"Miracles, revelations, agonies, loneliness, falling through the sea, down, down into the flames, all were burnt out, for he had a sense, as he watched Rezia trimming the straw hat for Mrs. Peters, of a coverlet of flowers.",miracle revelation agony loneliness fall through the sea down down into the flame all be burn out for he have a sense a he watch rezia trim the straw hat for mrs peter of a coverlet of flower
2495,"""It's too small for Mrs. Peters,"" said Septimus.",it be too small for mrs peter say septimus
2496,For the first time for days he was speaking as he used to do!,for the ﻿1 time for day he be speak a he use to do
2497,"Of course it was--absurdly small, she said.",of course it be absurdly small she say
2498,But Mrs. Peters had chosen it.,but mrs peter have choose it
2499,He took it out of her hands.,he take it out of her hand
2500,He said it was an organ grinder's monkey's hat.,he say it be a organ grinder s monkey s hat
2501,How it rejoiced her that!,how it rejoice her that
2502,"Not for weeks had they laughed like this together, poking fun privately like married people.",not for week have they laugh like this together poke fun privately like marry people
2503,"What she meant was that if Mrs. Filmer had come in, or Mrs. Peters or anybody they would not have understood what she and Septimus were laughing at.",what she mean be that if mrs filmer have come in or mrs peter or anybody they would not have understand what she and septimus be laugh at
2504,"""There,"" she said, pinning a rose to one side of the hat.",there she say pin a rise to one side of the hat
2505,Never had she felt so happy!,never have she feel so happy
2506,Never in her life!,never in her life
2507,"But that was still more ridiculous, Septimus said.",but that be still much ridiculous septimus say
2508,Now the poor woman looked like a pig at a fair.,now the poor woman look like a pig at a fair
2509,(Nobody ever made her laugh as Septimus did.),nobody ever make her laugh a septimus do
2510,What had she got in her work-box?,what have she get in her work box
2511,"She had ribbons and beads, tassels, artificial flowers.",she have ribbon and bead tassel artificial flower
2512,She tumbled them out on the table.,she tumble them out on the table
2513,"He began putting odd colours together--for though he had no fingers, could not even do up a parcel, he had a wonderful eye, and often he was right, sometimes absurd, of course, but sometimes wonderfully right.",he begin putt odd colour together for though he have no finger can not even do up a parcel he have a wonderful eye and often he be right sometimes absurd of course but sometimes wonderfully right
2514,"""She shall have a beautiful hat!""",she shall have a beautiful hat
2515,"he murmured, taking up this and that, Rezia kneeling by his side, looking over his shoulder.",he murmur take up this and that rezia kneel by his side look over his shoulder
2516,Now it was finished--that is to say the design; she must stitch it together.,now it be finish that be to say the design she must stitch it together
2517,"But she must be very, very careful, he said, to keep it just as he had made it.",but she must be very very careful he say to keep it just a he have make it
2518,So she sewed.,so she sew
2519,"When she sewed, he thought, she made a sound like a kettle on the hob; bubbling, murmuring, always busy, her strong little pointed fingers pinching and poking; her needle flashing straight.",when she sew he think she make a sound like a kettle on the hob bubble murmur always busy her strong little point finger pinch and poke her needle flash straight
2520,"The sun might go in and out, on the tassels, on the wall-paper, but he would wait, he thought, stretching out his feet, looking at his ringed sock at the end of the sofa; he would wait in this warm place, this pocket of still air, which one comes on at the edge of a wood sometimes in the evening, when, because of a fall in the ground, or some arrangement of the trees (one must be scientific above all, scientific), warmth lingers, and the air buffets the cheek like the wing of a bird.",the sun may go in and out on the tassel on the wall paper but he would wait he think stretch out his foot look at his ring sock at the end of the sofa he would wait in this warm place this pocket of still air which one come on at the edge of a wood sometimes in the even when because of a fall in the grind or some arrangement of the tree one must be scientific above all scientific warmth linger and the air buffet the cheek like the wing of a bird
2521,"""There it is,"" said Rezia, twirling Mrs. Peters' hat on the tips of her fingers.",there it be say rezia twirl mrs peter hat on the tip of her finger
2522,"""That'll do for the moment.",that will do for the moment
2523,Later .,late
2524,". ."" her sentence bubbled away drip, drip, drip, like a contented tap left running.",her sentence bubble away drip drip drip like a content tap leave run
2525,It was wonderful.,it be wonderful
2526,Never had he done anything which made him feel so proud.,never have he do anything which make him feel so proud
2527,"It was so real, it was so substantial, Mrs. Peters' hat.",it be so real it be so substantial mrs peter hat
2528,"""Just look at it,"" he said.",just look at it he say
2529,"Yes, it would always make her happy to see that hat.",yes it would always make her happy to see that hat
2530,"He had become himself then, he had laughed then.",he have become himself then he have laugh then
2531,They had been alone together.,they have be alone together
2532,Always she would like that hat.,always she would like that hat
2533,He told her to try it on.,he tell her to try it on
2534,"""But I must look so queer!""",but i must look so queer
2535,"she cried, running over to the glass and looking first this side then that.",she cry run over to the glass and look ﻿1 this side then that
2536,"Then she snatched it off again, for there was a tap at the door.",then she snatch it off again for there be a tap at the door
2537,Could it be Sir William Bradshaw?,can it be sir william bradshaw
2538,Had he sent already?,have he send already
2539,it was only the small girl with the evening paper.,it be only the small girl with the even paper
2540,"What always happened, then happened--what happened every night of their lives.",what always happen then happen what happen every night of their live
2541,The small girl sucked her thumb at the door; Rezia went down on her knees; Rezia cooed and kissed; Rezia got a bag of sweets out of the table drawer.,the small girl suck her thumb at the door rezia go down on her knee rezia coo and kiss rezia get a bag of sweet out of the table drawer
2542,For so it always happened.,for so it always happen
2543,"First one thing, then another.",﻿1 one thing then another
2544,"So she built it up, first one thing and then another.",so she build it up ﻿1 one thing and then another
2545,"Dancing, skipping, round and round the room they went.",dance skip round and round the room they go
2546,He took the paper.,he take the paper
2547,"Surrey was all out, he read.",surrey be all out he read
2548,There was a heat wave.,there be a heat wave
2549,Rezia repeated: Surrey was all out.,rezia repeat surrey be all out
2550,"There was a heat wave, making it part of the game she was playing with Mrs. Filmer's grandchild, both of them laughing, chattering at the same time, at their game.",there be a heat wave make it part of the game she be play with mrs filmer s grandchild both of them laugh chatter at the same time at their game
2551,He was very tired.,he be very tire
2552,He was very happy.,he be very happy
2553,He would sleep.,he would sleep
2554,He shut his eyes.,he shut his eye
2555,"But directly he saw nothing the sounds of the game became fainter and stranger and sounded like the cries of people seeking and not finding, and passing further and further away.",but directly he see nothing the sound of the game become faint and strange and sound like the cry of people seek and not find and pass far and far away
2556,They had lost him!,they have lose him
2557,He started up in terror.,he start up in terror
2558,What did he see?,what do he see
2559,The plate of bananas on the sideboard.,the plate of banana on the sideboard
2560,Nobody was there (Rezia had taken the child to its mother.,nobody be there rezia have take the child to its mother
2561,It was bedtime).,it be bedtime
2562,That was it: to be alone forever.,that be it to be alone forever
2563,That was the doom pronounced in Milan when he came into the room and saw them cutting out buckram shapes with their scissors; to be alone forever.,that be the doom pronounce in milan when he come into the room and see them cut out buckram shape with their scissor to be alone forever
2564,He was alone with the sideboard and the bananas.,he be alone with the sideboard and the banana
2565,"He was alone, exposed on this bleak eminence, stretched out--but not on a hill-top; not on a crag; on Mrs. Filmer's sitting-room sofa.",he be alone expose on this bleak eminence stretch out but not on a hill top not on a crag on mrs filmer s sit room sofa
2566,"As for the visions, the faces, the voices of the dead, where were they?",a for the vision the face the voice of the dead where be they
2567,"There was a screen in front of him, with black bulrushes and blue swallows.",there be a screen in front of him with black bulrush and blue swallow
2568,"Where he had once seen mountains, where he had seen faces, where he had seen beauty, there was a screen.",where he have once see mountain where he have see face where he have see beauty there be a screen
2569,"""Evans!""",evans
2570,he cried.,he cry
2571,There was no answer.,there be no answer
2572,"A mouse had squeaked, or a curtain rustled.",a mouse have squeak or a curtain rustle
2573,Those were the voices of the dead.,that be the voice of the dead
2574,"The screen, the coalscuttle, the sideboard remained to him.",the screen the coalscuttle the sideboard remain to him
2575,"Let him then face the screen, the coal-scuttle and the sideboard .",let him then face the screen the coal scuttle and the sideboard
2576,. . but Rezia burst into the room chattering.,but rezia burst into the room chatter
2577,Some letter had come.,some letter have come
2578,Everybody's plans were changed.,everybody s plan be change
2579,Mrs. Filmer would not be able to go to Brighton after all.,mrs filmer would not be able to go to brighton after all
2580,"There was no time to let Mrs. Williams know, and really Rezia thought it very, very annoying, when she caught sight of the hat and thought .",there be no time to let mrs williams know and really rezia think it very very annoy when she catch sight of the hat and think
2581,. . perhaps .,perhaps
2582,. . she .,she
2583,. . might just make a little.,may just make a little
2584,Her voice died out in contented melody.,her voice die out in content melody
2585,"""Ah, damn!""",ah damn
2586,"she cried (it was a joke of theirs, her swearing), the needle had broken.",she cry it be a joke of theirs her swear the needle have break
2587,"Hat, child, Brighton, needle.",hat child brighton needle
2588,"She built it up; first one thing, then another, she built it up, sewing.",she build it up ﻿1 one thing then another she build it up sew
2589,She wanted him to say whether by moving the rose she had improved the hat.,she want him to say whether by move the rise she have improve the hat
2590,She sat on the end of the sofa.,she sit on the end of the sofa
2591,"They were perfectly happy now, she said, suddenly, putting the hat down.",they be perfectly happy now she say suddenly putt the hat down
2592,For she could say anything to him now.,for she can say anything to him now
2593,She could say whatever came into her head.,she can say whatever come into her head
2594,"That was almost the first thing she had felt about him, that night in the caf when he had come in with his English friends.",that be almost the ﻿1 thing she have feel about him that night in the caf when he have come in with his english friend
2595,"He had come in, rather shyly, looking round him, and his hat had fallen when he hung it up.",he have come in rather shyly look round him and his hat have fall when he hang it up
2596,That she could remember.,that she can remember
2597,"She knew he was English, though not one of the large Englishmen her sister admired, for he was always thin; but he had a beautiful fresh colour; and with his big nose, his bright eyes, his way of sitting a little hunched made her think, she had often told him, of a young hawk, that first evening she saw him, when they were playing dominoes, and he had come in--of a young hawk; but with her he was always very gentle.",she know he be english though not one of the large englishmen her sister admire for he be always thin but he have a beautiful fresh colour and with his big nose his bright eye his way of sit a little hunch make her think she have often tell him of a young hawk that ﻿1 even she see him when they be play domino and he have come in of a young hawk but with her he be always very gentle
2598,"She had never seen him wild or drunk, only suffering sometimes through this terrible war, but even so, when she came in, he would put it all away.",she have never see him wild or drink only suffer sometimes through this terrible war but even so when she come in he would put it all away
2599,"Anything, anything in the whole world, any little bother with her work, anything that struck her to say she would tell him, and he understood at once.",anything anything in the whole world any little bother with her work anything that strike her to say she would tell him and he understand at once
2600,Her own family even were not the same.,her own family even be not the same
2601,"Being older than she was and being so clever--how serious he was, wanting her to read Shakespeare before she could even read a child's story in English!--being so much more experienced, he could help her.",be old than she be and be so clever how serious he be want her to read shakespeare before she can even read a child s story in english be so much much experience he can help her
2602,And she too could help him.,and she too can help him
2603,But this hat now.,but this hat now
2604,And then (it was getting late) Sir William Bradshaw.,and then it be get late sir william bradshaw
2605,"She held her hands to her head, waiting for him to say did he like the hat or not, and as she sat there, waiting, looking down, he could feel her mind, like a bird, falling from branch to branch, and always alighting, quite rightly; he could follow her mind, as she sat there in one of those loose lax poses that came to her naturally and, if he should say anything, at once she smiled, like a bird alighting with all its claws firm upon the bough.",she hold her hand to her head wait for him to say do he like the hat or not and a she sit there wait look down he can feel her mind like a bird fall from branch to branch and always alight quite rightly he can follow her mind a she sit there in one of that loose lax pose that come to her naturally and if he should say anything at once she smile like a bird alight with all its claw firm upon the bough
2606,"But he remembered Bradshaw said, ""The people we are most fond of are not good for us when we are ill.""",but he remember bradshaw say the people we be much fond of be not good for us when we be ill
2607,"Bradshaw said, he must be taught to rest.",bradshaw say he must be teach to rest
2608,Bradshaw said they must be separated.,bradshaw say they must be separate
2609,"""Must,"" ""must,"" why ""must""?",must must why must
2610,What power had Bradshaw over him?,what power have bradshaw over him
2611,"""What right has Bradshaw to say 'must' to me?""",what right have bradshaw to say must to me
2612,he demanded.,he demand
2613,"""It is because you talked of killing yourself,"" said Rezia.",it be because you talk of kill yourself say rezia
2614,"(Mercifully, she could now say anything to Septimus.)",mercifully she can now say anything to septimus
2615,So he was in their power!,so he be in their power
2616,Holmes and Bradshaw were on him!,holmes and bradshaw be on him
2617,The brute with the red nostrils was snuffing into every secret place!,the brute with the red nostril be snuff into every secret place
2618,"""Must"" it could say!",must it can say
2619,Where were his papers?,where be his paper
2620,the things he had written?,the thing he have write
2621,"She brought him his papers, the things he had written, things she had written for him.",she bring him his paper the thing he have write thing she have write for him
2622,She tumbled them out on to the sofa.,she tumble them out on to the sofa
2623,They looked at them together.,they look at them together
2624,"Diagrams, designs, little men and women brandishing sticks for arms, with wings--were they?--on their backs; circles traced round shillings and sixpences--the suns and stars; zigzagging precipices with mountaineers ascending roped together, exactly like knives and forks; sea pieces with little faces laughing out of what might perhaps be waves: the map of the world.",diagram design little man and woman brandish stick for arm with wing be they on their back circle trace round shilling and sixpence the sun and star zigzag precipice with mountaineer ascend rope together exactly like knife and fork sea piece with little face laugh out of what may perhaps be wave the map of the world
2625,Burn them!,burn them
2626,he cried.,he cry
2627,"Now for his writings; how the dead sing behind rhododendron bushes; odes to Time; conversations with Shakespeare; Evans, Evans, Evans--his messages from the dead; do not cut down trees; tell the Prime Minister.",now for his writing how the dead sing behind rhododendron bush ode to time conversation with shakespeare evans evans evans his message from the dead do not cut down tree tell the prime minister
2628,Universal love: the meaning of the world.,universal love the mean of the world
2629,Burn them!,burn them
2630,he cried.,he cry
2631,But Rezia laid her hands on them.,but rezia lay her hand on them
2632,"Some were very beautiful, she thought.",some be very beautiful she think
2633,She would tie them up (for she had no envelope) with a piece of silk.,she would tie them up for she have no envelope with a piece of silk
2634,"Even if they took him, she said, she would go with him.",even if they take him she say she would go with him
2635,"They could not separate them against their wills, she said.",they can not separate them against their will she say
2636,"Shuffling the edges straight, she did up the papers, and tied the parcel almost without looking, sitting beside him, he thought, as if all her petals were about her.",shuffle the edge straight she do up the paper and tie the parcel almost without look sit beside him he think a if all her petal be about her
2637,"She was a flowering tree; and through her branches looked out the face of a lawgiver, who had reached a sanctuary where she feared no one; not Holmes; not Bradshaw; a miracle, a triumph, the last and greatest.",she be a flower tree and through her branch look out the face of a lawgiver who have reach a sanctuary where she fear no one not holmes not bradshaw a miracle a triumph the last and great
2638,"Staggering he saw her mount the appalling staircase, laden with Holmes and Bradshaw, men who never weighed less than eleven stone six, who sent their wives to Court, men who made ten thousand a year and talked of proportion; who different in their verdicts (for Holmes said one thing, Bradshaw another), yet judges they were; who mixed the vision and the sideboard; saw nothing clear, yet ruled, yet inflicted.",stagger he see her mount the appall staircase lade with holmes and bradshaw man who never weigh little than eleven stone six who send their wife to court man who make ten thousand a year and talk of proportion who different in their verdict for holmes say one thing bradshaw another yet judge they be who mix the vision and the sideboard see nothing clear yet rule yet inflict
2639,"""Must"" they said.",must they say
2640,Over them she triumphed.,over them she triumph
2641,"""There!""",there
2642,she said.,she say
2643,The papers were tied up.,the paper be tie up
2644,No one should get at them.,no one should get at them
2645,She would put them away.,she would put them away
2646,"And, she said, nothing should separate them.",and she say nothing should separate them
2647,She sat down beside him and called him by the name of that hawk or crow which being malicious and a great destroyer of crops was precisely like him.,she sit down beside him and call him by the name of that hawk or crow which be malicious and a great destroyer of crop be precisely like him
2648,"No one could separate them, she said.",no one can separate them she say
2649,"Then she got up to go into the bedroom to pack their things, but hearing voices downstairs and thinking that Dr. Holmes had perhaps called, ran down to prevent him coming up.",then she get up to go into the bedroom to pack their thing but hear voice downstairs and think that dr holmes have perhaps call run down to prevent him come up
2650,Septimus could hear her talking to Holmes on the staircase.,septimus can hear her talk to holmes on the staircase
2651,"""My dear lady, I have come as a friend,"" Holmes was saying.",my dear lady i have come a a friend holmes be say
2652,"""No.",no
2653,"I will not allow you to see my husband,"" she said.",i will not allow you to see my husband she say
2654,"He could see her, like a little hen, with her wings spread barring his passage.",he can see her like a little hen with her wing spread bar his passage
2655,But Holmes persevered.,but holmes persevere
2656,"""My dear lady, allow me .",my dear lady allow me
2657,". .""",
2658,"Holmes said, putting her aside (Holmes was a powerfully built man).",holmes say putt her aside holmes be a powerfully build man
2659,Holmes was coming upstairs.,holmes be come upstairs
2660,Holmes would burst open the door.,holmes would burst open the door
2661,"Holmes would say ""In a funk, eh?""",holmes would say in a funk eh
2662,Holmes would get him.,holmes would get him
2663,But no; not Holmes; not Bradshaw.,but no not holmes not bradshaw
2664,"Getting up rather unsteadily, hopping indeed from foot to foot, he considered Mrs. Filmer's nice clean bread knife with ""Bread"" carved on the handle.",get up rather unsteadily hop indeed from foot to foot he consider mrs filmer s nice clean bread knife with bread carve on the handle
2665,"Ah, but one mustn't spoil that.",ah but one must not spoil that
2666,The gas fire?,the gas fire
2667,But it was too late now.,but it be too late now
2668,Holmes was coming.,holmes be come
2669,"Razors he might have got, but Rezia, who always did that sort of thing, had packed them.",razor he may have get but rezia who always do that sort of thing have pack them
2670,"There remained only the window, the large Bloomsbury-lodging house window, the tiresome, the troublesome, and rather melodramatic business of opening the window and throwing himself out.",there remain only the window the large bloomsbury lodge house window the tiresome the troublesome and rather melodramatic business of open the window and throw himself out
2671,"It was their idea of tragedy, not his or Rezia's (for she was with him).",it be their idea of tragedy not his or rezia s for she be with him
2672,Holmes and Bradshaw like that sort of thing.,holmes and bradshaw like that sort of thing
2673,(He sat on the sill.),he sit on the sill
2674,But he would wait till the very last moment.,but he would wait till the very last moment
2675,He did not want to die.,he do not want to die
2676,Life was good.,life be good
2677,The sun hot.,the sun hot
2678,Only human beings--what did they want?,only human being what do they want
2679,Coming down the staircase opposite an old man stopped and stared at him.,come down the staircase opposite a old man stop and stare at him
2680,Holmes was at the door.,holmes be at the door
2681,"""I'll give it you!""",i will give it you
2682,"he cried, and flung himself vigorously, violently down on to Mrs. Filmer's area railings.",he cry and fling himself vigorously violently down on to mrs filmer s area railing
2683,"""The coward!""",the coward
2684,"cried Dr. Holmes, bursting the door open.",cry dr holmes burst the door open
2685,"Rezia ran to the window, she saw; she understood.",rezia run to the window she see she understand
2686,Dr. Holmes and Mrs. Filmer collided with each other.,dr holmes and mrs filmer collide with each other
2687,Mrs. Filmer flapped her apron and made her hide her eyes in the bedroom.,mrs filmer flap her apron and make her hide her eye in the bedroom
2688,There was a great deal of running up and down stairs.,there be a great deal of run up and down stair
2689,"Dr. Holmes came in--white as a sheet, shaking all over, with a glass in his hand.",dr holmes come in white a a sheet shake all over with a glass in his hand
2690,"She must be brave and drink something, he said (What was it?",she must be brave and drink something he say what be it
2691,"Something sweet), for her husband was horribly mangled, would not recover consciousness, she must not see him, must be spared as much as possible, would have the inquest to go through, poor young woman.",something sweet for her husband be horribly mangle would not recover consciousness she must not see him must be spare a much a possible would have the inquest to go through poor young woman
2692,Who could have foretold it?,who can have foretell it
2693,"A sudden impulse, no one was in the least to blame (he told Mrs. Filmer).",a sudden impulse no one be in the little to blame he tell mrs filmer
